"DifuzzRTL: Differential Fuzz Testing to Find CPU Bugs","J. Hur; S. Song; D. Kwon; E. Baek; J. Kim; B. Lee","Department of Electrical and Computer Engineering, Seoul National University; Department of Electrical and Computer Engineering, Seoul National University; Department of Electrical and Computer Engineering, Seoul National University; Department of Electrical and Computer Engineering, Seoul National University; Department of Electrical and Computer Engineering, Seoul National University; Department of Electrical and Computer Engineering, Seoul National University","2021 IEEE Symposium on Security and Privacy (SP)","26 Aug 2021","2021","","","1286","1303","Security bugs in CPUs have critical security impacts to all the computation related hardware and software components as it is the core of the computation. In spite of the fact that architecture and security communities have explored a vast number of static or dynamic analysis techniques to automatically identify such bugs, the problem remains unsolved and challenging largely due to the complex nature of CPU RTL designs.This paper proposes DIFUZZRTL, an RTL fuzzer to automatically discover unknown bugs in CPU RTLs. DIFUZZRTL develops a register-coverage guided fuzzing technique, which efficiently yet correctly identifies a state transition in the finite state machine of RTL designs. DIFUZZRTL also develops several new techniques in consideration of unique RTL design characteristics, including cycle-sensitive register coverage guiding, asynchronous interrupt events handling, a unified CPU input format with Tilelink protocols, and drop-in-replacement designs to support various CPU RTLs. We implemented DIFUZZRTL, and performed the evaluation with three real-world open source CPU RTLs: OpenRISC Mor1kx Cappuccino, RISC-V Rocket Core, and RISC-V Boom Core. During the evaluation, DIFUZZRTL identified 16 new bugs from these CPU RTLs, all of which were confirmed by the respective development communities and vendors. Six of those are assigned with CVE numbers, and to the best of our knowledge, we reported the first and the only CVE of RISC-V cores, demonstrating its strong practical impacts to the security community.","2375-1207","978-1-7281-8934-5","10.1109/SP40001.2021.00103","National Research Foundation; ","https://ieeexplore.ieee.org/stamp/stamp.jsp?arnumber=9519470","CPU-bugs;Differential-Fuzzing;Register-coverage","Rockets;Privacy;Protocols;Computer bugs;Computer architecture;Fuzzing;Hardware","computer network security;finite state machines;microprocessor chips;program debugging;program testing;protocols;reduced instruction set computing;software engineering","differential fuzz testing;CPU bugs;security bugs;critical security impacts;hardware-software components;security communities;static analysis techniques;dynamic analysis techniques;CPU RTL designs;DIFUZZRTL;RTL fuzzer;register-coverage guided fuzzing technique;finite state machine;unique RTL design characteristics;cycle-sensitive register coverage;drop-in-replacement designs;real-world open source CPU RTLs;RISC-V Rocket Core;RISC-V Boom Core;security community;unified CPU input format;Tilelink protocols;OpenRISC Mor1kx Cappuccino","","6","","66","IEEE","26 Aug 2021","","","IEEE","IEEE Conferences"
"SMARTSHIELD: Automatic Smart Contract Protection Made Easy","Y. Zhang; S. Ma; J. Li; K. Li; S. Nepal; D. Gu","Shanghai Jiao Tong University, Shanghai, China; Data61, CSIRO, Sydney, Australia; Shanghai Jiao Tong University, Shanghai, China; Shanghai Jiao Tong University, Shanghai, China; Data61, CSIRO, Sydney, Australia; Shanghai Jiao Tong University, Shanghai, China","2020 IEEE 27th International Conference on Software Analysis, Evolution and Reengineering (SANER)","2 Apr 2020","2020","","","23","34","The immutable feature of blockchain determines that traditional security response mechanisms (e.g., code patching) must change to remedy insecure smart contracts. The only proper way to protect a smart contract is to fix potential risks in its code before it is deployed to the blockchain. However, existing tools for smart contract security analysis focus on the detection of bugs but seldom consider the code fix issues. Meanwhile, it is often time-consuming and error-prone for a developer to understand and fix flawed code manually. In this paper we propose SMARTSHIELD, a bytecode rectification system, to fix three typical security-related bugs (i.e., state changes after external calls, missing checks for out-of-bound arithmetic operations, and missing checks for failing external calls) in smart contracts automatically and help developers release secure contracts. Moreover, SMARTSHIELD guarantees that the rectified contract is not only immune to certain attacks but also gas-friendly (i.e., a slightly increase of gas cost). To evaluate the effectiveness and efficiency of SMARTSHIELD, we applied it to 28,621 real-world buggy contracts on Ethereum blockchain (as of January 2nd2019). Experiment results demonstrated that among 95,502 insecure cases in those contracts, 87,346 (91.5%) of them were automatically fixed by SMARTSHIELD. A following test with both program analysis and real-world exploits further testified that the rectified contracts were secure against common attacks. Moreover, the rectification only introduced a 0.2 % gas increment for each contract on average.","1534-5351","978-1-7281-5143-4","10.1109/SANER48275.2020.9054825","","https://ieeexplore.ieee.org/stamp/stamp.jsp?arnumber=9054825","Ethereum blockchain;Smart contract;Automated bug fix;Bytecode rectification","Codes;Costs;Smart contracts;Computer bugs;Semantics;Transforms;Software","contracts;cryptography;distributed databases;program debugging","security response mechanisms;smart contract security analysis;Ethereum blockchain;real-world buggy contracts;rectified contract;secure contracts;security-related bugs;bytecode rectification system;flawed code;code fix issues;code patching;automatic smart contract protection;SMARTSHIELD","","25","","68","IEEE","2 Apr 2020","","","IEEE","IEEE Conferences"
"Securing IoT Devices and SecurelyConnecting the Dots Using REST API and Middleware","H. Garg; M. Dave","Department of Computer Engineering, Nit Kurukshetra, Haryana, India; Department of Computer Engineering, Nit Kurukshetra, Haryana, India","2019 4th International Conference on Internet of Things: Smart Innovation and Usages (IoT-SIU)","29 Jul 2019","2019","","","1","6","Internet of Things (IoT) is a fairly disruptive technology with inconceivable growth, impact, and capability. We present the role of REST API in the IoT Systems and some initial concepts of IoT, whose technology is able to record and count everything. We as well highlight the concept of middleware that connects these devices and cloud. The appearance of new IoT applications in the cloud has brought new threats to security and privacy of data. Therefore it is required to introduce a secure IoT system which doesn't allow attackers infiltration in the network through IoT devices and also to secure data in transit from IoT devices to cloud. We provide the details on how Representational State Transfer (REST) API allows to securely expose connected devices to applications on cloud and users. In the proposed model, middleware is primarily used to expose device data through REST and to hide details and act as an interface to the user to interact with sensor data.","","978-1-7281-1253-4","10.1109/IoT-SIU.2019.8777334","","https://ieeexplore.ieee.org/stamp/stamp.jsp?arnumber=8777334","IoT;security;REST API;middleware","Internet of Things;Middleware;Logic gates;Authentication;Cloud computing;Authorization","application program interfaces;computer network security;data privacy;Internet of Things;middleware","secure IoT system;IoT devices;middleware;REST API;fairly disruptive technology;IoT applications;representational state transfer API;IoT systems","","44","","14","IEEE","29 Jul 2019","","","IEEE","IEEE Conferences"
"Decimeter Level Indoor Tracking Using a Single Access Point","W. Dong; Z. Tian; K. Liu; Z. Li","School of Communication and Information Engineering, Chongqing University of Posts and Telecommunications, Chongqing, China; School of Communication and Information Engineering, Chongqing University of Posts and Telecommunications, Chongqing, China; School of Communication and Information Engineering, Chongqing University of Posts and Telecommunications, Chongqing, China; School of Communication and Information Engineering, Chongqing University of Posts and Telecommunications, Chongqing, China","2022 IEEE 33rd Annual International Symposium on Personal, Indoor and Mobile Radio Communications (PIMRC)","20 Dec 2022","2022","","","890","895","Tracking is promising in various applications, such as elderly care and security monitoring. Prior works require multiple access points (AP) deployed in the tracking region or to utilize elaborately selected multipaths in an indoor environment to achieve tracking. However, this prevents their wide adoption because scenarios like homes typically only have a single AP, and using multipaths is vulnerable to unexpected interferences due to the complex indoor environment. This paper proposes a tracking system using only a single AP. The insight behind the proposed system is to mine the multi-dimensional channel parameters from the direct path to realize tracking. Therefore, we develop a model that establishes the correlation between the target motion and channel parameters, including the direct path's angle of arrival (AoA) and angle of departure (AoD). Then, we can formulate the tracking problem as the state transition with the observations. Since the nonlinear observation equation, we use particle filters to solve the problem accurately. Finally, we validate the proposed system via simulation using ray-tracing software. The simulation results show that the median tracking error is 0.21 m based on a 20 dB signal-to-noise ratio (SNR), comparable to previous state-of-the-art systems.","2166-9589","978-1-6654-8053-6","10.1109/PIMRC54779.2022.9977459","","https://ieeexplore.ieee.org/stamp/stamp.jsp?arnumber=9977459","Indoor tracking;single access point;wireless channel model;direct path;particle filter","Wireless communication;Target tracking;Simulation;Ray tracing;Mathematical models;Software;Indoor environment","direction-of-arrival estimation;image motion analysis;indoor radio;Kalman filters;multipath channels;particle filtering (numerical methods);radiowave propagation;ray tracing;target tracking;tracking;wireless LAN","complex indoor environment;decimeter level indoor tracking;direct path;elaborately selected multipaths;elderly care;median tracking error;multidimensional channel parameters;multiple access points;noise figure 20.0 dB;nonlinear observation equation;previous state-of-the-art systems;security monitoring;single access point;single AP;size 0.21 m;target motion;tracking problem;tracking region;tracking system;unexpected interferences","","","","10","IEEE","20 Dec 2022","","","IEEE","IEEE Conferences"
"Secure Autonomous Mobile Agents for Web Services","T. Salah; H. Hasan; M. J. Zemerly; C. Y. Yeun; M. Al-Qutayri; Y. Al-Hammadi; J. Hu","Department of Electrical and Computer Engineering, Khalifa University of Science and Technology, Abu Dhabi, UAE; Department of Electrical and Computer Engineering, Khalifa University of Science and Technology, Abu Dhabi, UAE; Department of Electrical and Computer Engineering, Khalifa University of Science and Technology, Abu Dhabi, UAE; Department of Electrical and Computer Engineering, Khalifa University of Science and Technology, Abu Dhabi, UAE; Department of Electrical and Computer Engineering, Khalifa University of Science and Technology, Abu Dhabi, UAE; Department of Electrical and Computer Engineering, Khalifa University of Science and Technology, Abu Dhabi, UAE; School of Engineering and Information Technology, The University of New South Wales, Canberra Campus, Australia","2018 IEEE Global Communications Conference (GLOBECOM)","21 Feb 2019","2018","","","1","6","Autonomous Mobile agents can be extremely useful in dynamic environments that require a continuous network connection. Network bandwidth reduction, protocol encapsulation, software automation and intelligence gathering can significantly affect Web Services. Integrating mobile agents with Web Services enables software adaptation to cope with a dynamic environment, automated system configuration and application requirement changes that are frequent in today''s ever fast-evolving technology. In this paper, we use a lightweight and efficient composition for mobile agents based Web services complying with Representational State Transfer (REST) principles for agent creation, migration, and control. The paper presents the overall concept and architecture of RESTful agents for web services. A security scheme is proposed for mobile agent security based on an infrastructure-less Identity Based Encryption (IBE) scheme integrated with Broadcast based Secure Mobile Agent Protocol (BROSMAP). A proof- of-concept implementation is provided.","2576-6813","978-1-5386-4727-1","10.1109/GLOCOM.2018.8647435","","https://ieeexplore.ieee.org/stamp/stamp.jsp?arnumber=8647435","","Mobile agents;Protocols;Servers;Security;Service-oriented architecture","cryptography;mobile computing;protocols;software agents;Web services","network bandwidth reduction;software automation;intelligence gathering;automated system configuration;RESTful agents;mobile agent security;Web services;secure autonomous mobile agents;broadcast based secure mobile agent protocol;protocol encapsulation;representational state transfer principles","","1","","25","IEEE","21 Feb 2019","","","IEEE","IEEE Conferences"
"An authentication based scheme for applications using JSON web token","S. Ahmed; Q. Mahmood","Department of Computer Science, Capital University of Science and technology, Islamabad, Pakistan; Department of Computer Science, Capital University of Science and technology, Islamabad, Pakistan","2019 22nd International Multitopic Conference (INMIC)","5 Mar 2020","2019","","","1","6","Information and Communication Technology (ICT) encompasses many devices and applications that are inter linked with each other on internet for communication. Development of client server applications on technologies, like IoT based, cloud based, and smart homes systems are growing rapidly in the current technology era. User authentication is important concern in these applications. REST (Representational State Transfer) based architecture with JWT emerged enormously in recent development of client server applications. JWTs (JSON Web Token) is used for authentication of subsequent client requests without making frequent calls to the resource server or database. In this paper, we present an authentication technique for regeneration of JWT on each client request based on truly random timestamp values to enhance the authenticity of client on server. The working of proposed technique is elaborated with a case study which indicates the stronger authentication and security.","2049-3630","978-1-7281-4001-8","10.1109/INMIC48123.2019.9022766","","https://ieeexplore.ieee.org/stamp/stamp.jsp?arnumber=9022766","Authentication;Security;Client Authentication;JSON Web Token;REST call authentication","Servers;Authentication;Cathode ray tubes;Cloud computing;Payloads;Smart homes","authorisation;client-server systems;cloud computing;Internet;Internet of Things;mobile computing","authentication based scheme;JSON web token;client server applications;smart homes systems;user authentication;REST based architecture;representational state transfer;JWT;subsequent client requests;resource server;authentication technique;truly random timestamp;cloud based home systems;information and communication technology;internet;ICT","","19","","11","IEEE","5 Mar 2020","","","IEEE","IEEE Conferences"
"Using cloud SaaS to ensure interoperability and standardization in heterogeneous Cloud based environment","E. Majda; E. Ahmed","Models and Systems Engineering Team, University of Mohammed V, Rabat, Morocco; Models and Systems Engineering Team, University of Mohammed V, Rabat, Morocco","2015 5th World Congress on Information and Communication Technologies (WICT)","13 Jun 2016","2015","","","29","34","During the last years, because of the evolution of Cloud applications and the attractive advantages given to consumers, many companies outsource their data and Information Technology (IT) system to the Cloud based technology. With the growth in the number of Cloud Service Providers, many enterprises and organizations can use and associate services from multiple providers. There may be many Internet protocols for service access standards that are used to ensure interoperability between users browser and Web server, such as Representational State Transfer (REST) and Simple Object Access Protocol (SOAP). Each service has its specific characteristics such as authentication and security requirements. Hence, Cloud providers attempt to lock customers into proprietary interfaces so consumers can find themselves at not expects inevitable vendor lock-in. Therefore, the focus of our paper is to propose a solution to this problem by using Cloud intermediate between Cloud providers and consumer in heterogeneous Cloud environments interfaces. This is to achieve benefits such as standardization and interoperability, minimizing lock-in of Cloud providers. To reach such benefits, we propose a Cloud SaaS based on two interfaces and an internet component. These interfaces are used in Cloud Consumer and Provider sides and therefore guarantee communication between Cloud Consumer and Provider using different Internet protocols for Web service access such as REST and SOAP. Our approach guarantees interoperability and standardization in heterogeneous Cloud based environments because in this case Cloud Consumer and Provider using REST interface can communicate easily with Cloud Provider and Consumer using SOAP interface.","","978-1-4673-8712-5","10.1109/WICT.2015.7489640","","https://ieeexplore.ieee.org/stamp/stamp.jsp?arnumber=7489640","CloudComputing;Heterogeneous Cloud;SOAP;REST;Web Service;Standarization;Interoperability","Cloud computing;Standards;Simple object access protocol;Interoperability;Protocols;Browsers","cloud computing;file servers;open systems;standardisation;Web services","cloud SaaS;interoperability;standardization;heterogeneous cloud-based environment;cloud service providers;Internet protocols;Web server;Web browser;cloud consumer-and-provider sides;Web service access","","","","8","IEEE","13 Jun 2016","","","IEEE","IEEE Conferences"
"A Proactive Defense Strategy Against SGX Side-channel Attacks via self-checking DRL in the Cloud","T. Ma; C. Xu; Q. An; X. Kuang; L. Zhong; L. A. Grieco","State Key Laboratory of Networking and Switching Technology, Beijing University of Posts and Telecommunications, Beijing, China; State Key Laboratory of Networking and Switching Technology, Beijing University of Posts and Telecommunications, Beijing, China; State Key Laboratory of Networking and Switching Technology, Beijing University of Posts and Telecommunications, Beijing, China; IIE, CAS, Beijing Key Laboratory of IOT Information Security, Beijing, China; Information Engineering College, Capital Normal University, Beijing, China; School of Electronic Engineering, Politecnico di Bari, Bari, Italy","ICC 2022 - IEEE International Conference on Communications","11 Aug 2022","2022","","","4174","4179","Intel software guard extensions (SGX) technology allows cloud vendors to provide customers with an independent and trusted execution environment (TEE). It protects critical data confidentiality and integrity from malicious software. However, more and more SGX side-channel attacks have appeared, which seriously undermine the confidence of tenants in cloud security. The related research focuses on system hardware and SGX compiler solutions for specific attacks, which also has difficulties in deployment. Differently, we propose an intelligent-driven proactive defense strategy, which is based on live migration. To the best of our knowledge, this is the first proactive defense against SGX side-channel attacks. We adopt the Markov decision process to solve the migration programming problem. The innovative deep reinforcement learning (DRL) solves problems of the unknown state transition probability and large machine load states, which is called self-checking proximal policy optimization (SPPO). It changes the reward pattern, improving the convergence speed and stability of DRL. In prototype experiments, we deploy the strategy in the OpenStack platform agilely to prove the defense performance and low virtual machine costs.","1938-1883","978-1-5386-8347-7","10.1109/ICC45855.2022.9838400","National Natural Science Foundation of China; ","https://ieeexplore.ieee.org/stamp/stamp.jsp?arnumber=9838400","Cloud security;SGX side-channel attack;software guard extensions;proactive defense;deep reinforcement learning","Data privacy;Prototypes;Side-channel attacks;Reinforcement learning;Programming;Markov processes;Virtual machining","cloud computing;learning (artificial intelligence);Markov processes;security of data;software architecture;trusted computing;virtual machines","SGX side-channel attacks;intel software guard extensions;cloud vendors;critical data confidentiality;cloud security;SGX compiler solutions;specific attacks;intelligent-driven proactive defense strategy;DRL","","","","23","IEEE","11 Aug 2022","","","IEEE","IEEE Conferences"
"A tool for practical reasoning about state machine designs","A. Cant; K. A. Eastaughffe; M. A. Ozols","Information Technology Division, Defence Science and Technology Organisation, Salisbury, SA, Australia; Information Technology Division, Defence Science and Technology Organisation, Salisbury, SA, Australia; Information Technology Division, Defence Science and Technology Organisation, Salisbury, SA, Australia","Proceedings of 1996 Australian Software Engineering Conference","6 Aug 2002","1996","","","16","26","Critical systems (e.g. safety critical and security critical systems) need the highest levels of assurance. The effective engineering design of critical systems still lacks easy to use, practical and above all trustworthy tools which allow the exploration of possible design strategies, and support formal reasoning about their critical properties. We describe the Veracity prototype tool, aimed at providing support for modelling and reasoning about state machine designs for critical software based devices. The tool has three main components: a graph editor, for constructing state transition diagrams; an animator, for exploring symbolic execution of the machine; and a prover, for verifying critical properties of the machine.","","0-8186-7635-3","10.1109/ASWEC.1996.534119","","https://ieeexplore.ieee.org/stamp/stamp.jsp?arnumber=534119","","Power engineering and energy;Formal specifications;Pressing;Graphical user interfaces;Process design;Writing;Prototypes;Functional programming;User interfaces;Automation","security of data;quality control;finite state machines;safety-critical software;program verification;theorem proving","practical reasoning;state machine designs;critical system;security critical systems;engineering design;trustworthy tools;formal reasoning;critical properties;Veracity prototype tool;critical software based devices;graph editor;state transition diagrams;animator;symbolic execution","","3","1","15","IEEE","6 Aug 2002","","","IEEE","IEEE Conferences"
