"Security Analysis of a Digital Twin Framework Using Probabilistic Model Checking","E. Shaikh; A. R. Al-Ali; S. Muhammad; N. Mohammad; F. Aloul","Department of Computer Science and Engineering, American University of Sharjah, Sharjah, United Arab Emirates; Cybersecurity Center, Prince Mohammad Bin Fahd University, Al Khobar, Saudi Arabia; Cybersecurity Center, Prince Mohammad Bin Fahd University, Al Khobar, Saudi Arabia; Cybersecurity Center, Prince Mohammad Bin Fahd University, Al Khobar, Saudi Arabia; Department of Computer Science and Engineering, American University of Sharjah, Sharjah, United Arab Emirates","IEEE Access","29 Mar 2023","2023","11","","26358","26374","Digital Twins (DTs) have been gaining popularity in various applications, such as smart manufacturing, smart energy, smart mobility, and smart healthcare. In simple terms, DT is described as a virtual replica of a given physical product, system, or process. It consists of three major segments: the physical entity, its virtual counterpart, and the connections between them. While the data is collected from a physical entity, processed at the virtual layer, and accessed in the form of a DT at the application layer, it is exposed to several security risks. To ensure the applicability of a DT system, it is imperative to understand these security risks and their implications. However, there is a lack of a framework that can be used to assess the security of a DT. This paper presents a framework in which the security of a DT can be analyzed with the help of a formal verification technique. The framework captures the defense of the system at different layers and considers various attacks at each layer. The security of the DT system is represented as a state-transition system and the security properties are captured in temporal logic. Probabilistic model checking (PMC) is used to verify the systems against these properties. In particular, the framework is used to analyze the probability of success and the cost of various potential attacks that can occur at each layer in a DT system. The applicability of the proposed framework is demonstrated with the help of a detailed case study in the healthcare domain.","2169-3536","","10.1109/ACCESS.2023.3257171","Computer Science and Engineering Department and the Open Access Program from the American University of Sharjah, United Arab Emirates; ","https://ieeexplore.ieee.org/stamp/stamp.jsp?arnumber=10068532","Digital twin security;security analysis;probabilistic model checking;Markov decision process;discrete time Markov chain","Security;Medical services;Sensors;Probabilistic logic;Model checking;Digital twins;Real-time systems","cyber-physical systems;digital twins;formal verification;health care;probability;production engineering computing;temporal logic","application layer;digital twin framework;Digital Twins;DT system;given physical product;physical entity;probabilistic model;security analysis;security properties;security risks;smart energy;smart healthcare;smart manufacturing;smart mobility;state-transition system;virtual counterpart;virtual layer;virtual replica","","","","85","CCBYNCND","14 Mar 2023","","","IEEE","IEEE Journals"
"Network security via reverse engineering of TCP code: vulnerability analysis and proposed solutions","B. Guha; B. Mukherjee","Department of Computer Science, University of California, Davis, USA; Roseville Networks Division, Hewlett Packard Company, Roseville, CA, USA","IEEE Network","6 Aug 2002","1997","11","4","40","48","The Transmission Control Protocol/Internet Protocol (TCP/IP) suite is widely employed to interconnect computing facilities in today's network environments. However, there exist several security vulnerabilities in the TCP specification and additional weaknesses in a number of its implementations. These vulnerabilities may allow an intruder to ""attack"" TCP-based systems, enabling him/her to ""hijack"" a TCP connection or cause denial of service to legitimate users. The authors analyze the TCP code via a ""reverse engineering"" technique called ""program slicing"" to identify several of these vulnerabilities, especially those that are related to the TCP state-transition diagram. They discuss many of the flaws present in the TCP implementation of many widely used operating systems, such as SUNOS 4.1.3, SVR4, and ULTRIX 4.3. The corresponding TCP attack ""signatures"" (including the well-known 1994 Christmas Day Mitnick Attack) are described, and recommendations are provided to improve the security state of a TCP-based system (e.g., incorporation of a ""timer escape route"" from every TCP state). Also, it is anticipated that wide dissemination of this article's results may not only lead to vendor patches to TCP code to plug security holes, but also raise awareness of how program slicing may be used to analyze other networking software and how future designs of TCP and other software can be improved.","1558-156X","","10.1109/65.598458","","https://ieeexplore.ieee.org/stamp/stamp.jsp?arnumber=598458","","Reverse engineering;TCPIP;Security;Transport protocols;Computer networks;Computer crime;Operating systems;Plugs;Hardware;Internetworking","transport protocols;security of data;computer networks;reverse engineering;network operating systems","reverse engineering;TCP code;network security;security vulnerability analysis;Transmission Control Protocol/Internet Protocol;TCP/IP;computing facilities interconnection;TCP specification;TCP connection;program slicing;TCP state-transition diagram;TCP implementation;operating systems;SUNOS 4.1.3;SVR4;ULTRIX 4.3;TCP attack signatures;Christmas Day Mitnick Attack;timer escape route;networking software","","8","24","22","IEEE","6 Aug 2002","","","IEEE","IEEE Magazines"
"Research and practice of dynamic network security architecture for IaaS platforms","L. Chen; X. Chen; J. Jiang; X. Yin; G. Shao","Sichuan University, Chengdu, Sichuan, CN; Sichuan University, Chengdu, Sichuan, CN; Sichuan University, Chengdu, Sichuan, CN; Sichuan University, Chengdu, Sichuan, CN; Sichuan University, Chengdu, Sichuan, CN","Tsinghua Science and Technology","13 Oct 2014","2014","19","5","496","507","Network security requirements based on virtual network technologies in IaaS platforms and corresponding solutions were reviewed. A dynamic network security architecture was proposed, which was built on the technologies of software defined networking, Virtual Machine (VM) traffic redirection, network policy unified management, software defined isolation networks, vulnerability scanning, and software updates. The proposed architecture was able to obtain the capacity for detection and access control for VM traffic by redirecting it to configurable security appliances, and ensured the effectiveness of network policies in the total life cycle of the VM by configuring the policies to the right place at the appropriate time, according to the impacts of VM state transitions. The virtual isolation domains for tenants' VMs could be built flexibly based on VLAN policies or Netfilter/Iptables firewall appliances, and vulnerability scanning as a service and software update as a service were both provided as security supports. Through cooperation with IDS appliances and automatic alarm mechanisms, the proposed architecture could dynamically mitigate a wide range of network-based attacks. The experimental results demonstrate the effectiveness of the proposed architecture.","1007-0214","","10.1109/TST.2014.6919826","","https://ieeexplore.ieee.org/stamp/stamp.jsp?arnumber=6919826","cloud computing;network security;IaaS;life cycle;network policy","Computer architecture;Home appliances;Switches;Access control;Communication networks;Software","authorisation;cloud computing;firewalls;software architecture;software management;telecommunication traffic;virtual machines","network-based attacks;automatic alarm mechanisms;IDS appliances;security supports;VLAN policies;Netfilter firewall appliances;Iptables firewall appliances;virtual isolation domains;state transitions;configurable security appliances;access control;software updates;vulnerability scanning;software defined isolation networks;network policy unified management;virtual machine;VM traffic redirection;IaaS platforms;dynamic network security architecture","","2","1","","","13 Oct 2014","","","TUP","TUP Journals"
"Analysis of a Virtualization-based Recovery Approach for Intrusion Tolerance Systems","J. Huang; Q. Ai","School of Information Science and Engineering, East China University of Science and Technology, Shanghai, China; School of Information Science and Engineering, East China University of Science and Technology, Shanghai, China","2013 International Conference on Computer Sciences and Applications","19 Jun 2014","2013","","","41","46","Recovery is a promising approach for building intrusion tolerant systems that remove or minimize the effects of malicious attacks. In this paper, a Virtualization-based Recovery approach for Intrusion Tolerance systems (VRIT) is proposed. We present the architecture of the VRIT, construct the state transition model of the VRIT, and analyze quantitatively the security of the VRIT system. We characterize the intrusion tolerance provided by the system through several measures defined on the model. Finally we have some simulation experiments to evaluate both the availability and the mean time to security failure for the VRIT system.","","978-0-7695-5125-8","10.1109/CSA.2013.17","","https://ieeexplore.ieee.org/stamp/stamp.jsp?arnumber=6835543","Virtualization;Recovery;Intrusion Tolerance;State Transition Model","Servers;Virtual machining;Security;Availability;Computer architecture;Virtualization;Mirrors","fault tolerant computing;security of data;system recovery;virtualisation","virtualization-based recovery approach for intrusion tolerance systems;state transition model;VRIT system security;VRIT system availability;mean time to security failure","","2","","9","IEEE","19 Jun 2014","","","IEEE","IEEE Conferences"
"Modelling and Analysis of Network Security - An Algebraic Approach","Q. Zhang; Y. Jiang; P. Wu","State Key Laboratory of Computer Science, Chinese Academy of Sciences, Beijing, China; State Key Laboratory of Computer Science, Chinese Academy of Sciences, Beijing, China; State Key Laboratory of Computer Science, Chinese Academy of Sciences, Beijing, China","2016 IEEE Trustcom/BigDataSE/ISPA","9 Feb 2017","2016","","","308","315","Game theory has been applied to investigate network security. But different security scenarios were often modeled via different types of games and analyzed in an ad-hoc manner. In this paper, we propose an algebraic approach for modeling and analyzing uniformly several types of network security games. This approach is based on a probabilistic extension of the value-passing Calculus of Communicating Systems (CCS), which is a common formal language for modeling concurrent systems. Our approach gives a uniform security model for different security scenarios. We present then a uniform algorithm for computing the Nash equilibria strategies on this security model. In a nutshell, the algorithm first generates a network state transition graph for our security model, then simplifies this transition graph through graph-theoretic abstraction and bisimulation minimization. Then, a backward induction method, which is only applicable to finite tree models, can be used to compute all the Nash equilibria strategies of the (possibly infinite) security models. This algorithm is implemented and can be tuned smoothly for computing its social optimal strategies, and its termination and correctness are proved. The effectiveness and efficiency of this approach are demonstrated with two detailed examples from the field of network security.","2324-9013","978-1-5090-3205-1","10.1109/TrustCom.2016.0078","","https://ieeexplore.ieee.org/stamp/stamp.jsp?arnumber=7846961","Network security;Nash equilibria strategies;Formal method;Probabilistic value-passing CCS","Security;Computational modeling;Probabilistic logic;Communication networks;Reactive power;Games;Analytical models","calculus of communicating systems;computer network security;formal languages;game theory","modelling;network security scenarios;game theory;network security games;probabilistic extension;value-passing calculus of communicating systems;CCS;formal language;concurrent systems;uniform security models;Nash equilibria strategies;network state transition graph;graph-theoretic abstraction;bisimulation minimization;backward induction method;finite tree models","","1","","23","IEEE","9 Feb 2017","","","IEEE","IEEE Conferences"
"Cascading Failure Risk Assessment Based on Event-Driven Model in a Cyber-physical Power System","Y. Wang; Y. Li; T. Xu; M. Zhu","Key Laboratory of Cyber-Physical Power System of Yunnan Colleges and Universities, Yunnan Minzu University, Kunming, China; Key Laboratory of Cyber-Physical Power System of Yunnan Colleges and Universities, Yunnan Minzu University, Kunming, China; Key Laboratory of Cyber-Physical Power System of Yunnan Colleges and Universities, Yunnan Minzu University, Kunming, China; Yunnan Power Grid Co., Ltd, Intelligent Perception Innovation Studio at the Power Science Research Institute, Kunming, China","2023 IEEE International Conference on Power Science and Technology (ICPST)","4 Jul 2023","2023","","","123","128","The integration of communication technology into power systems enhances their observability and controllability but also introduces additional risks caused by the interaction between cyber and physical systems, leading to the expansion of cascading failures in cyber-physical power systems (CPPSs). To address this problem, this article proposes a cascading failure risk assessment method for CPPS based on an event-driven model, which provides technical support for risk warning and security analysis of CPPSs. The proposed method involves the establishment of a state transition matrix of CPPS based on a dynamic Bayesian network and analysis of the triggering law of cascading faults. A dynamic HMM model and a set of expected risk scenarios of CPPS are established based on the observable results of physical system faults by the information system. Furthermore, the corresponding multi-index risk assessment model of CPPS is established to describe the risk propagation ability of the system in its operation state, followed by the migration of the operation mode according to the adjustment of the high-risk event-driven control strategy. Finally, the effectiveness of the method is verified using the IEEE-39 system.","","979-8-3503-1135-8","10.1109/ICPST56889.2023.10164915","National Natural Science Foundation of China; Innovation Fund; ","https://ieeexplore.ieee.org/stamp/stamp.jsp?arnumber=10164915","cyber-physical power systems;cascading failures;dynamic HMM;risk assessment","Analytical models;Power system protection;Power system dynamics;Refining;Hidden Markov models;Collaboration;Risk management","belief networks;cyber-physical systems;hidden Markov models;IEEE standards;power engineering computing;power system faults;power system security;risk analysis;risk management","cascading failure risk assessment method;cyber-physical power system;dynamic Bayesian network;dynamic HMM model;event-driven model;high-risk event-driven control strategy;IEEE-39 system;multiindex risk assessment model;power systems;risk propagation ability;risk warning;security analysis;state transition matrix","","","","11","IEEE","4 Jul 2023","","","IEEE","IEEE Conferences"
"Media Communication Framework of Governability in the Digital Public Administration System","A. M. Kuzmina; D. A. Abramov","Institute Higher School of Journalism and Mass Communication, St. Petersburg State University, St. Petersburg, Russia; Institute Higher School of Journalism and Mass Communication, St. Petersburg State University, St. Petersburg, Russia","2023 Communication Strategies in Digital Society Seminar (ComSDS)","25 May 2023","2023","","","70","73","The essential basis of social communication in digital media space is the mutual exchange of information between its actors. Information exchange occurs only when feedback between the participants of the communication process is possible in media space, and also when each social actor is given the opportunity to act as a subject of media communication. In this case, the possibility of information exchange within the framework of subject-object and subject-subject media communication relations is guaranteed mainly by the digital infrastructure of media tools and media platforms, through which the involvement of social actors in communication processes aimed at the implementation of public management to address socially important issues of life support, social significance and security is ensured. Social media communication is a factor of the digital public administration and forms its main qualitative characteristics and properties. Without the inclusion of actors of the public sphere in the digital media communication processes in the modern realities it is impossible to realize the conditions of the digital public administration, including the assessment of the effectiveness of its implementation and parameters of manageability. In this regard, the media and communication framework of the phenomenon of «governability» in the system of digital public management is the subject of this study. In strategic terms, governability in the system of the digital public administration is determined by its network organization instead of the classical hierarchical forms of interaction of public administration actors (see L.V. Smorgunov. Governability and network public administration, 2014). «Network» concept is considered by various authors in terms of public administration approach, therefore in the scientific literature it is also called the theory of political-management networks. Emerged together with the concept of new public management, the concept of political networks is based on the same postulates: the state changes the usual hierarchical form of administration to a new form of management. The difference between the two approaches lies in the fact that while in the new state management, market relations prevail over hierarchy, in the concept of political networks, communication processes play a key role in managerial and political processes. And, accordingly, the network organization of the digital public administration emerges through communication links of actors in the public sphere, which are formed in the digital media space. Spatial and infrastructural «turn» of digital media communications is considered by the author as a theoretical and methodological constant in identifying the set of factors of public management and the special properties and characteristics of media environments, in which the implementation of digital public management is possible.","2768-4873","979-8-3503-2003-9","10.1109/ComSDS58064.2023.10130416","","https://ieeexplore.ieee.org/stamp/stamp.jsp?arnumber=10130416","Governability;digital public administration;media communications","Seminars;Social networking (online);Semantics;Decision making;Organizations;Media;Security","public administration;social networking (online)","communication links;communication process;digital infrastructure;digital media communication processes;digital media communications;digital media space;digital public administration system;digital public management;information exchange;media communication framework;media environments;media platforms;media tools;network public administration;public administration actors;public administration approach;social actor;social communication;social media communication;subject-subject media communication relations","","","","18","IEEE","25 May 2023","","","IEEE","IEEE Conferences"
"A cloud-assisted malware detection and suppression framework for wireless multimedia system in IoT based on dynamic differential game","W. Zhou; B. Yu","Zhengzhou Institute of Information Science and Technology, Zhengzhou 450001, China; Zhengzhou Institute of Information Science and Technology, Zhengzhou 450001, China","China Communications","21 Feb 2018","2018","15","2","209","223","As a novel dynamic network service infrastructure, Internet of Things (IoT) has gained remarkable popularity with obvious superiorities in the interoperability and real-time communication. Despite of the convenience in collecting information to provide the decision basis for the users, the vulnerability of embedded sensor nodes in multimedia devices makes the malware propagation a growing serious problem, which would harm the security of devices and their users financially and physically in wireless multimedia system (WMS). Therefore, many researches related to the malware propagation and suppression have been proposed to protect the topology and system security of wireless multimedia network. In these studies, the epidemic model is of great significance to the analysis of malware propagation. Considering the cloud and state transition of sensor nodes, a cloud-assisted model for malware detection and the dynamic differential game against malware propagation are proposed in this paper. Firstly, a SVM based malware detection model is constructed with the data sharing at the security platform in the cloud. Then the number of malware-infected nodes with physical infectivity to susceptible nodes is calculated precisely based on the attributes of WMS transmission. Then the state transition among WMS devices is defined by the modified epidemic model. Furthermore, a dynamic differential game and target cost function are successively derived for the Nash equilibrium between malware and WMS system. On this basis, a saddle-point malware detection and suppression algorithm is presented depending on the modified epidemic model and the computation of optimal strategies. Numerical results and comparisons show that the proposed algorithm can increase the utility of WMS efficiently and effectively.","1673-5447","","10.1109/CC.2018.8300282","","https://ieeexplore.ieee.org/stamp/stamp.jsp?arnumber=8300282","Internet of Things;wireless multimedia system;state transition;malware propagation;differential game","Malware;Cloud computing;Wireless sensor networks;Wireless communication;Communication system security;Multimedia communication","cloud computing;computer network security;game theory;Internet of Things;invasive software;multimedia communication;radiocommunication;topology","Internet of Things;malware suppression framework;cloud-assisted malware detection;saddle-point malware detection;modified epidemic model;WMS devices;malware-infected nodes;SVM based malware detection;state transition;wireless multimedia network;system security;topology;malware propagation;multimedia devices;embedded sensor nodes;dynamic network service infrastructure;dynamic differential game;IoT;wireless multimedia system","","19","","","","21 Feb 2018","","","IEEE","IEEE Magazines"
