"A Three-dimension Resilience State Space-based Approach to Resilience Assessment of CBTC system","J. Zhao; T. Tang; B. Bu; Q. Li","State Key Lab. of Rail Traffic Control and Safety, Beijing Jiaotong University, Beijing, P.R China; State Key Lab. of Rail Traffic Control and Safety, Beijing Jiaotong University, Beijing, P.R China; State Key Lab. of Rail Traffic Control and Safety, Beijing Jiaotong University, Beijing, P.R China; State Key Lab. of Rail Traffic Control and Safety, Beijing Jiaotong University, Beijing, P.R China","2021 IEEE International Intelligent Transportation Systems Conference (ITSC)","25 Oct 2021","2021","","","3673","3678","Traditional passive defense methods cannot resist the constantly updated and evolving cyber attacks. The concept of resilience is introducing to measure the ability of the system to maintain its function under attack. It matters in evaluating the security of modern industrial systems. This paper presents a 3D Resilience State Space method to assess Communication-based train control (CBTC) system resilience under malware attack. We model the spread of malware as two functions: the communicability function $f$(x) and the susceptibility function 9 (x). We describe the characteristics of these two function in the CBTC complex network by using the percolation theory. Then we use a perturbation formalism to analyze the impact of malware attack on information flow and use it as an indicator of the cyber layer state. The CBTC cyber-physical system resilience metric formalizes as the system state transitions in three-dimensional state space. The three dimensions respectively represent the cyber layer state, the physical layer state, and the transmission layer state. The simulation results reveal that the proposed framework can effectively assess the resilience of the CBTC system. And the anti-malware programs can prevent the spread of malware and improve CBTC system resilience.","","978-1-7281-9142-3","10.1109/ITSC48978.2021.9564448","National Natural Science Foundation of China; ","https://ieeexplore.ieee.org/stamp/stamp.jsp?arnumber=9564448","","Fault tolerance;Three-dimensional displays;Simulation;Resists;Control systems;Malware;State-space methods","complex networks;computer network security;invasive software;railway communication;state-space methods","three-dimension resilience state space-based approach;passive defense methods;communication-based train control system resilience;cyber-physical system resilience metric formalizes;CBTC system resilience;anti-malware programs;transmission layer state;physical layer state;system state transitions;cyber layer state;CBTC complex network;susceptibility function;communicability function;malware attack;industrial systems;cyber attacks","","","","18","IEEE","25 Oct 2021","","","IEEE","IEEE Conferences"
"IEEE Draft Standard for Biometric Privacy","",,"IEEE P2410/D3, November 2020","10 Nov 2020","2020","","","1","50","The Standard for Biometric Privacy (SBP) provides private identity assertion. SBP supersedes the prior IEEE Std 2410(TM)-2019 by including a formal specification for privacy and biometrics such that a conforming SBP system does not incur GDPR, CCPA, BIPA or HIPAA privacy obligations. Homomorphic encryption ensures the biometric payload is always one-way encrypted with no need for key management and provides full privacy by ensuring plaintext biometrics are never received by the SBP server. The SBP implementation includes software running on a client device and on the SPB server. Pluggable components are used to replace legacy functionality to allow rapid integration into existing operating environments. The SBP implementation allows the systems to meet security needs by using the application programming interface, whether the underlying system is a relational database management system or a search engine. The SBP implementation functionality offers a “point-and-cut” mechanism to add the appropriate security to the production systems as well as to the systems in development. The architecture is language neutral, allowing Representational State Transfer (REST ), JavaScript Object Notation (JSON), and Transport Layer Security (TLS) to provide the communication interface. This document describes the essential methodology to SBP.","","978-1-5044-7197-8","","","https://ieeexplore.ieee.org/stamp/stamp.jsp?arnumber=9254105","admin console;application;biometric-driven device;biometrics;privacy;client device IDS;IDS cluster;IEEE Std 2410(TM);Jena Rules;liveness;original site admin;SBP admin;SBP cluster;SBP IDS;SBP server;site admin;trusted adjudicated data;user","IEEE Standards;Biometrics (access control);Servers;Formal specification;Identification;Encryption;Computer architecture;Computer security;Database systems","","","","","","","","10 Nov 2020","","","IEEE","IEEE Standards"
"Implementation of action recognition algorithm on multiple-streaming multimedia unit","J. -c. Chiu; T. -C. Lin; Y. -L. Chou","Department of Electrical Engineering, National Sun Yat-Sen University, Kaohsiung, Taiwan; Department of Electrical Engineering, National Sun Yat-Sen University, Kaohsiung, Taiwan; Department of Electrical Engineering, National Sun Yat-Sen University, Kaohsiung, Taiwan","2010 International Computer Symposium (ICS2010)","10 Jan 2011","2010","","","804","808","Action recognition had become prosperous in development and been broadly applied in several sectors. From homeland security, personal property, home caring, even the smart environment and the motion-sensing games, are in its territories. This paper analyses the algorithm of action recognition for embedded system and finds that there are many blocks can use the parallel execution to compute more efficiently. This paper tries to implement action recognition algorithm on the Multiple-Streaming Multimedia Unit (MSMU). MSMU is a MMX-like SIMD architecture, with SIMD operation and data storage. By introduction the concept of multi-streaming SIMD, MSMU will be able to modulate the amount of parallel data streams dynamically via switching the instruction mode. With mode switching and new added transfer instruction to compute 2D image processing, we study the benefit of the instruction mode switching through comparing the 128-bit SSE architecture and MSMU architecture with the practical example, highlight the problems that exploiting the subword parallelisms facing and bring out the advantage of multi-streaming SIMD. For the algorithm, we study the slicing of the minimum element and the using of the bitwise operation approach to better efficiency. Compare to embedded SIMD architecture ""WMMX"", MSMU can achieve 3.49× overall speedup.","","978-1-4244-7640-4","10.1109/COMPSYM.2010.5685403","","https://ieeexplore.ieee.org/stamp/stamp.jsp?arnumber=5685403","Action recognition;Embedded computer vision;MMX;SIMD","Computer architecture;Streaming media;Support vector machines;Pixel;Feature extraction;Multimedia communication;Registers","embedded systems;gesture recognition;image processing;media streaming;multimedia computing;parallel processing","action recognition algorithm;multiple streaming;multimedia unit;embedded system;parallel execution;data storage;SIMD architecture;SIMD operation;parallel data stream;mode switching;transfer instruction;2D image processing;instruction mode switching;bitwise operation","","1","","17","IEEE","10 Jan 2011","","","IEEE","IEEE Conferences"
"A Cognitive Distortion based BB84 Protocol for Data Transmission in Intelligent System","S. Poorani; R. Anitha","Dept. of CSE, Sri Venkateswara College of Engineering, Chennai; Dept. of CSE, Sri Venkateswara College of Engineering, Chennai","2022 6th International Conference on Electronics, Communication and Aerospace Technology","16 Jan 2023","2022","","","680","685","The advent of technology and the rapid flow of data from Internet of Things (IoT) lead to finding a weakness in the framework on the existing cryptographic algorithms. The devices and the operations performed in cloud service providers make an open challenge to the data security. This work discusses about the BB84 protocol encoding polarization scheme for data security in the presence of mechanical properties for data transmission over secured quantum channel. The proposed model of Cognitive Distortion based BB84 protocol (CD-BB84) schema addresses the integrity of the message using error control and error correction mechanism with noise interpretation. In the quantum channel, the occurrence of qubits state changes due to the physical cable delinquency or by the presence of eavesdropper. This method provides a concealed polarization bases with the effective marginal loss on QNSR value in which the bases pass over the quantum channel.","","978-1-6654-8271-4","10.1109/ICECA55336.2022.10009227","","https://ieeexplore.ieee.org/stamp/stamp.jsp?arnumber=10009227","Photon interference;Quantum Key Distribution (QKD);True Random number generator (TRng);Cognitive Distortion BB84 (CD-BB84);Optical Cable Attenuation (OCA);Quantum Noise Signal Ratio(QNSR);RSA (Rivest-Shamir-Adleman)","Performance evaluation;Protocols;Power cables;Quantum channels;Qubit;Distortion;Error correction","cloud computing;encoding;error correction;Internet of Things;protocols;quantum computing;quantum cryptography;security of data","BB84 protocol encoding polarization scheme;CD-BB84;cloud service providers;cognitive distortion;cryptographic algorithms;data security;data transmission;error correction mechanism;intelligent system;Internet of Things lead;mechanical properties;polarization bases;secured quantum channel","","","","19","IEEE","16 Jan 2023","","","IEEE","IEEE Conferences"
"Efficient computation of sensor activation decisions in discrete-event systems","D. Sears; K. Rudie","School of Computing, Queen's University, Kingston, ON, Canada; Department of Electrical and Computer Engineering, Queen's University, Kingston, ON, Canada","52nd IEEE Conference on Decision and Control","10 Mar 2014","2013","","","6966","6971","This paper considers partially-observed discrete-event systems where sensors are associated with events observable to an agent monitoring the system. The agent is capable of turning the sensors for events on and off dynamically, depending on the trajectory of the system. Reading data from the sensors may be costly so it is imperative that their use be reduced for reasons such as energy, bandwidth or security. When a sensor for an event is on / active any occurrence of the event is detected by the agent and is not detected otherwise. The agent may employ different sensor activation policies, depending on the task at hand. Sensor activation policies are defined over the transitions of a state-transition representation of the system. From sensor activation policies a map from observed event sequences to sensor activation decisions can be computed which the agent can use to determine which sensors to turn on / off and when. In this paper, we consider two subclasses of sensor activation policies of increasing generality. For each subclass, we demonstrate ways to compute maps from observed event sequences to sensor activation decisions in polynomial time.","0191-2216","978-1-4673-5717-3","10.1109/CDC.2013.6760993","","https://ieeexplore.ieee.org/stamp/stamp.jsp?arnumber=6760993","","Automata;Discrete-event systems;Polynomials;Turning;Labeling;Observers;Monitoring","computational complexity;discrete event systems;observability;sensors","partially-observed discrete-event systems;reading data;sensor activation policies;state-transition representation;observed event sequences;sensor activation decisions;polynomial time","","10","","16","IEEE","10 Mar 2014","","","IEEE","IEEE Conferences"
"Computing sensor activation decisions from state equivalence classes in discrete-event systems","D. Sears; K. Rudie","Queen's University, Kingston, ON, CA; Department of Electrical and Computer Engineering, Queen's University, Kingston, ON, Canada","52nd IEEE Conference on Decision and Control","10 Mar 2014","2013","","","6972","6977","This paper considers partially-observed discrete-event systems where sensors are associated with events observable to an agent monitoring the system. The agent is capable of turning the sensors for events on and off dynamically, depending on the trajectory of the system. Reading data from the sensors may be costly so it is imperative that their use be reduced for reasons such as energy, bandwidth or security. When a sensor for an event is on / active any occurrence of the event is detected by the agent and is not detected otherwise. The agent may employ different sensor activation policies, depending on the task at hand. Sensor activation policies are defined over the transitions of a state-transition representation of the system. From sensor activation policies a map from observed event sequences to sensor activation decisions can be computed which the agent can use to determine which sensors to turn on / off and when. In this paper, we consider a subclass of sensor activation policies. For this subclass, we demonstrate a way to compute maps from observed event sequences to sensor activation decisions in polynomial time. However, we demonstrate that verifying if an arbitrary sensor activation policy belongs to this subclass is PSPACE-complete.","0191-2216","978-1-4673-5717-3","10.1109/CDC.2013.6760994","","https://ieeexplore.ieee.org/stamp/stamp.jsp?arnumber=6760994","","Automata;Observers;Discrete-event systems;Polynomials;Turning;Labeling;Writing","computational complexity;discrete event systems;sensors","state equivalence classes;partially-observed discrete-event systems;agent monitoring;state-transition representation;polynomial time;arbitrary sensor activation policy;PSPACE-complete","","3","","17","IEEE","10 Mar 2014","","","IEEE","IEEE Conferences"
"Formally testing fail-safety of electronic purse protocols","J. Jurjens; G. Wimmel","Computing Laboratory, University of Oxford, UK; Institut für Informatik, Technische Universität München, Munchen, Germany","Proceedings 16th Annual International Conference on Automated Software Engineering (ASE 2001)","7 Aug 2002","2001","","","408","411","Designing and implementing security-critical systems correctly is difficult. In practice, most vulnerabilities arise from bugs in implementations. We present work towards systematic specification-based testing of security-critical systems using the CASE tool AutoFocus. Cryptographic systems are formally specified with state transition diagrams, a notation for state machines in the AutoFocus system., We show how to systematically generate test sequences for security properties based on the model that can be used to test the implementation for vulnerabilities. In particular we focus on the principle of fail-safety. We explain our method at the example of a part of the Common Electronic Purse Specifications (CEPS). Most commonly, attacks address vulnerabilities in the way security mechanisms are used, rather than the mechanisms themselves. Being able to treat security aspects with a general CASE tool within the context of system development enables detection of such vulnerabilities.","1938-4300","0-7695-1426-X","10.1109/ASE.2001.989840","","https://ieeexplore.ieee.org/stamp/stamp.jsp?arnumber=989840","","Electronic equipment testing;System testing;Computer bugs;Computer aided software engineering;Security;Access protocols;Laboratories;Cryptography;Protection;Natural languages","cryptography;conformance testing;protocols;EFTS","security-critical systems;specification-based testing;CASE tool;AutoFocus;cryptographic systems;state machines;state transition diagrams;common electronic purse specifications;electronic purse protocols","","12","","14","IEEE","7 Aug 2002","","","IEEE","IEEE Conferences"
"A Comprehensive Client-Side Behavior Model for Diagnosing Attacks in Ajax Applications","X. Dong; K. Patil; J. Mao; Z. Liang","School of Computing, National University of Singapore, Singapore; School of Computing, National University of Singapore, Singapore; School of Electronic and Information Engineering, BeiHang University, China; School of Computing, National University of Singapore, Singapore","2013 18th International Conference on Engineering of Complex Computer Systems","19 Sep 2013","2013","","","177","187","Behavior models of applications are widely used for diagnosing security incidents in complex web-based systems. However, Ajax techniques that enable better web experiences also make it fairly challenging to model Ajax application behaviors in the complex browser environment. In Ajax applications, server-side states are no longer synchronous with the views to end users at the client side. Therefore, to model the behaviors of Ajax applications, it is indispensable to incorporate client-side application states into the behavior models, as being explored by prior work. Unfortunately, how to leverage behavior models to perform security diagnosis in Ajax applications has yet been thoroughly examined. Existing models extracted from Ajax application behaviors are insufficient in a security context. In this paper, we propose a new behavior model for diagnosing attacks in Ajax applications, which abstracts both client-side state transitions as well as their communications to external servers. Our model articulates different states with the browser events or user actions that trigger state transitions. With a prototype implementation, we demonstrate that the proposed model is effective in attack diagnosis for real-world Ajax applications.","","978-0-7695-5007-7","10.1109/ICECCS.2013.35","","https://ieeexplore.ieee.org/stamp/stamp.jsp?arnumber=6601822","","Electronic mail;Browsers;Security;Context;Web servers;Load modeling","Internet;online front-ends;security of data","comprehensive client-side behavior model;real-world Ajax applications;complex Web-based systems;complex browser environment;security incident diagnosis;external servers;browser events;user actions;state transitions;prototype implementation;attack diagnosis","","9","","41","IEEE","19 Sep 2013","","","IEEE","IEEE Conferences"
"Monitoring Interactions Across Multi Business Processes with Token Carried Data","C. Li; J. Ge; Z. Li; L. Huang; H. Yang; B. Luo","State Key Laboratory for Novel Software Technology, Nanjing University, Jiangsu Sheng, China; State Key Laboratory for Novel Software Technology, Nanjing University, Jiangsu Sheng, China; State Key Laboratory for Novel Software Technology, Nanjing University, Jiangsu Sheng, China; Department of Computer Science and Engineering, Southern Methodist University, Dallas; Bath Spa University, Bath, England, United Kingdom; State Key Laboratory for Novel Software Technology, Nanjing University, Jiangsu Sheng, China","IEEE Transactions on Services Computing","10 Dec 2019","2019","12","6","941","954","The rapid development of web service provides many opportunities for companies to migrate their business processes to the Internet for wider accessibility and higher collaboration efficiency. However, the open, dynamic and ever-changing Internet also brings challenges in protecting these business processes. There are certain process monitoring methods and the recently proposed ones are based on state changes of process artifacts or places, however, they do not mention defending process interactions from outer tampering, where events could not be detected by process systems, or saving fault-handling time. In this paper, we propose a novel Token-based Interaction Monitoring framework based on token carried data to safeguard process collaboration and reduce problem solving time. Token is a more common data entity in processes than process artifacts and they cover all tasks' executions. Comparing to detecting places' state change, we set security checking points at both when tokens are just produced and to be consumed. This will ensure that even if data is tampered after being created it would be detected before being used. For applying monitoring framework, we develop a collaboration constructing method with token-based process mining techniques to derive global interaction processes as well as organize historical process data in forms of token.","1939-1374","","10.1109/TSC.2016.2645690","Key Program of Research and Development of China(grant numbers:2016YFC0800803); National Natural Science Foundation of China(grant numbers:61572162,61572251); Natural Science Foundation of Jiangsu Province(grant numbers:BK20131277); National Science Foundation(grant numbers:CNS-1126747); Fundamental Research Funds for the Central Universities; ","https://ieeexplore.ieee.org/stamp/stamp.jsp?arnumber=7801152","Web services;collaboration construct;process reengineering methodology;business process monitoring;Data models","Monitoring;Collaboration;Internet;Data mining;Data models;Web services","business data processing;data mining;groupware;security of data;Web services","token carried data;web service;business processes;Internet;process monitoring methods;process artifacts;process interactions;process systems;process collaboration;common data entity;collaboration constructing method;token-based process;multibusiness processes;token-based interaction monitoring framework;security checking points;token-based process mining techniques","","3","","59","IEEE","28 Dec 2016","","","IEEE","IEEE Journals"
"Experimental Realization of Microcontroller Based Programmable Miniature Cost Effective Circuit Breaker","M. M. Mostafa; P. Sudheer; M. A. Hoque","Dept. of Electrical and Computer Engineering, University of Saskatchewan, Saskatoon, SK, Canada; Dept. of Electrical Engineering, Central University of Karnataka, Kalaburgi, India; Dept. of Electrical and Electronic Engineering, BRAC University, Dhaka, Bangladesh","2020 International Conference on Smart Grids and Energy Systems (SGES)","5 Mar 2021","2020","","","697","700","Miniature circuit breaker (MCB) is an electrical protection equipment. Generally it is used in households as an over current circuit breaker to ensure safety from electrical hazards like outrageous fire accidents arising from electrical short circuit. These kinds of electrical hazards occur because the amperage of these circuit breakers are fixed and we cannot change the tripping current anytime to endure the newly added or removed electrical loads. This paper reports the experimental realization of a numerical overcurrent relay using, primarily, a microcontroller and a micro current transformer (CT) which is compatible with smart grid technology and high voltage system like electric vehicle. In this newly designed numerical over current relay (NOCR) the user can change the set current and the sensitivity of the system just by twisting two different knobs. Thus this system ensures advance security against electrical hazards than a normal MCB. It will obtain, trial and covert analog current signals hooked on digital form of a power system in real time. Solid state switch (MOSFET switch) has been opted as circuit breaker in order to enhance system effectivity. This newly designed system can detect a fault or over current with 100% accuracy and the operating time (OT) calculated by this relay is 99.57% responsive to the theoretical calculation. All the components used to assemble this system are off the shelf; hence engender an economic and portable over current relay than any other commercially available system.","","978-1-7281-8550-7","10.1109/SGES51519.2020.00129","","https://ieeexplore.ieee.org/stamp/stamp.jsp?arnumber=9364424","Miniature circuit breaker;numerical over current relay;current transformer;microcontroller;MOSFET","Microcontrollers;Circuit breakers;Hazards;Smart grids;Power systems;Relays;Switching circuits","circuit breakers;current transformers;microcontrollers;overcurrent protection;power distribution protection;relay protection;smart power grids","microcontroller based programmable miniature cost effective circuit breaker;miniature circuit breaker;electrical protection equipment;current circuit breaker;electrical hazards;outrageous fire accidents;electrical short circuit;tripping current;electrical loads;numerical overcurrent relay;microcurrent transformer;high voltage system;electric vehicle;current relay;set current;covert analog current signals;power system;system effectivity;newly designed system;commercially available system","","","","11","IEEE","5 Mar 2021","","","IEEE","IEEE Conferences"
