id,relevant,title,abstract
10,y,A Network Access Control Architecture Using State-Transfer-Based Dynamic Policy,"The access control architecture using state-transfer-based dynamic policy is proposed to make access control more flexible and dynamic. This architecture can dynamically change the policy according to a state-transfer composed of a previous state and a current state. It can indicate the tendency of the system by using both previous and current information in order to decide a more appropriate policy to the current system and future condition. And there are two steps in this dynamic policy method, one is deciding a partial-state and the other one is deciding a state, two dynamic policy decision layers are included into this architecture in order to manage these two steps."
18,n,Algorithmic Analysis of the System Based on the Functioning Table and Information Security,"Systems are ideally and rapidly evolving with the development of the Internet and modern web technologies. Example, Ecological monitoring information system has become very important in determining its superiority as a system, so it should be tested. This article describes how to benchmark a system by creating a state change graph to simulate different intuitions on the part of each subsystem, and then comparing the graph to Petri net modeling based on Functioning table (PNMFT). Test cases can be prepared based on the accessibility of trees based on comparable PNMFTs. The existing fact-testing strategy for comprehensive testing of the system will be further generalized to improve the consistent quality of the remaining tests. After that, talk about algorithmic analysis of the system is an important for information security issue. The initial stage of ongoing research to improve the reliability of algorithmic analysis of algorithmic formalization of web systems is described. It may also be advisable to include a set of dynamic coverage criteria for web systems defined for the statistical testing approach used through algorithmic analysis to improve testing quality and algorithmic formalization of the web system through algorithmic analysis."
24,n,Software defined network: Future of networking,"The digital world we live in has been lead by the evolution of Internet, which has created revolution. Today almost everything is connected and accessible from anywhere, everywhere. Unfortunately, the traditional IP network system is still complex, not easily manageable and difficult to reconfigure in case of any change or fault. Software Defined Networking (SDN) is an emerging paradigm separates the network's control logic from the underlying routers and switches, promoting logical centralization of network control and introducing the ability to program the network. It has become the focus in the current information and communication technology area because of its flexibility and programmability. SDN abstracts low-level network functionalities to simplify network management. The OpenFlow protocol implements the SDN concept by abstracting network elements. It offers flexible and scalable functionality for network by decoupling the network control from forwarding devices. SDN uses a REST API (Representational State Transfer) for communication between controller and another application."
67,n,Towards Further Formal Foundation of Web Security: Expression of Temporal Logic in Alloy and Its Application to a Security Model With Cache,"Security analysis of a web system is complicated, and thus analysis using formal methods to describe system specification mathematically has attracted attention. Some previous studies have adopted formal methods, but their models cannot express parallel communication completely. This limitation gives rise to problems where web functions, such as a cache that stores contents, cannot be defined and attacks that forge contents cannot be analyzed. These problems are present in the Alloy-based implementations of current models that do not have the ability to express temporal logic. Therefore, we design implementation and evaluation of temporal logic in Alloy to express time series and parallel computation for web security analysis. In doing so, state transitions in the web can be expressed by fitting them in our proposed syntax. As concrete applications, we describe a web security model that includes caches and show that our proposed syntax can analyze state-of-the-art attacks, such as unauthorized access to users' account pages via caches. The source code of our proposed model in Alloy is publicly available."
85,y,The STAT tool suite,"Describes a suite of intrusion detection tools developed by the Reliable Software Group at the University of California at Santa Barbara (UCSB). The tool suite is based on the state transition analysis technique (STAT), in which computer penetrations are specified as sequences of actions that cause transitions in the security state of a system. This general approach has been extended and tailored to perform intrusion detection in different domains and environments. The most recent STAT-based intrusion detection systems were developed following a framework-based approach, and the resulting design uses a ""core"" module that embodies the domain-independent characteristics of the STAT approach. This generic core is extended in a well-defined way to implement intrusion detection systems for different domains and environments. The approach supports software reuse, portability and extendibility, and it allows for the optimization of critical functionalities."
96,y,Privacy-Preserving Medical Treatment System Through Nondeterministic Finite Automata,"In this article, we propose a privacy-preserving medical treatment system using nondeterministic finite automata (NFA), hereafter referred to as P-Med, designed for remote medical environment. P-Med makes use of the nondeterministic transition characteristic of NFA to flexibly represent medical model, which includes illness states, treatment methods and state transitions caused by exerting different treatment methods. A medical model is encrypted and outsourced to cloud to deliver telemedicine service. Using P-Med, patient-centric diagnosis and treatment can be made on-the-fly while protecting the confidentiality of patient’s illness states and treatment recommendation results. Moreover, a new privacy-preserving NFA evaluation method is given in P-Med to get a confidential match result for the evaluation of an encrypted NFA and an encrypted data set, which avoids the cumbersome inner state transition determination. We demonstrate that P-Med realizes treatment procedure recommendation without privacy leakage to unauthorized parties. We conduct extensive experiments and analysis to evaluate the efficiency."
140,n,A Blockchain-Based Authentication and Security Mechanism for IoT,"The existing identity authentication of IoT devices mostly depends on an intermediary institution, i.e., a CA server, which suffers from the single-point-failure attack. Even worse, the critical data of authenticated devices can be tampered by inner attacks without being identified. To address these issues, we utilize blockchain technology, which serves as a secure tamper-proof distributed ledger to IoT devices. In the proposed method, we assign a unique ID for each individual device and record them into the blockchain, so that they can authenticate each other without a central authority. We also design a data protection mechanism by hashing significant data (i.e. firmware) into the blockchain where any state changes of the data can be detected immediately. Finally, we implement a prototype based on an open source blockchain platform Hyperledger Fabric to verify the proposed system."
144,n,"Effects of layer thickness for GSAW, PSAW and HVPSAW devices","Considerable efforts in recent SAW device design and development have aimed at low loss, high performance and high frequency operation. A large number of applications relate to cellular and mobile telephony, pagers, local area networks, cordless phones, global positioning systems, and security systems. Pseudo-SAW (PSAW) and more recently the High Velocity Pseudo-SAW (HVPSAW) have received a great deal of attention due to their high phase velocities, and therefore the high frequencies of operation these modes may provide. In addition to high phase velocities, the pseudo-modes must also present low propagation losses and considerably high electromechanical coupling coefficients to be considered for practical devices. This paper verifies that the metallic layer thickness is a relevant SAW device parameter in order to achieve lower losses, for high frequency, high electromechanical coupling, low loss SAW devices. Popular PSAW and HVPSAW material orientations such as 64/spl deg/ YX LiNbO/sub 3/(0/spl deg/ 26/spl deg/ 0/spl deg/), 36/spl deg/ YX LiTaO/sub 3/ (0/spl deg/-54/spl deg/ 0/spl deg/), LiNbO/sub 3/ (90/spl deg/ 90/spl deg/ 36/spl deg/), LiTaO/sub 3/ (90/spl deg/ 90/spl deg/ 31/spl deg/), quartz ST-X (0/spl deg/ 132.75/spl deg/ 0/spl deg/), Li/sub 2/B/sub 4/O/sub 7/ (0/spl deg/ 45/spl deg/ 90/spl deg/), among others, are considered. In addition to the lower losses and the dispersion analysis for the pseudo modes, the present work discusses the transitions with layer thickness from HVPSAWs to higher order PSAWs modes, and the transitions from PSAWs to the generalized SAWs (GSAWs) modes. Besides contributing to the knowledge of the pseudo-modes behavior with layer thickness, this mode transition analysis enlightens the situation where the losses in the pseudo modes go to zero, due to the merging of the pseudo modes into the GSAWs. The fact that as a function of thickness the GSAWs are a natural continuation for the pseudo modes may be conveniently used in the fabrication of low loss devices. For completeness the effects of heavy layer metals, such as gold, in reducing the layer thickness where the pseudo modes merge to the GSAWs are discussed. Numerical results are compared to some experimental data available in the literature, and the present analysis elucidates experimentally observed higher order pseudo modes, and values of layer thickness where lower losses are achieved."
150,n,Defining the possible variants of a sectioned network by using a modified Newton-Raphson algorithm,"Congestions and undesirable power flows are an increasingly common occurrence in transmission networks. One possible measure to eliminate the congestion in network would be changing the network's topology since the stated changes the impedance of the network, which results in a change of power flow. Since the change in network topology has various implications, it can also be used as a powerful tool in optimization techniques resulting in reduction of power system losses, as well as in the already mentioned congestion management. This study deals with a new approach to the problem of changes in network topology based on application of a three-dimensional matrix of admittance, and with automating the process of power flow calculations for all possible variants of the network."
159,n,Using cloud SaaS to ensure interoperability and standardization in heterogeneous Cloud based environment,"During the last years, because of the evolution of Cloud applications and the attractive advantages given to consumers, many companies outsource their data and Information Technology (IT) system to the Cloud based technology. With the growth in the number of Cloud Service Providers, many enterprises and organizations can use and associate services from multiple providers. There may be many Internet protocols for service access standards that are used to ensure interoperability between users browser and Web server, such as Representational State Transfer (REST) and Simple Object Access Protocol (SOAP). Each service has its specific characteristics such as authentication and security requirements. Hence, Cloud providers attempt to lock customers into proprietary interfaces so consumers can find themselves at not expects inevitable vendor lock-in. Therefore, the focus of our paper is to propose a solution to this problem by using Cloud intermediate between Cloud providers and consumer in heterogeneous Cloud environments interfaces. This is to achieve benefits such as standardization and interoperability, minimizing lock-in of Cloud providers. To reach such benefits, we propose a Cloud SaaS based on two interfaces and an internet component. These interfaces are used in Cloud Consumer and Provider sides and therefore guarantee communication between Cloud Consumer and Provider using different Internet protocols for Web service access such as REST and SOAP. Our approach guarantees interoperability and standardization in heterogeneous Cloud based environments because in this case Cloud Consumer and Provider using REST interface can communicate easily with Cloud Provider and Consumer using SOAP interface."
191,n,An adaptive security end-system model based on active defense,"In order to enhance the security of Web service as well as to support the differentiated service, the paper puts forward an adaptive model, which is based on active defense strategy. It uses a network prediction model on base of self-similar sequence theory to estimate current slates of transfer servers in end-system, then classifies them with fuzzy-C-means clustering method. Finally, we bring forward a load balancing algorithm that is founded on the classification results and grading users' requests. In that way, it optimizes the allocation of system resources and ensures data security and reliability. Moreover, this model is not dependent on the original operating system and is transplantable and extensible"
205,y,Adaptive Cyber Security for Critical Infrastructure,"In the modern era, much of worldwide critical operations from a variety of different sectors are managed by industrial control systems (ICS). A typical ICS includes an extensive range of comput-erized devices, control systems, and networking appliances used to manage efficiently an industrial process across large geographical areas. ICS underpin sensitive and critical national infrastructures such as water treatment and energy production and transportation. The consequences of a successful attack against them can lead to shutting the infrastructure down which has major impacts such as production stoppages or safety implications for people, the environment, and assets. At the same time, running a process while the infrastructure is under attack or compromised also has safety im-plications, potentially catastrophic. This work-in-progress focuses on an adaptive approach, able to alter the defensive posture while providing assurances about operational capacity (or downgrading it) and safety. Our approach involves transforming policies from simply a means to enforce security requirements defined a priori, to adaptive objects that are capable to evolve in response to unfolding attacks. We use a case study of reconnaissance attacks and moving target defense as a means to realize such adaptive security policies."
213,y,Multi modal verification for teleservices and security applications (M2VTS),"The paper presents the European ACTS project ""M2VTS"" which stands for Multi Modal Verification for Teleservices and Security Applications. The primary goal of this project is to address the issue of secured access to local and centralised services in a multimedia environment. The main objective is to extend the scope of application of network based services by adding novel and intelligent functionalities, enabled by automatic verification systems combining multimodal strategies (secured access based on speech, image or other information). The objectives of the project are also to show that limitations of individual technologies (speaker verification, frontal face authentication, profile identification...) can be overcome by relying on multi modal decisions (combination or fusion of these technologies)."
220,n,System-aware security for nuclear power systems,"As shown in the recently publicized Stuxnet attack in Iran, there are significant threats of embedded infections by the producers of equipment that support our nations nuclear power plants that cannot be completely addressed by advancing perimeter security solutions. In this paper we layout a new systems engineering focused approach for addressing these threats: referred to as System-Aware Security for Nuclear Power Systems. This security architecture resides at the application layer and is based on smart reusable system security services. Furthermore, to show how such an architecture can enhance the security of nuclear power systems, this paper present a vision for this architectural formulation for a Nuclear Power Plant Turbine Control System."
232,n,Research on Real Power Grid Security and Stability Based on Big Data Analysis Method and Online Data of Power Grid,"In terms of the accumulation of historical data of the power system, China's power grids have accumulated a great number of dispatching and operating data which contains different voltage levels. Online safety and stability analysis conduct a comprehensive system assessment every 15 minutes, including power flow, short circuit, static safety analysis, voltage stability, transient stability, small disturbance stability, limit transmission power, and scheduling assistance decision-making, and the calculation data and result data are about 1G. Based on the six-month online historical data accumulated by a provincial power grid, this paper studies the characteristics of the actual power grid security and stability, and proposes a system stability analysis method based on the online security analysis of historical resources. At the same time, Considering the time-varying characteristics of the power system, an operation rule extracting method was proposed. Firstly, based on the correlation analysis methods, the corresponding features are selected for each type on the hierarchical grid. Then, a power grid security risk assessment system is established based on load ratio, and line limitation. Finally, this article automatically discovers the characteristics and rules of grid dispatching operations from numerous online data, provides a theoretical basis for operational mode and scheduling decisions, further improves the ability of large-scale grid dispatching and online safety analysis, and enhances the ability of power grids to resist the influence of external factors on safe and stable operations ability and has important practical application value."
260,y,Engineering topology aware adaptive security: Preventing requirements violations at runtime,"Adaptive security systems aim to protect critical assets in the face of changes in their operational environment. We have argued that incorporating an explicit representation of the environment's topology enables reasoning on the location of assets being protected and the proximity of potentially harmful agents. This paper proposes to engineer topology aware adaptive security systems by identifying violations of security requirements that may be caused by topological changes, and selecting a set of security controls that prevent such violations. Our approach focuses on physical topologies; it maintains at runtime a live representation of the topology which is updated when assets or agents move, or when the structure of the physical space is altered. When the topology changes, we look ahead at a subset of the future system states. These states are reachable when the agents move within the physical space. If security requirements can be violated in future system states, a configuration of security controls is proactively applied to prevent the system from reaching those states. Thus, the system continuously adapts to topological stimuli, while maintaining requirements satisfaction. Security requirements are formally expressed using a propositional temporal logic, encoding spatial properties in Computation Tree Logic (CTL). The Ambient Calculus is used to represent the topology of the operational environment - including location of assets and agents - as well as to identify future system states that are reachable from the current one. The approach is demonstrated and evaluated using a substantive example concerned with physical access control."
266,n,Automatic management of network security policy,"The paper describes work in our project funded by the DARPA Dynamic Coalitions program to design, develop, and demonstrate a system for automatically managing security policies in dynamic networks. Specifically, we aim to reduce human involvement in network management by building a practical network reconfiguration system so that simple security policies stated as positive and negative invariants are upheld as the network changes. The focus of this project is a practical tool to help systems administrators verifiably enforce simple multi-layer network security policies. Our key design considerations are computational cost of policy validation and the power of the enforcement primitives. The central component is a policy engine populated by models of network elements and services that validates policies and computes new configuration settings for network elements when they are violated. We instantiate our policy enforcement tool using a monitoring and instrumentation layer that reports network changes as they occur and implements configuration changes computed by the policy engine."
353,n,NextGen flight security risk assessment information concept,"One of the foundational elements of the Next Generation Air Transportation System (NextGen) Secure Airspace concept is the flight security risk assessment. This risk assessment is continually performed and updated based on changes to security-related information pertaining to a particular flight, as well as changes to the security environment external to the flight; e.g., other flights, airports, and airspace. This dynamic risk assessment is part of the NextGen layered, adaptive security concept in which technologies, policies, and procedures are adaptively scaled and deployed to counter a particular threat. This paper describes key information concepts for dynamic flight security risk assessment."
354,n,Probabilistic Evaluation of Substation Criticality Based on Static and Dynamic System Performances,"In most practical cases, traditional methods for assessing the reliability of substations, separately from the electric power network, are not sufficient to a good understanding of the system performance and possible reinforcements. This paper presents a new methodology to evaluate the criticality of electrical substations taking into account their possible operating states, associate probabilities, and consequences on the static and dynamic performance of the electric power system. Two complementary reliability indices are proposed to express the dynamic security and static adequacy levels that a substation provides to the power grid. An application in a test system is presented and the substation criticality ranking is provided and discussed."
381,n,Dynamically evolvable distributed systems,"Dynamic evolution allows designers to move logic from interpreted data structures into directly executed code. This provides the efficiency of code-driven security enforcement without sacrificing flexibility. The Evolvable Systems Project (ESP) at University of California, is developing techniques for safely and securely evolve distributed Java applications at runtime. We briefly describe the design and implementation of a type-safe model for dynamically modifying Java programs on a single host. We then describe how this model can be applied for building an adaptive security infrastructure. An extension of the single host model to a distributed environment is considered. Finally, we conclude with a brief outline of the project and the future work."
386,n,The method of selecting the operation modes of the multifunctional HF radio,"The article proposes the method for determining the operation modes of the multifunctional radio using the theory of fuzzy logic. The method takes into account the requirements for customers of various categories of importance. The method implements two ways of evaluating the effectiveness of each of the available operating modes of the radio. In the first case, the timely, credibility and security of information transmission on the specified radio route is evaluated. In the second case, the system supports decision-making based on the expert assessment is used. The method would be used for the development of an automated system decided to determine the operation modes of a multifunctional radio."
436,y,"Adaptive SSL: Design, Implementation and Overhead Analysis","Adaptive security is based on the observation that the security requirements of a system or service heavily depend on the environment in which they operate and should therefore be dynamically adjusted to best operate within that environment as the environment changes. In this paper we are concerned with adapting the choice of cryptographic algorithms applied to client-server interactions. To that end, we design and implement an adaptation controller for SSL (Secure Socket Layer), called Adaptive SSL."
