id,relevant,title,abstract
698,n,Regularity-Based Virtualization under the ARINC 653 Standard for Embedded Systems,"In embedded real-time virtualized systems (ERTVS), the ARINC 653 standard specifies a cyclic scheduling policy to guarantee the real-time performance of tasks in multiple Virtual Machines (VMs) residing on shared hardware. Based on this policy, the Regularity-based Resource Partitioning (RRP) model defines an efficient interface specification to hierarchically partition and assign resource slices among VMs. Although this model has received plenty of attention recently, three major pieces remain missing for applying this model in ERTVS. (1) Embedded systems are more sensitive to resource utilization efficiency since this may drastically affect their deployment cost for including additional cores. Therefore, this paper proposes an optimal and an approximate RRP resource scheduler for multi-core platforms. (2) A resource reconfiguration is required when an embedded system has to switch between operating modes, resulting in the current cyclic schedule being replaced by another pre-configured and verified cyclic schedule. This paper formalizes a new One-Hop Reconfiguration (OHR) problem tailored for mode-switch-capable embedded systems and introduces a corresponding optimal solution. (3) No RRP-based toolset is currently available for embedded systems. This paper thus presents an optimized RRP toolset tailored for embedded systems. Numerous experiments are conducted to evaluate the efficacy of this toolset.  © 1968-2012 IEEE."
720,n,Cyber-attack research for integrated energy systems by the correlated matrix based object-oriented modeling method,"The rise of an integrated energy system requires the integration of multiple sources of energy to be embraced and transited over the power grid; that means the information and communication systems of traditional power systems will be extended, and their complexity will be increased. As the information and communication systems play a more important role in the infrastructure of the power system, a cyber-attack on them may have an impact on the power system and cause a serious threat to the integrated energy system. To analyze the threat to the complex and integrated system, some researchers provide some modeling methods to study the impact of cyber-attacks on the information and communication systems, such as the Attack Tree Model, Attack Graph Model, Petri Net Model for cyber-attack, Attack Description Language Model, State Transition Graph Model, etc. However, these modeling methods have some shortcomings. For example, they cannot describe the systematical cyber-attack and show the secure status during the cyber-attack; it is hard for them to analyze the larger and more complicated information and communication systems. To overcome the shortages, in this paper, a correlated matrix-based object-oriented model is proposed for cyber-attack modeling. With this model, the relationship between the attacker and victim can be directly built; the cyber-attack path and packets from the attacker can be tracked; and the status of the nodes and links can be shown during a cyber-attack. There are two steps to build the cyber-attack model. Firstly, the procedure and approach of the cyber-attack will be modeled by an object-oriented method; then, a correlated matrix model will be built for network topology, attack path, and attack procedure. By combining these two models, the whole cyber-attack model is created. Finally, to demonstrate the modeling method and its benefits, we use the MITM (Man-in-the-middle Attack) attack on measurement data of an AVC (Automation Voltage Control) system as examples, and build a hardware-in-the-loop (HIL) co-simulation platform to verify the model. Copyright © 2022 Tong, Xu, Li and Zhang."
734,n,Towards Developing a Data Security Aware Federated Training Framework in Multi-Modal Contested Environments,"Secure data communication is crucial in contested environments such as battlefields. In such environments, there is always risk of data breach through unauthorized interceptions. This may lead to unauthorized access to tactical information and infiltration into the systems. In this work, we propose a detailed training setup in the federated learning framework for object classification where the raw data will be maintained locally at the edge devices and will not be shared with a central server or with each other. The server sends a global model to edge devices, which is then trained locally at the edge, and the updated parameters are sent back to the central server, where they are aggregated, which takes place iteratively. This setup ensures robustness against malicious cyberattacks as well as reduce communication overhead. Furthermore, to tackle the irregularity in object classification task with a single data modality in such contested environment, a deep learning model incorporating multiple modalities is used as the global model in our proposed federated learning setup. This model can serve as a possible solution in object identification with multi-modal data. We conduct a comprehensive analysis on the importance of multi-modal approach compared to individual modalities within our proposed federate learning setup. We also provide a resource profiling based on memory requirements, training time, and energy usage on two resource constrained devices to demonstrate the feasibility of the proposed approach. © 2022 SPIE."
740,n,Modeling Technology of Naval Formation Area Antiaircraft Kill Web based on Event Graph,"Future air defense missions of naval formation are becoming more and more diverse, and various combat resources are deployed, which poses new challenges to the traditional area antiaircraft system. This research focuses on the 'orientation' of the confrontation, and builds the kill web model of area air defense based on event graph. Under the event graph paradigm, the state change of air target is the fundamental constraint of event evolution, and the continuous dynamic process of the operational implementation is transformed into a discrete dynamic process composed of key events. Through the analysis of the constraints and correlations of area air defense operational elements, the tactical action effect evaluation model is used to evaluate the resource combination scheme, and the final optimal combination scheme is determined based on the intelligent algorithm, thereby exploring a new way for the construction of a naval formation area air defense kill web.  © 2022 IEEE."
750,n,Multimodal Classification of Onion Services for Proactive Cyber Threat Intelligence Using Explainable Deep Learning,"The dark web has been confronted with a significant increase in the number and variety of onion services of illegitimate and criminal intent. Anonymity, encryption, and the technical complexity of the Tor network are key challenges in detecting, disabling, and regulating such services. Instead of tracking an operational location, cyber threat intelligence can become more proactive by utilizing recent advances in Artificial Intelligence (AI) to detect and classify onion services based on the content, as well as provide an interpretation of the classification outcome. In this paper, we propose a novel multimodal classification approach based on explainable deep learning that classifies onion services based on the image and text content of each site. A Convolutional Neural Network with Gradient-weighted Class Activation Mapping (Grad-CAM) and a pre-trained word embedding with Bahdanau additive attention are the core capabilities of this approach that classify and contextualize the representative features of an onion service. We demonstrate the superior classification accuracy of this approach as well as the role of explainability in decision-making that collectively enables proactive cyber threat intelligence in the dark web.  © 2013 IEEE."
753,n,The Application of Beidou and Ultra-Broadband Positioning Technology in the Power Security Protection System,"In the Beidou positioning system, due to the obstruction of obstacles, the indoor is often unable to obtain positioning information. For this case, a scheme based on Beidou indoor and outdoor integration positioning is proposed. First, the algorithms of satellite localization and ultra wide band localization are studied, and a high-precision positioning algorithm compatible with both positioning modes is proposed. Seamless switching algorithm can realize positioning mode switching without affecting positioning accuracy. Based on the research of algorithm model of substation, determine the layout mode and positioning accuracy, and solve the problem of weak signal of indoor positioning. This scheme guarantees the positioning accuracy in the practical application environment, and it provides a theoretical basis for the positioning of people and equipment in the power system. © 2022, Springer Nature Singapore Pte Ltd."
760,n,Steady-State Availability Evaluation for Heterogeneous Edge Computing-Enabled WSNs with Malware Infections,"To evaluate the steady-state availability of heterogeneous edge computing-enabled wireless sensor networks (HECWSNs) with malware infections, we first propose a Stackelberg attack-defence game to predict the optimal strategies of malware and intrusion detection systems (IDSs) deployed in heterogeneous sensor nodes (HSNs). Next, we present a new malware infection model-heterogeneous susceptible-threatened-active-recovered-dead (HSTARD) based on epidemic theory. Then, considering the heterogeneity of sink sensor nodes and common sensor nodes and the malware attack correlation, we derive the state transition probability matrix of an HSN based on a semi-Markov process (SMP), as well as the steady-state availability of an HSN. Furthermore, based on a data flow analysis of HSNs, we deduce the steady-state availability of HECWSNs with various topologies, including the star topology, cluster topology, and mesh topology. Finally, numerical analyses illustrate the influence of the IDS parameters on the optimal infection probability of malware and reveal the effect of multiple factors on the steady-state availability of HSNs, including the initial infection rate, the infection change rate, and the malware attack correlation. In addition, we present data analyses of the steady-state availability of HECWSNs with various topologies, including the star topology, cluster topology, and mesh topology, which provide a theoretical basis for the design, deployment, and maintenance of high-availability HECWSNs.  © 2022 Hong Zhang et al."
769,n,Modeling and simulation of secure connectivity and hop count of multi-hop ad-hoc wireless networks with colluding and non-colluding eavesdroppers,"Connectivity and hop count are two crucial attributes of dynamic wireless networks such as ad-hoc wireless networks (AHWNs). When the security issue is considered, establishing a secure multi-hop path in AHWNs is challenging because an intermediate node having a wireless link with previous nodes may not be secure to receive data from those nodes, and vice versa. In this paper, stochastic geometry graphs is used to model the AHWNs with eavesdroppers’ presence, then a simulation-based analysis method is proposed to investigate the characteristics of connectivity, hop count distribution, average hop count, and their relations in various scenarios. The proposed simulation-based analysis method consists of two algorithms. The first one finds all possible secure communication paths between two arbitrary legitimate users selected as source and destination and returns the shortest path's hop count. This algorithm utilizes the random locations of legitimate users and eavesdroppers, the wireless channel condition, and the eavesdropper's operating mode as input data. The second one provides the hop count distribution and the connection probability of the obtained multi-hop path of the first algorithm by averaging a huge number of network topology trials. So far, this paper is the first work that investigates both connectivity and hop count of security-aware multi-hop AHWNs. Moreover, these characteristics of multi-hop AHWNs with colluding eavesdroppers are compared with those of multi-hop AHWNs with non-colluding eavesdroppers and without eavesdroppers. Simulation results show that putting more legitimate users does not greatly improve the quality of the multi-hop path in the non-colluding case compared with that in colluding case. Furthermore, the shape parameter of Nakagami fading has a more substantial effect on the connectivity and hop count than the spread parameter. The results in this paper provide valuable insights in designing and evaluating security-aware multi-hop AHWNs. © 2021 Elsevier B.V."
770,n,Industrial Pervasive Edge Computing-Based Intelligence IoT for Surveillance Saliency Detection,"Numerous surveillance data processing is crucial in the Internet-of-Things systems with pervasive edge computing. In this process, salient object detection from surveillance videos plays an important role because it provides the human-concerned semantic cue for various industrial tasks. However, it is still challenging for the existing studies with two aspects. The first one is the redundant saliency information from moving background to disturb the detection of salient objects. The second one is the difficulty to model the spatiotemporal saliency uncertainty. To overcome these challenges. In this article, an intelligent approach is proposed for surveillance saliency detection. It enables a region-proposal-based optical flow strategy to suppress the saliency enhancement of non-salient regions due to the moving background. Besides, it develops the bidirectional Bayesian state transition strategy to model the motion uncertainty for refining the spatiotemporal saliency feature. Extensive experiments have been performed on two datasets (the increase of Fβ is larger than 0.01 for DAVIS, and larger than 0.015 for UVSD), and the comparison with seven methods to evaluate the effectiveness of the proposed approach.  © 2005-2012 IEEE."
771,n,Situational Anomaly Detection in Multimedia Data under Concept Drift,"Anomaly detection has been a very challenging and active area of research for decades, particularly for video surveillance. However, most of the works detect predefined anomaly classes using static models. These frameworks have limited applicability for real-life surveillance where the data have concept drift. Under concept drift, the distribution of both normal and anomaly classes changes over time. An event may change its class from anomaly to normal or vice-versa. The non-adaptive frameworks do not handle this drift. Additionally, the focus has been on detecting local anomalies, such as a region of an image. In contrast, in CCTV-based monitoring, flagging unseen anomalous situations can be of greater interest. Utilizing multiple sensory information for anomaly detection has also received less attention. This extended abstract discusses these gaps and possible solutions. © 2021 ACM."
772,n,Deriving adaptive long-term complementary operating rules for a large-scale hydro-photovoltaic hybrid power plant using ensemble Kalman filter,"The complementary operating rules of hydro-photovoltaic (PV) hybrid power plants have been explored fully to operate reservoirs for complementing the PV output. However, prevailing operating rules were constant, which is incapable to be dynamically updated based on new observations. To address this issue, adaptive complementary operating rules were developed to deal with the future uncertainties of reservoir inflow and solar radiation using ensemble Kalman filter (EnKF). First, a long-term complementary optimization model was developed to derive the initial parameters of linear operating rules. Then, the optimal decisions under historical condition were used as the observation. Finally, six assimilation schemes were proposed, according to the two state transition equations (the same period of the previous year, the previous period) and three observations (the same period of the previous year, the previous period and their joint). China's Longyangxia hydro-PV hybrid power plant was chosen as a case study. Results show that (1) the two state transition equations have comparative effects on operation results, (2) the choice of observation plays a decisive role. The assimilation scheme, in which the optimal operation decision of the same period in previous year is as observation, outperforms the stationary operating rules. Specifically, the total power generation and guaranteed rate are improved by 7.14% and 5.33%, respectively, (3) the deriving framework works effectively under the synthetic nonstationary reservoir inflow and solar radiation, and ensures the stability and security of energy system in the changing environment. © 2021"
779,n,Attack-driven Test Case Generation Approach using Model-checking Technique for Collaborating Systems,"The formal verification technique of model-checking can be used to derive test cases. This approach has become popular as it provides the capabilities of exhaustively exploring the state space of the modeled system and generates counterexamples for properties specified over the model. However, counterexamples only show states, transitions and the values of their parameters. In addition, its semantics are also dependent on input model specification languages and trace representation notations. In this paper, we present a focused test case generation approach from PAT model checker for collaborating systems. The focus is driven by specific and putative attack behaviours. To this end, we devised test specification rules/algorithm to translate counterexamples to test cases. The translation aims at reducing semantic gaps between counterexamples and the corresponding test cases. We assess the viability of the test cases generated from our approach by using JADE simulation framework for aircraft landing scenario in air traffic control domain.  © 2021 IEEE."
783,n,Reliability and optimal triggering policy for multi-state systems subject to shocks and supported by a protective device,"Failures of safety-critical systems could result in irretrievable economic loss and significant environmental damage. To mitigate the failure risk of safety-critical systems, a protective device is commonly designed to alleviate the damage caused by external shocks. In this paper, a multi-state system subject to shocks and supported by a protective device is considered. The protective device can be triggered to defense valid shocks when the system state is worse than a predetermined threshold. During the operating process of the protective device, the system is assumed to be failure-free due to the resistant effect of the protective device. After resisting a finite number of valid shocks for the system, the protective device loses the protective ability. A finite Markov chain imbedding method is employed to derive the system reliability characteristics. Based on the established reliability model, the state based triggering policy of the protective device is designed and an optimization model is constructed to determine the optimal triggering threshold. Finally, numerical examples are given to illustrate the proposed model and obtained results. © 2021 Elsevier Ltd"
784,n,Enabling self-adaptability of small scale and large scale security systems using dynamic partial reconfiguration,"The application areas of field programmable gate arrays (FPGAs) are increasing due to its hardware acceleration and reprogrammable features. From large-scale computation systems like cloud, aerospace, and defence to small-scale computation systems like home automation and mobile phones, the dynamic partial reconfiguration property is found to be attractive to design adaptive systems for self-reconfiguration and self-healing. The article presents two self- adaptive security systems for small scale as well as for large-scale systems. The security system is designed to include encryption accelerators and hash code generation accelerators. The security system designed for small-scale systems saves space and power using hardware adaptation by loading or creating only the required accelerator during execution of the application. It uses light weight cryptographic algorithms. A second design for large-scale systems focuses on getting more throughput by allocating more resources to the required accelerator at runtime. Two designs are created for hardware adaptation based on the accelerator requirement at runtime. Proposed adaptive design for small-scale systems achieved 68.50% decrease in resource consumption and design for large-scale systems achieved 25.93% more throughput than the best existing implementations. © 2020, Springer-Verlag GmbH Germany, part of Springer Nature."
797,n,NetBot-An Automated Router Hardening Solution for Small to Medium Enterprises,"Network security is of vital importance, and Information Technology admins must always be vigilant. But they often lack the expertise and skills required to harden the network properly, in with the emergence of security threats. The router plays a significant role in maintaining operational security for an organization. When it comes to information security, information security professionals mainly focus on protecting items such as firewalls, virtual private networks, etc. Routers are the foundation of any network's communication method, which means all the network information passes through the routers, making them a desirable target. The proposed automation of the router security hardening solution will immediately improve the security of routers and ensure that they are updated and hardened with minimal human intervention and configuration changes. This is specially focused on small and medium-sized organizations lacking workforce and expertise on network security and will help secure the routers with less time consumption, cost, and increased efficiency. The solution consists of four primary functions, initial configuration, vulnerability fixing, compliance auditing, and rollback. These focus on all aspects of router security in a network, from its configuration when it is initially connected to the network to checking its compliance errors, continuously monitoring the vulnerabilities that need to be fixed, and ensuring that the behavior of the devices is stable and shows no abnormalities when it comes to configuration changes.  © 2021 IEEE."
799,n,A polymorphic heterogeneous security architecture for edge-enabled smart grids,"The emergence of edge computing alleviates the network congestion, delay, and packet loss of cloud computing enabled smart grid architecture in big data scenarios, greatly improving the operation efficiency and communication quality of the smart grid. However, edge computing architecture also brings great security risks to the smart grid. This paper proposes a Polymorphic Heterogeneous Security Architecture (PHSA) for edge enabled smart grid, to assure the key services in the smart grid. Based on the dynamic heterogeneous redundancy architecture, the proposed architecture introduces intelligent scheduling of executors, intelligent arbitration of multi-state service response, cleaning and reconstruction of executors, and attack surface management. We establish a closed-loop core control process of decision and processing, adjustment and scheduling, cleaning reconstruction, migration, and recovery. Furthermore, a dynamic scheduling algorithm based on executor credit and heterogeneity is proposed. The simulation results show that, compared with the traditional smart grid security architecture, the PHSA has better defense ability and system reliability, significantly improving the security of edge enabled smart grid system. Besides, compared with the random scheduling strategy, the proposed dynamic executor scheduling algorithm can further improve the security of the system. © 2021 Elsevier Ltd"
