,id,title,authors,doi,link,pub_year,type,abstract,source,pub_title
45,46,"Frequency Response Capabilities of Utility-scale Battery Energy Storage Systems, with Application to the August 2018 Separation Event in Australia",M. G. Dozein; P. Mancarella,10.1109/ICPES47639.2019.9105646,https://ieeexplore.ieee.org/stamp/stamp.jsp?arnumber=9105646,2019.0,IEEE Conferences,This paper is aimed to investigate the capabilities of utility-scale energy storage system (BESS) in provision of both contingency and regulation frequency control ancillary services (FCAS). In pa...,IEEE Xplore,2019 9th International Conference on Power and Energy Systems (ICPES)
75,76,Generalized n+2 state system Markov model for station-oriented reliability evaluation,R. Billinton; H. Chen; Jiaqi Zhou,10.1109/59.627850,https://ieeexplore.ieee.org/stamp/stamp.jsp?arnumber=627850,1997.0,IEEE Journals,"Practical restorative actions and existing dependencies in stations cannot be completely represented using a conventional three state model. In order to overcome these weaknesses, system state tra...",IEEE Xplore,IEEE Transactions on Power Systems
141,142,Hybrid Hierarchical Network Intrusion Detection,H. -y. Yang; L. -x. Xie,10.1109/ICMLC.2006.258929,https://ieeexplore.ieee.org/stamp/stamp.jsp?arnumber=4028520,2006.0,IEEE Conferences,"A prototype of three-layer network intrusion detection system (NIDS) was designed to improve the veracity and efficiency of intrusion detection. The NIDS deals with the network layer raw data, the...",IEEE Xplore,2006 International Conference on Machine Learning and Cybernetics
142,143,A State-Adaptive Access Control Model for Web-Based IDRS System,X. Wu; Y. He; Z. Zhou,10.1109/NSWCTC.2009.32,https://ieeexplore.ieee.org/stamp/stamp.jsp?arnumber=4908433,2009.0,IEEE Conferences,"Role based access control reduces the cost of security administration of large-scale systems. However, it mainly abstracts a user from the function aspect, which is not enough for some complex lar...",IEEE Xplore,"2009 International Conference on Networks Security, Wireless Communications and Trusted Computing"
150,151,Power grids reliability appraisal with intrusion tolerant capability in SCADA systems,Y. Zhang; L. Wang; Y. Xiang,10.1109/POWERCON.2014.6993998,https://ieeexplore.ieee.org/stamp/stamp.jsp?arnumber=6993998,2014.0,IEEE Conferences,"By intruding into the substations and control center of the supervisory control and data acquisition (SCADA) system, trip commands can be sent to intelligent electronic devices (IEDs) which contro...",IEEE Xplore,2014 International Conference on Power System Technology
215,216,Distributed Secure Control Against Denial-of-Service Attacks in Cyber-Physical Systems Based on K-Connected Communication Topology,T. -Y. Zhang; D. Ye,10.1109/TCYB.2020.2973303,https://ieeexplore.ieee.org/stamp/stamp.jsp?arnumber=9016368,2020.0,IEEE Journals,"In this article, the security problem in cyber-physical systems (CPSs) against denial-of-service (DoS) attacks is studied from the perspectives of the designs of communication topology and distrib...",IEEE Xplore,IEEE Transactions on Cybernetics
343,344,Remote Attestation with Domain-Based Integrity Model and Policy Analysis,W. Xu; X. Zhang; H. Hu; G. -J. Ahn; J. -P. Seifert,10.1109/TDSC.2011.61,https://ieeexplore.ieee.org/stamp/stamp.jsp?arnumber=6104065,2012.0,IEEE Journals,"We propose and implement an innovative remote attestation framework called DR@FT for efficiently measuring a target system based on an information flow-based integrity model. With this model, the ...",IEEE Xplore,IEEE Transactions on Dependable and Secure Computing
435,436,Transparent 3rd-Party Authentication With Application Mobility for 5G Mobile Edge Computing,A. Ali; Y. -D. Lin; C. -Y. Li; Y. -C. Lai,10.1109/TNSM.2023.3296085,https://ieeexplore.ieee.org/stamp/stamp.jsp?arnumber=10185455,2023.0,IEEE Early Access Articles,Mobile Edge Computing (MEC) is a key technology for supporting low latency applications close to the end user. Users can access application servers in MEC instead of routing to the internet by pas...,IEEE Xplore,IEEE Transactions on Network and Service Management
457,458,Automatic Current Transformer Verification Technology for High-Speed Railway Power Based on Edge-Cloud Collaborative Computing,L. Yang; Z. -L. Zhang; S. -K. Wang; W. -T. Zhang; R. Dai; Y. -B. Liu,10.1109/CCET55412.2022.9906363,https://ieeexplore.ieee.org/stamp/stamp.jsp?arnumber=9906363,2022.0,IEEE Conferences,"Current transformer is a key power equipment for high-speed railway power, with high risk for the operator. Based on the architecture of edge-cloud collaborative computing, an automatic high volta...",IEEE Xplore,2022 IEEE 5th International Conference on Computer and Communication Engineering Technology (CCET)
500,501,Framework for Identification of Power System Operating Security Regions,M. A. El-Kady; E. A. Al-Ammar,10.1109/NSS.2009.16,https://ieeexplore.ieee.org/stamp/stamp.jsp?arnumber=5319315,2009.0,IEEE Conferences,"Power system operation aims, in principle, at maintaining reliable and secure supply of electricity while minimizing the total cost of operation. In theory, there are two main objectives that coul...",IEEE Xplore,2009 Third International Conference on Network and System Security
605,606,Conceptual framework for composite power system health analysis,R. Billinton; S. Aboreshaid; M. Fotuhi-Firuzabad,10.1109/CCECE.1996.548120,https://ieeexplore.ieee.org/stamp/stamp.jsp?arnumber=548120,1996.0,IEEE Conferences,"Probability methods are being used extensively in the area of static adequacy assessment; however, their application to power system security evaluation has not received the same degree of attenti...",IEEE Xplore,Proceedings of 1996 Canadian Conference on Electrical and Computer Engineering
634,635,FBASHI: Fuzzy and Blockchain-Based Adaptive Security for Healthcare IoTs,Z. Zulkifl; F. Khan; S. Tahir; M. Afzal; W. Iqbal; A. Rehman; S. Saeed; A. M. Almuhaideb,10.1109/ACCESS.2022.3149046,https://ieeexplore.ieee.org/stamp/stamp.jsp?arnumber=9703287,2022.0,IEEE Journals,"Internet of Things (IoT) is a system of interconnected devices that have the ability to monitor and transfer data to peers without human intervention. Authentication, Authorization and Audit Logs ...",IEEE Xplore,IEEE Access
719,720,Runtime Security Adaptation Using Adaptive SSL,C. J. Lamprecht; A. P. A. van Moorsel,10.1109/PRDC.2008.27,https://ieeexplore.ieee.org/stamp/stamp.jsp?arnumber=4725310,2008.0,IEEE Conferences,Self-adaptive security offers great potential in providing timely and fine grained security control. In this paper we experimentally investigate the effects of a security adaptation in various cli...,IEEE Xplore,2008 14th IEEE Pacific Rim International Symposium on Dependable Computing
728,729,Forming the multi-modal situation context in ambient intelligence systems on the basis of self-organizing cognitive architectures,P. Ivanov; Z. Nagoev; I. Pshenokova; D. Tokmakova,10.1109/WICT.2015.7489658,https://ieeexplore.ieee.org/stamp/stamp.jsp?arnumber=7489658,2015.0,IEEE Conferences,The article provides a theoretical basis of multi-agent recursive cognitive architectures as a distributed intelligent system of decision-making and control of an ambient intelligence system. It i...,IEEE Xplore,2015 5th World Congress on Information and Communication Technologies (WICT)
751,752,Adaptive Protective Relay Settings – A Vision to the Future,S. Mukherjee; M. Marshall; T. Smith; E. Piesciorvosky; I. Snyder; C. Sticht,10.1109/REPEC55671.2022.00013,https://ieeexplore.ieee.org/stamp/stamp.jsp?arnumber=9799956,2022.0,IEEE Conferences,Adaptive relaying utilizes the continuously changing status of the power system as the basis for online adjustment of the power system relay settings. Fundamentally they are protection schemes tha...,IEEE Xplore,2022 IEEE Rural Electric Power Conference (REPC)
763,764,Optimal Energy Reserve Scheduling in Integrated Electricity and Gas Systems Considering Reliability Requirements,H. Hui; M. Bao; Y. Ding; Y. Yang; Y. Xue,10.35833/MPCE.2021.000028,https://ieeexplore.ieee.org/stamp/stamp.jsp?arnumber=9584449,2022.0,SGEPRI Journals,"With the growing interdependence between the electricity system and the natural gas system, the operation uncertainties in either subsystem, such as wind fluctuations or component failures, could ...",IEEE Xplore,Journal of Modern Power Systems and Clean Energy
775,776,A Study of Biometric Identification and Verification System,Vandana; N. Kaur,10.1109/ICACITE51222.2021.9404735,https://ieeexplore.ieee.org/stamp/stamp.jsp?arnumber=9404735,2021.0,IEEE Conferences,"Conventionally, the identification of users is performed using passwords and PIN numbers. However, due to the rapid changes in technology, these security measure's abuse and theft are also increas...",IEEE Xplore,2021 International Conference on Advance Computing and Innovative Technologies in Engineering (ICACITE)
789,790,Wearable haptic-based multi-modal teleoperation of field mobile manipulator for explosive ordnance disposal,Dongseok Ryu; Chang-Soon Hwang; Sungchul Kang; Munsang Kim; Jae-Bok Song,10.1109/SSRR.2005.1501246,https://ieeexplore.ieee.org/stamp/stamp.jsp?arnumber=1501246,2005.0,IEEE Conferences,This paper describes a wearable multi-modal user interface design and its implementation for a teleoperated field robot system. Recently some teleoperated field robots are employed for hazard envi...,IEEE Xplore,"IEEE International Safety, Security and Rescue Rototics, Workshop, 2005."
815,816,Reliability Modeling and Assessment of Cyber Space in Cyber-Physical Power Systems,R. He; H. Xie; J. Deng; T. Feng; L. L. Lai; M. Shahidehpour,10.1109/TSG.2020.2982566,https://ieeexplore.ieee.org/stamp/stamp.jsp?arnumber=9044394,2020.0,IEEE Journals,The information technology in a cyber-physical power system plays a significant role in quickly regulating the energy flow that can cope with the complexity of power system operation and control. ...,IEEE Xplore,IEEE Transactions on Smart Grid
1009,1010,Meta-control for Adaptive Cybersecurity in FUZZBUSTER,D. J. Musliner; S. E. Friedman; J. M. Rye; T. Marble,10.1109/SASO.2013.29,https://ieeexplore.ieee.org/stamp/stamp.jsp?arnumber=6676509,2013.0,IEEE Conferences,"Modern cyber attackers use sophisticated, highly-automated vulnerability search and exploit development tools to find new ways to break into target computers. To protect against such threats, we a...",IEEE Xplore,2013 IEEE 7th International Conference on Self-Adaptive and Self-Organizing Systems
1016,1017,Integrating changes to a hierarchical policy model,S. Hinrichs,10.1109/INM.2005.1440815,https://ieeexplore.ieee.org/stamp/stamp.jsp?arnumber=1440815,2005.0,IEEE Conferences,Cisco's VPN and security management system (VMS) is based on a hierarchical security policy model. Customers have found this hierarchical composition policy model a clear and succinct form for exp...,IEEE Xplore,"2005 9th IFIP/IEEE International Symposium on Integrated Network Management, 2005. IM 2005."
1024,1025,Fusion of Multi-Modal Credentials for Authentication in Digital Identity Management Systems,J. Phiri; J. I. Agbinya,10.1109/AUSWIRELESS.2007.34,https://ieeexplore.ieee.org/stamp/stamp.jsp?arnumber=4299669,2007.0,IEEE Conferences,"The recent years have seen an increase in identity fraud and accessing online services when communication devices such as computers, mobile phones and card based credentials (e.g. credit cards) ar...",IEEE Xplore,The 2nd International Conference on Wireless Broadband and Ultra Wideband Communications (AusWireless 2007)
1085,1086,A Conception of Prospects for Application of Edge Computing Technology in Equipment Support,J. Pan; J. Han; K. Qin; P. Xu,10.1109/ICAIBD57115.2023.10206250,https://ieeexplore.ieee.org/stamp/stamp.jsp?arnumber=10206250,2023.0,IEEE Conferences,"Edge computing is a new computing model that is different from the traditional cloud computing model. It helps to relieve the pressure on the network bandwidth and cloud computing center, reduce t...",IEEE Xplore,2023 6th International Conference on Artificial Intelligence and Big Data (ICAIBD)
1128,1129,A Novel Paradigm: Cloud-Fog Integrated IoT Approach,S. K. Dwivedi; J. Yadav; S. A. Ansar; M. W. Khan; D. Pandey; R. A. Khan,10.1109/ICCAKM54721.2022.9990519,https://ieeexplore.ieee.org/stamp/stamp.jsp?arnumber=9990519,2022.0,IEEE Conferences,"The recent age of cloud computing (CC) has witnessed significant breakthroughs, notably in IoT (Internet of Things), Edge computing, Fog computing, 5G, and subsequently 6G technology. CC allows in...",IEEE Xplore,"2022 3rd International Conference on Computation, Automation and Knowledge Management (ICCAKM)"
1181,1182,Sentinel: A Multi-institution Enterprise Scale Platform for Data-driven Cybersecurity Research,A. Nottingham; M. Buchanan; M. Gardner; J. Hiser; J. Davidson,10.1109/ISSREW55968.2022.00075,https://ieeexplore.ieee.org/stamp/stamp.jsp?arnumber=9985118,2022.0,IEEE Conferences,"Current cybersecurity research is constrained by the general scarcity of large, realistic, labeled network traffic datasets. To address said scarcity, this paper introduces Sentinel: a multi-enter...",IEEE Xplore,2022 IEEE International Symposium on Software Reliability Engineering Workshops (ISSREW)
1248,1249,Tracking multiple three-dimensional motions by using modified condensation algorithm and multiple images,K. Hamasaki; T. Nakajima; T. Okatani; K. Deguchi,10.1109/IROS.2003.1250634,https://ieeexplore.ieee.org/stamp/stamp.jsp?arnumber=1250634,2003.0,IEEE Conferences,In this paper we present a system for tracking objects' 3D motions by using sampling algorithm. The system consists of three cameras and 1 PC. We modified the condensation algorithm [M.A. Isard et...,IEEE Xplore,Proceedings 2003 IEEE/RSJ International Conference on Intelligent Robots and Systems (IROS 2003) (Cat. No.03CH37453)
1282,1283,Fault Detection of LLE Compound Statistic Based on Weighted K-nearest Neighbor Selection,H. Gu; P. Qian; L. Wang; K. Cao,10.1109/CAC48633.2019.8997239,https://ieeexplore.ieee.org/stamp/stamp.jsp?arnumber=8997239,2019.0,IEEE Conferences,"Complex chemical process has the characteristics of nonlinear and multi-mode, so the on-line monitoring is of great significance to the system security. Based on a large number of industrial proce...",IEEE Xplore,2019 Chinese Automation Congress (CAC)
1285,1286,Development Process and Hot Spot Analysis of Object Detection Based on Mapping Knowledge Domains,J. Xiang,10.1109/ICCASIT53235.2021.9633393,https://ieeexplore.ieee.org/stamp/stamp.jsp?arnumber=9633393,2021.0,IEEE Conferences,"The object detection technology undergoes rapid development, has been widely used in the fields of transportation, medical treatment, Internet security etc., and has received extensive attention f...",IEEE Xplore,2021 IEEE 3rd International Conference on Civil Aviation Safety and Information Technology (ICCASIT)
1337,1338,Improving Virtualization in the Presence of Software Managed Translation Lookaside Buffers,"Chang X,Franke H,Ge Y,Liu T,Wang K,Xenidis J,Chen F,Zhang Y",10.1145/2485922.2485933,https://doi.org/10.1145/2485922.2485933;http://dx.doi.org/10.1145/2485922.2485933,2013,Conference Paper,"Virtualization has become an important technology that is used across many platforms, particularly servers, to increase utilization, multi-tenancy and security. Virtualization introduces additiona...",ACM Digital Library,Proceedings of the 40th Annual International Symposium on Computer Architecture
1347,1348,Prediction of the Domain Name System (DNS) Quality Attributes,"Radwan M,Heckel R",10.1145/3019612.3019728,https://doi.org/10.1145/3019612.3019728;http://dx.doi.org/10.1145/3019612.3019728,2017,Conference Paper,"The Domain Name System (DNS) has a direct impact on the performance and dependability of nearly all aspects of interactions on the Internet. DNS relies on a delegation-based architecture, where re...",ACM Digital Library,Proceedings of the Symposium on Applied Computing
1394,1395,A Bottom-Up Approach to Teaching Server-Side Web Development Skills (Abstract Only),Ortiz A,10.1145/2676723.2691922,https://doi.org/10.1145/2676723.2691922;http://dx.doi.org/10.1145/2676723.2691922,2015,Conference Paper,"When dealing with the topic of back-end programming many CS web development courses typically focus on how to use a popular web framework, for example Spring MVC or Ruby on Rails. The problem with...",ACM Digital Library,Proceedings of the 46th ACM Technical Symposium on Computer Science Education
1460,1461,Adaptive Security and Cyber Assurance for Risk-Based Decision Making,"Brooks, Tyson T. (55377952200)",10.4018/978-1-6684-7766-3,https://www.scopus.com/inward/record.uri?eid=2-s2.0-85157962996&doi=10.4018%2f978-1-6684-7766-3&partnerID=40&md5=7a2d1c555f47a29f48c7515a4e0e8b74,2023,Book,Cyber-professionals recognize that some defensive measures could exacerbate cyber-defense challenges by motivating attackers to adapt-unintentionally inspiring attackers to develop more potent and...,Scopus,Adaptive Security and Cyber Assurance for Risk-Based Decision Making
1488,1489,Autoencoder-Based Collaborative Attention GAN for Multi-Modal Image Synthesis,"Cao, Bing (57204475892); Cao, Haifang (58281282700); Liu, Jiaxu (58280598400); Zhu, Pengfei (35779388800); Zhang, Changqing (56313466500); Hu, Qinghua (7403214664)",10.1109/TMM.2023.3274990,https://www.scopus.com/inward/record.uri?eid=2-s2.0-85159812209&doi=10.1109%2fTMM.2023.3274990&partnerID=40&md5=178f2c5e515d502c9da0fae104bc6329,2023,Article,"Multi-modal images are required in a wide range of practical scenarios, from clinical diagnosis to public security. However, certain modalities may be incomplete or unavailable because of the rest...",Scopus,IEEE Transactions on Multimedia
1490,1491,Deep multimodal representation learning for generalizable person re-identification,"Xiang, Suncheng (57193625126); Chen, Hao (57218309973); Ran, Wei (57218602527); Yu, Zefang (57216317706); Liu, Ting (55727716700); Qian, Dahong (57188691661); Fu, Yuzhuo (21933259100)",10.1007/s10994-023-06352-7,https://www.scopus.com/inward/record.uri?eid=2-s2.0-85164196516&doi=10.1007%2fs10994-023-06352-7&partnerID=40&md5=3aa8fbcc957108d878d76d78294f3ca2,2023,Article,"Person re-identification plays a significant role in realistic scenarios due to its various applications in public security and video surveillance. Recently, leveraging the supervised or semi-unsu...",Scopus,Machine Learning
1509,1510,State Identification of Power System Based on Visual Geometric Group Network,"Yang, Jing (57219210946); Meng, Runquan (35220273600)",10.1088/1742-6596/2527/1/012081,https://www.scopus.com/inward/record.uri?eid=2-s2.0-85166477317&doi=10.1088%2f1742-6596%2f2527%2f1%2f012081&partnerID=40&md5=516b689de99ea0fff36974bf644dfbfb,2023,Conference paper,Accurate and timely identification of power system operation states are requisite for taking control strategies and ensuring power system security. With the high grid penetration of renewable ener...,Scopus,Journal of Physics: Conference Series
1544,1545,Evaluation and Adjustment Based on Broad Learning System for Small Signal Stability Analysis of Power System Integrated with Wind Farms,"Yang, Yu-De (24177885600); Yao, Wen-Jing (57701770200); Yang, Li-Zhen (57479163300)",10.1007/s42835-022-01111-5,https://www.scopus.com/inward/record.uri?eid=2-s2.0-85130460010&doi=10.1007%2fs42835-022-01111-5&partnerID=40&md5=5b43f1a4c18f9db3ec8ca5044a65aeab,2022,Article,This paper primarily focuses on evaluation and adjustment methods for small signal analysis with wind farm integration. The connection of wind farms may affect the original oscillation modes of th...,Scopus,Journal of Electrical Engineering and Technology
1673,1674,Observer-Based Adaptive Security Control for Network Control Systems Under TDS Actuator Attacks,"Wang, Liang (57983000200); Zhao, Ping (57220868596)",10.1007/978-981-19-6142-7_38,https://www.scopus.com/inward/record.uri?eid=2-s2.0-85142667756&doi=10.1007%2f978-981-19-6142-7_38&partnerID=40&md5=fd722b9d89271baa6da7f2bbd932b39b,2022,Conference paper,"Networked control systems (NCS) have been used widely in many practical fields. The communication connection in NCS allows agents to communicate with each other quickly, which can quickly respond ...",Scopus,Communications in Computer and Information Science
1700,1701,CONDITIONAL RGB-T FUSION FOR EFFECTIVE CROWD COUNTING,"Pahwa, Esha (57417427200); Kapadia, Sanjeet (57417383600); Luthra, Achleshwar (57345945500); Sheeranali, Shreyas (58073761500)",10.1109/ICIP46576.2022.9897548,https://www.scopus.com/inward/record.uri?eid=2-s2.0-85146657719&doi=10.1109%2fICIP46576.2022.9897548&partnerID=40&md5=14a734acd52a1b6f12f13941b1348523,2022,Conference paper,"A robust and efficient crowd counting framework forms a vital step towards the analysis of a crowded scene and finds its applications in social distance monitoring, traffic management, and video s...",Scopus,"Proceedings - International Conference on Image Processing, ICIP"
1711,1712,State Estimation of Intelligent Distribution Network Based on Data Fusion,"Li, Daoyu (57477490900); Sun, Yuanyuan (55737770800); Yuan, Lintao (57477490800); Wang, Chao (57889981500); An, Peng (57210688960); Pang, Yanqing (57297103000)",10.1007/978-981-19-1922-0_43,https://www.scopus.com/inward/record.uri?eid=2-s2.0-85137998265&doi=10.1007%2f978-981-19-1922-0_43&partnerID=40&md5=361be5c115fe0fd4029232fd512e35c1,2022,Conference paper,Higher information processing needs have been brought about by the development of smart grids. In order to solve the problem that there are many types of existing intelligent measurement terminals...,Scopus,Lecture Notes in Electrical Engineering
1755,1756,The Application of Beidou and Ultra-Broadband Positioning Technology in the Power Security Protection System,"Yang, Yu-qing (57549259000); Miao, Wei-wei (57192541666); Zeng, Zeng (57876478700)",10.1007/978-981-19-0852-1_13,https://www.scopus.com/inward/record.uri?eid=2-s2.0-85127020452&doi=10.1007%2f978-981-19-0852-1_13&partnerID=40&md5=9fb15885f8fe05775248624e0e06c0e9,2022,Conference paper,"In the Beidou positioning system, due to the obstruction of obstacles, the indoor is often unable to obtain positioning information. For this case, a scheme based on Beidou indoor and outdoor inte...",Scopus,Communications in Computer and Information Science
1772,1773,Template security scheme for multimodal biometrics using data fusion technique,"Bokade, Gayatri U. (57215307258); Kanphade, Rajendra D. (24174635600)",10.1504/IJBM.2022.121801,https://www.scopus.com/inward/record.uri?eid=2-s2.0-85128743982&doi=10.1504%2fIJBM.2022.121801&partnerID=40&md5=c49d976c134dae7a29a5ca9fb2072d0f,2022,Article,The emerging demand of biometric technology across the globe has given rise to the development of various biometric systems involving multiple traits. The multimodal biometric authentication syste...,Scopus,International Journal of Biometrics
1838,1839,Enabling self-adaptability of small scale and large scale security systems using dynamic partial reconfiguration,"Manjith, B.C. (57204588175); Dhanalakshmi, R. (57207592243)",10.1007/s12652-020-02658-9,https://www.scopus.com/inward/record.uri?eid=2-s2.0-85096334533&doi=10.1007%2fs12652-020-02658-9&partnerID=40&md5=c54353705ed902ffa4ee6bce01749fb1,2021,Article,"The application areas of field programmable gate arrays (FPGAs) are increasing due to its hardware acceleration and reprogrammable features. From large-scale computation systems like cloud, aerosp...",Scopus,Journal of Ambient Intelligence and Humanized Computing
1861,1862,Continuous auditing and threat detection in multi-cloud infrastructure,"Torkura, K.A. (57188671884); Sukmana, Muhammad I.H. (57193575858); Cheng, Feng (35271162300); Meinel, Christoph (56187776800)",10.1016/j.cose.2020.102124,https://www.scopus.com/inward/record.uri?eid=2-s2.0-85098136177&doi=10.1016%2fj.cose.2020.102124&partnerID=40&md5=6e87bf564ea746518cc3c2419a72b9dd,2021,Article,Efficient change control and configuration management is imperative for addressing the emerging security threats in cloud infrastructure. These threats majorly exploit misconfiguration vulnerabili...,Scopus,Computers and Security
1951,1952,Multi-source Anomaly Detection in Distributed IT Systems,"Bogatinovski, Jasmin (57217014567); Nedelkoski, Sasho (57195837657)",10.1007/978-3-030-76352-7_22,https://www.scopus.com/inward/record.uri?eid=2-s2.0-85111402590&doi=10.1007%2f978-3-030-76352-7_22&partnerID=40&md5=89629ed2c30fdccb7cce29e815a23f24,2021,Conference paper,"The multi-source data generated by distributed systems, provide a holistic description of the system. Harnessing the joint distribution of the different modalities by a learning model can be benef...",Scopus,Lecture Notes in Computer Science (including subseries Lecture Notes in Artificial Intelligence and Lecture Notes in Bioinformatics)
1953,1954,Detecting Portable Executable Malware by Binary Code Using an Artificial Evolutionary Fuzzy LSTM Immune System,"Jiang, Jian (57224502024); Zhang, Fen (57226324595)",10.1155/2021/3578695,https://www.scopus.com/inward/record.uri?eid=2-s2.0-85111161221&doi=10.1155%2f2021%2f3578695&partnerID=40&md5=11f698c3f1ce62f39111dda1b6313f30,2021,Article,"As the planet watches in shock the evolution of the COVID-19 pandemic, new forms of sophisticated, versatile, and extremely difficult-to-detect malware expose society and especially the global eco...",Scopus,Security and Communication Networks
