,id,title,authors,doi,link,pub_year,type,abstract,source,pub_title
1989,1990,Multimodal self-assessed personality prediction in the wild,"Kamisaka, Daisuke (24331804600); Ishikawa, Yuichi (56824926900)",10.1145/3395035.3425260,https://www.scopus.com/inward/record.uri?eid=2-s2.0-85099195956&doi=10.1145%2f3395035.3425260&partnerID=40&md5=f3f0fe64b4885bd6ce67c930db438deb,2020,Conference paper,"Personality is an essential human attribute, and plays an important role for personalization of face-to-face services that improves sales and customer satisfaction in a variety of different busine...",Scopus,ICMI 2020 Companion - Companion Publication of the 2020 International Conference on Multimodal Interaction
2046,2047,An Adaptive Security Data Collection and Composition Recognition method for security measurement over LTE/LTE-A networks,"Fu, Yulong (57190983692); Chen, Hanlu (57192006982); Zheng, Qinghua (56113889000); Yan, Zheng (56517487500); Kantola, Raimo (6603838260); Jing, Xuyang (57192208722); Cao, Jin (55124800000); Li, Hu...",10.1016/j.jnca.2020.102549,https://www.scopus.com/inward/record.uri?eid=2-s2.0-85079237087&doi=10.1016%2fj.jnca.2020.102549&partnerID=40&md5=53f0c334437fe4c5230563484a1e233f,2020,Article,"With the development of wireless communications, Mobile Networks have become an important part of our daily life and fueled the growth of many attractive technologies such as 5G, Internet of Thing...",Scopus,Journal of Network and Computer Applications
2070,2071,Security-reliability tradeoff for multi-terminal multi-mode coexisting systems in the presence of multiple eavesdroppers,"Ding, Xiaojin (57188965800); Ding, Fei (35217477600); Chen, Xiaoshu (57203885369); Wang, Xiaojun (57826453500)",10.1049/iet-com.2019.0117,https://www.scopus.com/inward/record.uri?eid=2-s2.0-85084933231&doi=10.1049%2fiet-com.2019.0117&partnerID=40&md5=030cc6f579ea1f9ea7f9f4397e31f08a,2020,Article,"In this study, the authors explore a wireless network consisting of multiple smart terminals relying on multi-mode in the presence of an eavesdropper, where the eavesdropper may be deployed to wir...",Scopus,IET Communications
2182,2183,A robust single-sensor face and iris biometric identification system based on multimodal feature extraction network,"Luo, Zhengding (57215531996); Gu, Qinghua (57215532794); Qi, Gege (57215535895); Liu, Song (57215534919); Zhu, Yuesheng (55453293800); Bai, Zhiqiang (54582152200)",10.1109/ICTAI.2019.00-95,https://www.scopus.com/inward/record.uri?eid=2-s2.0-85081092274&doi=10.1109%2fICTAI.2019.00-95&partnerID=40&md5=d616685c2f961242d37e44568b63e35c,2019,Conference paper,"Joint face-iris identification can integrate complementary information from face and iris to fulfill the requirement of performance improvement and security. However, most of the current face-iris...",Scopus,"Proceedings - International Conference on Tools with Artificial Intelligence, ICTAI"
2186,2187,Multi-modal multi-layer fusion network with average binary center loss for face anti-spoofing,"Kuang, Huafeng (57215280616); Ji, Rongrong (23134935200); Liu, Hong (57192389201); Zhang, Shengchuan (56647102100); Sun, Xiaoshuai (24278895900); Zhang, Baochang (55791583300); Huang, Feiyue (5645...",10.1145/3343031.3351001,https://www.scopus.com/inward/record.uri?eid=2-s2.0-85074865538&doi=10.1145%2f3343031.3351001&partnerID=40&md5=83fb2d993be7a789cf1b2396ba0bd1c8,2019,Conference paper,"Face anti-spoofing detection is critical to guarantee the security of biometric face recognition systems. Despite extensive advances in facial anti-spoofing based on single-model image, little wor...",Scopus,MM 2019 - Proceedings of the 27th ACM International Conference on Multimedia
2226,2227,Adaptively secure anonymous identity-based broadcast encryption for data access control in cloud storage service,"Chen, Liqing (23767050700); Li, Jiguo (26661714200); Zhang, Yichen (7601317493)",10.3837/tiis.2019.03.023,https://www.scopus.com/inward/record.uri?eid=2-s2.0-85065575241&doi=10.3837%2ftiis.2019.03.023&partnerID=40&md5=2976e6206b3c3173a08df976fc2132b5,2019,Article,Cloud computing is now a widespread and economical option when data owners need to outsource or share their data. Designing secure and efficient data access control mechanism is one of the most ch...,Scopus,KSII Transactions on Internet and Information Systems
2262,2263,Understanding the Evolution of Ransomware: Paradigm Shifts in Attack Structures,"Zimba, Aaron (57193826183); Chishimba, Mumbi (57203412062)",10.5815/ijcnis.2019.01.03,https://www.scopus.com/inward/record.uri?eid=2-s2.0-85084748060&doi=10.5815%2fijcnis.2019.01.03&partnerID=40&md5=56542e89ad848e6b02af6ca52517cf03,2019,Article,The devasting effects of ransomware have continued to grow over the past two decades which have seen ransomware shift from just being opportunistic attacks to carefully orchestrated attacks. Indiv...,Scopus,International Journal of Computer Network and Information Security
2320,2321,Multimodal biometrics system using feature-level fusion of iris and fingerprint,"Khoo, Yik-Herng (57204671574); Goi, Bok-Min (6508137561); Chai, Tong-Yuen (40661042200); Lai, Yen-Lung (57188928420); Jin, Zhe (8563659400)",10.1145/3239576.3239599,https://www.scopus.com/inward/record.uri?eid=2-s2.0-85056614609&doi=10.1145%2f3239576.3239599&partnerID=40&md5=dee9d8f22a466ab181230fd3afadce4f,2018,Conference paper,"Biometrics system had been widely implemented in our daily life applications. With continuous improvement in biometrics recognition performance, biometrics security hence becomes an important topi...",Scopus,ACM International Conference Proceeding Series
2334,2335,A Progressive Vehicle Search System for Video Surveillance Networks,"Liu, Xinchen (56431458100); Liu, Wu (55145372400); Ma, Huadong (7403096223); Li, Shuangqun (57192989695)",10.1109/BigMM.2018.8499096,https://www.scopus.com/inward/record.uri?eid=2-s2.0-85057106411&doi=10.1109%2fBigMM.2018.8499096&partnerID=40&md5=20c3ada5e7e58701c6f669a35a94fd48,2018,Conference paper,"Vehicle search aims to find a specific vehicle appeared in the physical world through surveillance networks. Existing systems usually exploit attributes, like colors and types, or license plate nu...",Scopus,"2018 IEEE 4th International Conference on Multimedia Big Data, BigMM 2018"
2385,2386,"Multimodal Biometric Authentication Algorithm Using Iris, Palm Print, Face and Signature with Encoded DWT","Sujatha, E. (57196457623); Chilambuchelvan, A. (14631498800)",10.1007/s11277-017-5034-1,https://www.scopus.com/inward/record.uri?eid=2-s2.0-85033382978&doi=10.1007%2fs11277-017-5034-1&partnerID=40&md5=00fe89662ba9f28859933379d776ab36,2018,Article,"A multimodal biometric system is applied to recognize individuals as authentication, identification and verification for claimed identity. Multimodal biometrics increases the security level accura...",Scopus,Wireless Personal Communications
2388,2389,Cryptographic key generation from multimodal template using fuzzy extractor,"Kaur, Taranpreet (57213122556); Kaur, Manvjeet (56045999600)",10.1109/IC3.2017.8284321,https://www.scopus.com/inward/record.uri?eid=2-s2.0-85046346676&doi=10.1109%2fIC3.2017.8284321&partnerID=40&md5=c35917f696cf162feee3b927e99c9271,2018,Conference paper,"The encryption techniques, biometrics and cryptography integrate to form biometric cryptosystems. These are designed either to bind a cryptographic key or to generate cryptographic key using biome...",Scopus,"2017 10th International Conference on Contemporary Computing, IC3 2017"
2413,2414,Virtual teach pendant interface for android cellphones (VTPAC),"Ferri, Giulia A. (57205502343); Walter, Scott E. (57205501206); Tennakoon, Asiri (57205507876); Djuric, Ana M. (55178652700)",10.1115/IMECE2018-86865,https://www.scopus.com/inward/record.uri?eid=2-s2.0-85060312054&doi=10.1115%2fIMECE2018-86865&partnerID=40&md5=3ce3ad00d018fe211adbe9a58cf9119a,2018,Conference paper,The objective of this research is to develop a Virtual Teach Pendant for Android Cellphones (VTPAC) that is able to communicate with the robot model in the Visual Components software [11 [2]. The ...,Scopus,"ASME International Mechanical Engineering Congress and Exposition, Proceedings (IMECE)"
2472,2473,Person tracking association using multi-modal systems,"Belmonte-Hernandez, A. (57194728886); Solachidis, V. (6603350936); Theodoridis, T. (57197852284); Hernandez-Penaloza, G. (42261720800); Conti, G. (57213412858); Vretos, N. (13408103200); Alvarez, ...",10.1109/AVSS.2017.8078529,https://www.scopus.com/inward/record.uri?eid=2-s2.0-85039924064&doi=10.1109%2fAVSS.2017.8078529&partnerID=40&md5=604498d52497262d0027c70a2c2fe3e7,2017,Conference paper,"In this paper, a novel multi-modal method for person identification in indoor environments is presented. This approach relies on matching the skeletons detected by a Kinect v2 device with wearable...",Scopus,"2017 14th IEEE International Conference on Advanced Video and Signal Based Surveillance, AVSS 2017"
2485,2486,Voltage Security Assessment by Using PFDT and CBR Methods in Emerging Power System,"Nandanwar, S.R. (57192422301); Kolhe, M.L. (55370084800); Warkad, S.B. (55180689200); Patidar, N.P. (15924117500); Singh, V.K. (56074953000)",10.1016/j.egypro.2018.06.023,https://www.scopus.com/inward/record.uri?eid=2-s2.0-85051318868&doi=10.1016%2fj.egypro.2018.06.023&partnerID=40&md5=ef5bd38814c486aee4477a13c22b728d,2018,Conference paper,This paper exhibits varied methods for voltage security assessment in a restructured power system. This paper primarily lays emphasis on two methods that are Probabilistic Fuzzy Decision Tree (PFD...,Scopus,Energy Procedia
2628,2629,Managing intellectual property in a music fruition environment,"Barate, Adriano (14031183900); Haus, Goffredo (8684305900); Ludovico, Luca A. (8684305800); Perlasca, Paolo (6508116272)",10.1109/MMUL.2015.92,https://www.scopus.com/inward/record.uri?eid=2-s2.0-84969677913&doi=10.1109%2fMMUL.2015.92&partnerID=40&md5=21fbbca9d19369ad90fdaf224a47c6db,2016,Article,"With the advent of the digital age and the spread of portable digital audio players, interest in software and hardware tools that can help producers and distributors enhance and revive their catal...",Scopus,IEEE Multimedia
2641,2642,Multimodal biometrics for improvised security,"Arora, Garima (57191037120); Pavani, P. Lakshmi (57191033976); Kohli, Rashi (56828926500); Bibhu, Vimal (56521523700)",10.1109/ICICCS.2016.7542312,https://www.scopus.com/inward/record.uri?eid=2-s2.0-84985946721&doi=10.1109%2fICICCS.2016.7542312&partnerID=40&md5=28f4c63c4f97b2b8fd10177255a98b52,2016,Conference paper,"Biometrics simply means to recognise a person based on his behavioural or physiological characteristics. With this, we can establish an individual on the basis of who the person is, rather than wh...",Scopus,"2016 1st International Conference on Innovation and Challenges in Cyber Security, ICICCS 2016"
2708,2709,"The first large area, high X-ray energy phase contrast prototype for enhanced detection of threat object in baggage screening","Astolfo, Alberto (55985279700); Endrizzi, Marco (35067989100); Price, Benjamin (15069830500); Haig, Ian (56024784800); Olivo, Alessandro (7004072469)",10.1117/12.2239556,https://www.scopus.com/inward/record.uri?eid=2-s2.0-85008229667&doi=10.1117%2f12.2239556&partnerID=40&md5=50120018452a20c250bc3b735e231a59,2016,Conference paper,X-ray imaging is the most commonly used method in baggage screening. Conventional x-ray attenuation (usually in dual-energy mode) is exploited to discriminate threat and non-Threat materials: This...,Scopus,Proceedings of SPIE - The International Society for Optical Engineering
2737,2738,Multimodal Fingerprint Spoof Detection Using White Light,"Balaji, Aadhithya (58349040000); Varun, H.S. (57191280463); Sikha, O.K. (55437853400)",10.1016/j.procs.2016.02.066,https://www.scopus.com/inward/record.uri?eid=2-s2.0-84988663714&doi=10.1016%2fj.procs.2016.02.066&partnerID=40&md5=2ea2c8c09427b77965a5ac8b4aaade9e,2016,Conference paper,"Advancement in technology has increased the need to provide adequate security. Hence came the first security system using passwords, these systems have evolved and started using biometrics traits ...",Scopus,Procedia Computer Science
2814,2815,Hand based multibiometric authentication using local feature extraction,"Bhaskar, Bhagya (57212754453); Veluchamy, S. (6506644033)",10.1109/ICRTIT.2014.6996136,https://www.scopus.com/inward/record.uri?eid=2-s2.0-84921047418&doi=10.1109%2fICRTIT.2014.6996136&partnerID=40&md5=8e107e05bc8cb8e85ce8285ce286bc11,2014,Conference paper,"Biometrics has wide applications in the fields of security and privacy. Since unimodal biometrics are subjected to various problems regarding recognition and security, multimodal biometrics have b...",Scopus,"2014 International Conference on Recent Trends in Information Technology, ICRTIT 2014"
2902,2903,Novel mixture model-based approaches for person verification using multimodal biometrics,"Raghavendra, R. (57218667948)",10.1007/s11760-012-0294-4,https://www.scopus.com/inward/record.uri?eid=2-s2.0-84881544631&doi=10.1007%2fs11760-012-0294-4&partnerID=40&md5=22b8fcfbcb5e577fc4884934a22b20e7,2013,Article,"With growing concerns about security, the world over, biometric-based person verification is gaining more and more attention. Recently, multimodal biometric has attracted increasing focus among re...",Scopus,"Signal, Image and Video Processing"
2940,2941,"The integration of diversely redundant designs, dynamic system models, and state estimation technology to the cyber security of physical systems","Horowitz, Barry M. (7101607874); Pierce, Katherine M. (55539605400)",10.1002/sys.21239,https://www.scopus.com/inward/record.uri?eid=2-s2.0-84886097175&doi=10.1002%2fsys.21239&partnerID=40&md5=1cb38bd72fb7f27bbb8b0194cd7ac9a7,2013,Article,"As exemplified in the 2010 Stuxnet attack on Iranian nuclear facilities, cyber attackers have capabilities to embed disruptive infections into equipment that is employed within physical systems. T...",Scopus,Systems Engineering
2974,2975,Approach to security attack pattern networks on the basis of bayesian networks,"Xu, Chao (56547706400); Xu, Guangquan (22981884000); Li, Xiaohong (57022407900); Feng, Zhiyong (56984876600); Meng, Zhaopeng (7201894900)",10.12785/amis/071L32,https://www.scopus.com/inward/record.uri?eid=2-s2.0-84896819676&doi=10.12785%2famis%2f071L32&partnerID=40&md5=2b132efd6003bb9ddff51639dbc7e15c,2013,Article,Researchers are becoming more and more interested in the security issues of software engineering. It will effectively reduce the cost of development and maintenance in order to detect and predict ...,Scopus,Applied Mathematics and Information Sciences
2990,2991,Multi-view multi-modal gait based human identity recognition from surveillance videos,"Hossain, Emdad (36473316000); Chetty, Girija (14008859700); Goecke, Roland (22234389600)",10.1007/978-3-642-37081-6_11,https://www.scopus.com/inward/record.uri?eid=2-s2.0-84875185983&doi=10.1007%2f978-3-642-37081-6_11&partnerID=40&md5=31d0c98fa7c85e0502808815b22f802c,2013,Conference paper,"In this paper we propose a novel human-identification scheme from long range gait profiles in surveillance videos. We investigate the role of multi view gait images acquired from multiple cameras,...",Scopus,Lecture Notes in Computer Science (including subseries Lecture Notes in Artificial Intelligence and Lecture Notes in Bioinformatics)
2994,2995,Normalizing Cross-Border Healthcare in Europe via New E-Prescription Paradigms,"Berler, Alexander (6602221253); Apostolakis, Ioannis (23988724600)",10.4018/978-1-4666-4321-5.ch011,https://www.scopus.com/inward/record.uri?eid=2-s2.0-84937473562&doi=10.4018%2f978-1-4666-4321-5.ch011&partnerID=40&md5=0cd6e339c386e9bdd6605a5262333d04,2013,Book chapter,The 21st century started with some significant efforts globally in the e-health sector. This was mainly pushed as a generic strategy from many nations and international organizations in order to c...,Scopus,Research Perspectives on the Role of Informatics in Health Policy and Management
3036,3037,A robust multimodal biometric security system using the polynomial curve technique within Shamir's secret sharing algorithm,"Aldosary, Saad (57216820874); Howells, Gareth (35565062100)",10.1109/EST.2012.9,https://www.scopus.com/inward/record.uri?eid=2-s2.0-84869457056&doi=10.1109%2fEST.2012.9&partnerID=40&md5=31acd438125f356b405b8d9b656d3745,2012,Conference paper,"This paper investigates the application of secret sharing technology to allow an encryption key to be derived from multimodal biometric samples. Within the proposed scheme, individual points on a ...",Scopus,"Proceedings - 3rd International Conference on Emerging Security Technologies, EST 2012"
3096,3097,Visual cryptography for MMBS of wireless images for ATM banking,"Koteswari, S. (56373648800); John Paul, P. (57198177603); Indrani, S. (56373860600)",10.1049/cp.2012.2539,https://www.scopus.com/inward/record.uri?eid=2-s2.0-84907521758&doi=10.1049%2fcp.2012.2539&partnerID=40&md5=4c62174029d6cb852a55c5cc29b25cdd,2012,Conference paper,"Security plays a very important role in one's life. Due to the limitations imposed by real time applications, its very challenging deal to get the accurate identification of the person to access s...",Scopus,IET Conference Publications
3098,3099,Vitality detection from biometrics: State-of-the-art,"Singh, Yogendra Narain (56237029000); Singh, Sanjay Kumar (57413852300)",10.1109/WICT.2011.6141226,https://www.scopus.com/inward/record.uri?eid=2-s2.0-84863136569&doi=10.1109%2fWICT.2011.6141226&partnerID=40&md5=a504c2e8300e52e7fd93931abc447324,2011,Conference paper,"Biometric authentication systems have become the basis of trust to human society from the beginning of last decade, but the security of the system can be breached by presenting a non-live or fake ...",Scopus,"Proceedings of the 2011 World Congress on Information and Communication Technologies, WICT 2011"
3132,3133,Cooperative neural network background model for multi-modal video surveillance,"Wang, Zhiming (7410039211); Hong, Bao (57206299568)",10.1109/CIS.2011.63,https://www.scopus.com/inward/record.uri?eid=2-s2.0-84863077062&doi=10.1109%2fCIS.2011.63&partnerID=40&md5=f700d78ad47deac434fe4ee3d9374b3f,2011,Conference paper,"This paper proposed a new cooperative background model for multi-modal video surveillance based on probability neural network (PNN). Firstly, probability of being foreground was estimated in visib...",Scopus,"Proceedings - 2011 7th International Conference on Computational Intelligence and Security, CIS 2011"
3135,3136,User-friendly security robots,"Randelli, Gabriele (34267805500); Iocchi, Luca (6602922345); Nardi, Daniele (7006582655)",10.1109/SSRR.2011.6106788,https://www.scopus.com/inward/record.uri?eid=2-s2.0-84855835559&doi=10.1109%2fSSRR.2011.6106788&partnerID=40&md5=280babdcfa3bf66d95a23d3d770525ac,2011,Conference paper,"Robotic systems are today capable of performing patrolling and surveillance tasks in indoor structured environments. However, they need to be designed by taking into account the operational enviro...",Scopus,"9th IEEE International Symposium on Safety, Security, and Rescue Robotics, SSRR 2011"
3191,3192,Attack against robust watermarking-based multimodal biometric recognition systems,"Hämmerle-Uhl, Jutta (25421752000); Raab, Karl (36237179800); Uhl, Andreas (7005841206)",10.1007/978-3-642-19530-3_3,https://www.scopus.com/inward/record.uri?eid=2-s2.0-79952912965&doi=10.1007%2f978-3-642-19530-3_3&partnerID=40&md5=98862f6f49dedbb1e4162ae179746208,2011,Conference paper,Several multimodal biometric schemes have been suggested in literature which employ robust watermarking in order to embed biometric template data into biometric sample data. In case robust embeddi...,Scopus,Lecture Notes in Computer Science (including subseries Lecture Notes in Artificial Intelligence and Lecture Notes in Bioinformatics)
3246,3247,New fully functioning digital hologram recording system and its applications,"Kang, Der-Kuan (7402889460); Alcaraz Rivera, Miguel (15830931600); Báez-Rojas, José J. (55989692200); Cruz-López, María-Luisa (57783764700)",10.1117/1.3497068,https://www.scopus.com/inward/record.uri?eid=2-s2.0-80051760211&doi=10.1117%2f1.3497068&partnerID=40&md5=37cb596ff58eb1b7e150c2a3de8e812c,2010,Article,"We propose a low-cost optical system that is able to simply generate computer-generated holograms and rainbow type and true-color Lippmann type holograms. In this system, a microimaging system is ...",Scopus,Optical Engineering
3252,3253,Integrating palmprint and fingerprint for identity verification,"Chin, Yong Jian (35241832300); Ong, Thian Song (55665240800); Goh, Michael K.O. (36117903000); Hiew, Bee Yan (16244988100)",10.1109/NSS.2009.25,https://www.scopus.com/inward/record.uri?eid=2-s2.0-72849137045&doi=10.1109%2fNSS.2009.25&partnerID=40&md5=a1c7c7ec197fd6bdd62ca3b57669d507,2009,Conference paper,"In this paper, we propose a multimodal biometrics system that combines fingerprint and palmprint features to overcome several limitations of unimodal biometrics - such as the inability to tolerate...",Scopus,NSS 2009 - Network and System Security
3263,3264,Enhancing DoDAF with a HCPN executable model to support validation,"Ni, Feng (35729312300); Wang, Ming-Zhe (56139174900); Liao, Jing-Jing (35757761400); Zhou, Jing-Dan (35758144900)",10.1109/ISCID.2009.217,https://www.scopus.com/inward/record.uri?eid=2-s2.0-77649333464&doi=10.1109%2fISCID.2009.217&partnerID=40&md5=d644b39ac63956ec69ba96bfa89b4ee2,2009,Conference paper,"Department of Defense Architecture Framework (DoDAF) as a common integrated system architecture specification has already gained the widespread acceptance in the world. However, the limitations of...",Scopus,ISCID 2009 - 2009 International Symposium on Computational Intelligence and Design
3266,3267,Safety analysis of helicopter models using timed automata hybrid systems,"Sutarto, H.Y. (17435994800); Megawati, N.Y. (35795741400); Salmah (25923560200); Suparwanto, A. (35796578500); Joelianto, E. (17434540100); Wijayanti, I.E. (16053675900); Budiyono, A. (26323497100...",10.1109/ICICI-BME.2009.5417220,https://www.scopus.com/inward/record.uri?eid=2-s2.0-77950944049&doi=10.1109%2fICICI-BME.2009.5417220&partnerID=40&md5=f899be165d8d54aff1a35510dfd9bd25,2009,Conference paper,"A mini scale helicopter poses complex dynamics and is difficult to control. Compared to its full size counterparts, the model of mini scale helicopter exhibits not only increased sensitivity to co...",Scopus,"International Conference on Instrumentation, Communication, Information Technology, and Biomedical Engineering 2009, ICICI-BME 2009"
3436,3437,On dynamic and concurrent model of web service components,"Zhu, Junwu (55704615100); Wang, Jiandong (55885593500); Li, Bin (36072005200)",10.1109/CSCWD.2007.4281498,https://www.scopus.com/inward/record.uri?eid=2-s2.0-47649129469&doi=10.1109%2fCSCWD.2007.4281498&partnerID=40&md5=0c20415dc9be94bd288f1ac3c39a8856,2007,Conference paper,"The current researches of Web service fasten on composition process, and are lack of the formalized description on dynamic attributes of service component itself. Aiming to these, a new dynamic an...",Scopus,"Proceedings of the 2007 11th International Conference on Computer Supported Cooperative Work in Design, CSCWD"
3445,3446,Voltage security assessment and optimal load shedding of power system using the case-based reasoning approach,"Patidar, N.P. (15924117500); Sharma, Jaydev (7402613473)",10.1504/IJRS.2008.020770,https://www.scopus.com/inward/record.uri?eid=2-s2.0-78651565424&doi=10.1504%2fIJRS.2008.020770&partnerID=40&md5=54fb05775d9841fea89990f4aa91af65,2008,Article,"This paper presents the case-based reasoning (CBR) technique, a novel approach for voltage security assessment and optimal load shedding plan in a real time environment. CBR extracts the informati...",Scopus,International Journal of Reliability and Safety
3458,3459,Incremental checkpointing with application to distributed discrete event simulation,"Feng, Thomas Huining (20435527100); Lee, Edward A. (7406967883)",10.1109/WSC.2006.323188,https://www.scopus.com/inward/record.uri?eid=2-s2.0-46149084477&doi=10.1109%2fWSC.2006.323188&partnerID=40&md5=2977afca03af57b9a73db99db63d2abc,2006,Conference paper,Checkpointing is widely used in robust fault-tolerant applications. We present an efficient incremental checkpointing mechanism. It requires to record only the state changes and not the complete s...,Scopus,Proceedings - Winter Simulation Conference
3470,3471,Finite state machine IP watermarking: A tutorial,"Abdel-Hamid, Amr T. (8532443100); Tahar, Sofiène (35584065000); Aboulhamid, El Mostapha (6701773664)",10.1109/AHS.2006.40,https://www.scopus.com/inward/record.uri?eid=2-s2.0-33845574341&doi=10.1109%2fAHS.2006.40&partnerID=40&md5=4cd11781ce90bc27866a1386dbb79cd8,2006,Conference paper,"Sharing Intellectual Property (IP) blocks In today's competitive market poses significant high security risks. In this paper, we present a tutorial for a watermarking approach based on the embeddi...",Scopus,"Proceedings - First NASA/ESA Conference on Adaptive Hardware and Systems, AHS 2006"
3630,3631,Denial of Service: An Example,"Needham, Roger M. (7005873732)",10.1145/188280.188294,https://www.scopus.com/inward/record.uri?eid=2-s2.0-0028532812&doi=10.1145%2f188280.188294&partnerID=40&md5=b712b50db2e4b6491db8d80d2ffa7a43,1994,Article,[No abstract available],Scopus,Communications of the ACM
