,id,title,authors,doi,link,pub_year,type,abstract,source,pub_title
3640,3641,Continuous variable quantum key distribution with multi-mode signals for noisy detectors,"Kumar R,Tang X,Wonfor A,Penty R,White I",10.1364/JOSAB.36.00B109,http://dx.doi.org/10.1364/JOSAB.36.00B109,2019,Journal Article,"This paper proposes a multi-mode Gaussian modulated continuous variable quantum key distribution (CV-QICD) scheme able to operate at high bandwidth despite using conventional noisy, coherent detec...",Web of Science,JOURNAL OF THE OPTICAL SOCIETY OF AMERICA B-OPTICAL PHYSICS
3666,3667,Interconnection networks: Architectural challenges for utility computing data centers,"Lysne O,Reinemo SA,Skeie T,Solheim AG,Sodring T,Huse LP,Johnsen BD",10.1109/MC.2008.391,http://dx.doi.org/10.1109/MC.2008.391,2008,Journal Article,"Although academic interest in computational grids may have peaked, it spawned awareness of a new operational mode for computational data centers, utility computing. In this mode, the system assign...",Web of Science,COMPUTER
3682,3683,Binary Tree Encryption with Constant-Size Public Key in the Standard Model,"Feng S,Gong J,Chen J",10.1093/comjnl/bxaa194,http://dx.doi.org/10.1093/comjnl/bxaa194,2022,Journal Article,"Binary tree encryption is an intriguing primitive that enables many practical applications to achieve an increasing important security feature, forward security. However, the public key size of ex...",Web of Science,COMPUTER JOURNAL
3719,3720,Blockchain based Secured Virtual Machine Image Monitor,"Basu S,Karmakar S,Bera D",10.5220/0010228804320439,http://dx.doi.org/10.5220/0010228804320439,2021,Conference Paper,"Blockchain technology supports data immutability. Whereas, smart contracts are piece of self-executable codes running inside the blockchain network, responsible for the transformation or state cha...",Web of Science,ICISSP: PROCEEDINGS OF THE 7TH INTERNATIONAL CONFERENCE ON INFORMATION SYSTEMS SECURITY AND PRIVACY
3775,3776,Principled Data-Driven Decision Support for Cyber-Forensic Investigations,"Atefi, Soodeh (57219493916); Panda, Sakshyam (57203006852); Panaousis, Emmanouil (34877407700); Laszka, Aron (57294198700)",,https://www.scopus.com/inward/record.uri?eid=2-s2.0-85167867971&partnerID=40&md5=7cc282d0b7bfbc64eceb94be8242497a,2023,Conference paper,"In the wake of a cybersecurity incident, it is crucial to promptly discover how the threat actors breached security in order to assess the impact of the incident and to develop and deploy counterm...",Scopus,"Proceedings of the 37th AAAI Conference on Artificial Intelligence, AAAI 2023"
3799,3800,A method of hidden faults opposition for FPGA-based components of safety-related systems,"Drozd, Oleksandr (55388226700); Romankevich, Vitaliy (57193263058); Romankevich, Alexei (6602114176); Kuznietsov, Mykola (56021496100); Drozd, Myroslav (56667174000)",,https://www.scopus.com/inward/record.uri?eid=2-s2.0-85085481021&partnerID=40&md5=03336e04fcda3685172cf7b272be8b50,2020,Conference paper,"The paper is devoted to the problem of hidden faults, which is inherent in safety-related systems aimed at ensuring the functional safety of high-risk facilities to counter accidents. The problem ...",Scopus,CEUR Workshop Proceedings
3888,3889,A formal downgrading policy framework for the secure sharing of mission sensitive data and services,"Skoutaris, Eleftherios (41262418600); Fischer, Daniel (56804364200); Engel, Thomas (17434157900)",,https://www.scopus.com/inward/record.uri?eid=2-s2.0-84901248170&partnerID=40&md5=897030643d2e627ad9bf4f6a25f21bfc,2014,Conference paper,"Formal specification and visual modeling languages are used to precisely describe a system's state or its evolving behavior (e.g., data computations specified as state-changes). In terms of securi...",Scopus,"13th International Conference on Space Operations, SpaceOps 2014"
4015,4016,Tests of robustness of GMM speaker verification in VoIP telephony,"Staroniewicz, Piotr (11142100200)",,https://www.scopus.com/inward/record.uri?eid=2-s2.0-39649086499&partnerID=40&md5=66e224bfd89811b573045fe884e4a83b,2007,Conference paper,The paper presents the scores of the GMM (Gaussian Mixture Models) based speaker verification system for speech signal transmitted in VoIP (Voice over IP) telephony conditions. The speaker verific...,Scopus,Archives of Acoustics
4052,4053,The formal modelling and verification of safety critical ATP software design,"Yan, F. (57198405519); Tang, T. (34973410200)",,https://www.scopus.com/inward/record.uri?eid=2-s2.0-84903388956&partnerID=40&md5=e4db63bdeb20e460010de7ebd23b4dd4,2005,Conference paper,The safety of software is becoming increasingly important as computers pervade control systems on which human life depends. This has become more complex and in rail transportation fields and the m...,Scopus,WIT Transactions on the Built Environment
4068,4069,Monotonicity and partial results protection for mobile agents,"Yee, Bennet (7006955686)",,https://www.scopus.com/inward/record.uri?eid=2-s2.0-0038305265&partnerID=40&md5=aac9d90037194cc1212e2f3d3671f4c6,2003,Conference paper,"Remotely executing mobile code introduces a plethora of security problems. This paper examines the ""external agent replay"" attack, identifies the notion of one-way program state transitions, descr...",Scopus,Proceedings - International Conference on Distributed Computing Systems
4077,4078,International aerial robotics competition 2004,"Holifield, Nicholas (8601590300); Lallinger, Justin (8886003800); Underwood, Garrett (8601590200)",,https://www.scopus.com/inward/record.uri?eid=2-s2.0-21644463723&partnerID=40&md5=c9682d46829a0ace506312a3729a3a58,2004,Conference paper,The University of Texas at Austin IEEE Robot Team has prepared an entry to the 2004 International Aerial Robotics Competition. The team aims to demonstrate autonomous forward flight and navigation...,Scopus,AUVSI's Unmanned Systems North America 2004 - Proceedings
4142,4143,Power Consumption Aware Software Architecture for M-Health Applications with Adaptive Security of Network Protocols,"Ciric V,Zlatanovic J,Milovanovic E,Stojanovic N",,,2015,Conference Paper,"The goal of this paper is development of software architecture for mobile devices, which is able to trade-off between security levels and power consumption. The analysis of the influence of differ...",Web of Science,"2015 12TH INTERNATIONAL CONFERENCE ON TELECOMMUNICATIONS IN MODERN SATELLITE, CABLE AND BROADCASTING SERVICES (TELSIKS)"
4147,4148,Security Policy Transition Framework for Software Defined Networks,"Cox Jr JH,Clark RJ,Owen HL",,,2016,Conference Paper,Controllers for software defined networks (SDNs) are quickly maturing to offer network operators more intuitive programming frameworks and greater abstractions for network application development....,Web of Science,2016 IEEE CONFERENCE ON NETWORK FUNCTION VIRTUALIZATION AND SOFTWARE DEFINED NETWORKS (NFV-SDN)
4150,4151,Research on Measures for Computer Application System Security Technology Strengthening,Xi G,,,2016,Conference Paper,"With the continuous development of science and technology, in particular of information technology, network information technology is applied in daily production and life more and more widely, and...",Web of Science,"PROCEEDINGS OF THE 2016 6TH INTERNATIONAL CONFERENCE ON MACHINERY, MATERIALS, ENVIRONMENT, BIOTECHNOLOGY AND COMPUTER (MMEBC)"
4302,4303,TCP-Fuzz: Detecting Memory and Semantic Bugs in TCP Stacks with Fuzzing,"Zou YH,Bai JJ,Zhou J,Tan J,Qin C,Hu SM",,,2021,Conference Paper,"TCP stacks provide reliable data transmission in network, and thus they should be correctly implemented and well tested to ensure reliability and security. However, testing TCP stacks is difficult...",Web of Science,PROCEEDINGS OF THE 2021 USENIX ANNUAL TECHNICAL CONFERENCE
4324,4325,Formal Specification and Verification of wireless networked self-organized Systems on Chip,"Daoud H,Tanougast C,Belarbi M,Heil M",,,2014,Conference Paper,"Communication in networked systems must be reliable during run time data exchanges. Therefore, their specifications and designs must be clear, understandable and follow specific rules. Indeed, the...",Web of Science,"2014 INTERNATIONAL CONFERENCE ON CONTROL, DECISION AND INFORMATION TECHNOLOGIES (CODIT)"
