id,title,abstract
1175,Applying of component system development in object methodology,"In the last three decades, the concept and implementation of component-based architectures have been promoted in software systems creation. Increasingly complex demands are placed on the software component systems, in particular relating to the dynamic properties. The emergence of such requirements has been gradually enforced by the practice of development and implementation of these systems, especially for information systems software. Just the information systems (robust IS) of different types require that target software meets their requirements. Among other things, we mean primarily the adaptive processes of different domains, high distributives due to the possibilities of the Internet 2.0, acceptance of high integrity of life domains (process, data and communications integrity), scalability, and flexible adaptation to process changes, a good context for external devices and transparent structure of the sub-process modules and architectural units. Of course, the target software of required qualities and the type robust cannot be a monolith. As commonly known, development of design toward information systems software has clearly come to the need for the software composition of completely autonomous, but cooperating architectural units that communicate with each other using messages of prescribed formats. Although for such units there were often used the so called subsystems and modules, see (Jac, Boo, Rumbo, 1998) and (Arlo, Neus, 2007), their abstraction being gradually enacted as the term component. In other words, the subsystems and modules are specific types of components. In (Kral, Žeml, 2000) and (Kral, Žeml, 2003) there are considered two types of target software of information systems. The first type - there are SWC (Software Components), composed of permanently available components, which are thought as services - Confederate software. The second type - SWA (Software Alliance), called semi Confederate, formed during the run-time of the software system and referred to as software alliance. In both of these mentioned publications there is delivered deep philosophy of relevant issues relating to SWC /SWA as creating copies of components (cloning), the establishment and destruction of components at software run-time (dynamic reconfiguration), cooperation of autonomous components, programmable management of components interface in depending on internal components functionality and customer requirements (functionality, security, versioning). Nevertheless, even today we can meet numerous cases of SWC /SWA existence, with a highly developed architecture that is accepting vast majority of these requests. On the other hand, in the development practice of component-based systems with a dynamic architecture (i.e. architecture with dynamic reconfiguration), and finally with a mobile architecture (i.e. architecture with dynamic component mobility) confirms the inadequacy of the design methods contained in UML 2.0. It proves especially the dissertation thesis (Rych, Weis, 2008). Software Engineering currently has two different approaches to systems SWC /SWA. The first approach is known as component-oriented software development CBD (Component based Development). According to (Szyper, 2002) that is a collection of CBD methodologies that are heavily focused on the setting up and software components re-usability within the architecture. Although CBD does not show high theoretical approach, nevertheless, it is classified under the general evolution of SDP (Software Development Process), see (Sommer, 2010) as one of its two dominant directions. From a structural point of view, a software system consists of self-contained, interoperable architectural units - components based on well-defined interfaces. Classical procedural objectoriented methodologies significantly do not use the component meta-models, based on which the target component systems are formed, then. Component meta-models describe the syntax, semantics of components. They are a system of rules for components, connectors and configuration. Component meta-models for dynamic and mobile architectures also describe the concept of rules for configuration changes (rules for reconfiguration). As well-known meta-models are now considered: Wright for static architecture, SOFA and Darvin for dynamic architecture and SOFA 2.0 for mobile architecture, see (Rych, Weis, 2008). The CBD approach verbally defines the basic terms as component (primitive /composite), interface, component system, configuration, reconfiguration, logical (structural) view, process view (behavioral), static component architecture, dynamic architecture, mobile architecture (fully dynamic architecture), see (IEEE Report, 2000) and (Crnk, Chaud, 2006). The CBD approach also presents several ADL languages (Architecture Description Languages) which are able to describe software architecture. The known languages are integration ACME and UML (Unified Modeling Language), see (Garl, Mon, Wil, 2000) and (UNIFEM, 2005). The second approach to SWC /SWA systems is formed on SOA, but this article does not deal with it consistently. SOA is a philosophy of architecture. SOA is not a methodology for the comprehensive development of the target software. Nevertheless, SOA successfully filled the role of software design philosophy and on the other hand, also gave an important concept linking software components and their architectural units - business services. SOA understands any software as a Component System of a business service and solved life components in it. The physical implementation of components is given by a Web services platform. A certain lack of SOA is its weak link to the business processes that are a universally recognized platform for business activities and the source for the creation of enterprise services. This paper deals with a specific activity in the CBD, i.e. the integration of the concept of componentbased system into an advanced procedural, object-oriented methodology (Arlo, Neust, 2007), (Kan, Muller, 2005), ( Krutch, 2003) for problem domains with double-layer process logic. There is indicated an integration method, based on a certain meta-model (Applying of the Component system Development in object Methodology) and leading to the component system formation. The mentioned meta-model is divided into partial workflows that are located in different stages of a classic object process-based methodology. Into account there are taken the consistency of the input and output artifacts in working practices of the meta-model and mentioned object methodology. This paper focuses on static component systems that are starting to explore dynamic and mobile component systems. In addition, in the contribution the component system is understood as a specific system, for its system properties and basic terms notation being used a set and graph and system algebra."
1192,Multi-Modal Cooperative Intelligent Transport Systems to Improve Safety,"Population increases globally have put considerable strain on transport infrastructure and transport management resulting in large social, environmental and economic costs. Cooperative Intelligent Transport Systems (ITS), based on Information and Communication Technologies (ICT), can help focus on problems associated with traffic management, infrastructure management and security, as well as enhanced driver safety and logistics support for transport operations. It will improve drivers’ commutes, provide better information to city planners, increase the productivity of businesses and raise citizens’ quality of life, reduce congestion, shrink fuel use and cut CO2 emissions. This paper presents a multi-modal Cooperative Intelligent Transport Systems based solution that has been designed as a more efficient and effective approach to prevent and potentially eliminate collisions at rail/road crossings. Large scale field trials of the system at level crossing interfaces have produced promising outcomes is a major step towards improving safety at level crossings. © 2013, Springer International Publishing Switzerland."
1204,Information security management based on adaptive security policy using user behavior analysis,"This chapter presents a system for information security management based on adaptative security policy using user's behavior analysis in Information Technology. This system must be able to acquire information about the environment, space, time, equipment, hardware, and software. This information is used in the user behavior analysis. This work proposes that, based on the evidence of the user behavior, it is possible to trust or not trust the user. Levels of trust are released according to the user behavior and the rules that were previously established for the parameters, which help to establish the evidences of behavioral trust, interacting with the environment information, so as to keep trust levels updated in a more accurate and faithful way. © 2012, IGI Global."
1224,Specification-based intrusion detection system for WiBro,"WiBro (Wireless Broadband), the service based on the IEEE 802.16e (mobile WiMAX) standard, is a wireless broadband Internet technology developed by the South Korean telecommunications industry. In this paper, we analyze security vulnerabilities of the WiBro standard, focusing on the initial authentication phase and propose a specification-based intrusion detection system that can detect those vulnerabilities. We first derive specifications from the normal operational process of the initial authentication based on PKMv2 EAP-AKA and formalize the derived specifications as a state transition diagram. The proposed system executes the intrusion detection based on those specifications and the state transition diagram. In this paper, to verify the detection capability of the proposed system, we construct an experimental network and execute scenario-based tests. © 2011 Springer-Verlag."
1246,Context-awareness handoff planning in heterogeneous wireless networks,"This paper addresses a context-awareness handoff planning mechanism in heterogeneous wireless networks for seamless ubiquitous access. The proliferation of digital devices with communication capability heralds the era of ubiquitous computing, as predicted by Mark Weiser. Mobile devices with multi-mode interfaces can access heterogeneous wireless networks, such as wireless local area network (WLAN), worldwide interoperability for microwave access (WiMAX) network and third generation (3G) network. In heterogeneous wireless networks, different network provides different network capability, transmission range, data rate, access cost, security policy and quality of service. Therefore, a ubiquitous access aims to provide users intelligent human-centric context-aware handoff mechanism in heterogeneous wireless networks at anytime anywhere is gradually become an important issue. Optimal handoff planning in heterogeneous wireless networks considers the needs of users, accessing service and the surrounding context. However, most of existing handoff mechanisms only considered few contexts that lead to not able to select the most suitable network for individual user. In this paper, we propose a human-centric context-aware solution to access most appropriate network that satisfies individual user's requirement, fulfills seamless data transmission and reduces handoff delay. We develop two integrated approaches for context-awareness handoff planning mechanisms, namely MADM approach and GA approach. The MADM approach contains initial process and decision process. Initial process weights context by Analytic Hierarchy Process (AHP) method while decision process selects the most appropriate network by Technique for Order Preference by Similarity to Ideal Solution (TOPSIS). The GA approach uses Genetic Algorithm to minimize handoff under given QoS constraints. Performance of proposed mechanisms is evaluated under different services with different QoS considerations. Our simulation results show that both mechanisms are able to derive a proper network handoff plan which guarantees QoS requirements and reduces delay, jitter, and number of handoffs. © 2010 Springer-Verlag."
1261,Transition path analysis in status quo model,"Status quo model is a graphic model to help complete strategic conflict analysis, which display the players' moving path on different states. In this paper, a deep analysis about states transition path is studied, using Markov chain and conflict resolution technique. The concept of virtual player is introduced whose transition probability matrix is derived from individual player in conflict system. The average transition path is calculated to measure the cost for conflict resolution. Finally, a case study of public resource management strategy conflict is carried out to verify the proposed analysis approach. ©2009 IEEE."
1273,A RESTful approach to the management of cloud infrastructure,"Recently, REpresentational State Transfer (REST) has been proposed as an alternative architecture for Web services. In the era of Cloud and Web 2.0, many complex Web service-based systems such as e-Business and e-Government applications have adopted REST. Unfortunately, the REST approach has been applied to few cases in management systems, especially for a management system for cloud computing infrastructures. In this paper, we design and implement a RESTful Cloud Management System (CMS). Managed elements can be modelled as resources in REST and operations in existing systems can be evaluated using four methods of REST or a combination of them. We also show how components of existing management systems can be realized as REST-style Web services. © 2009 IEEE."
1311,Modeling of neural-network security tools for computer-aided systems: A formal model of adaptation and operation. I,"Basing on the biosystem analogy and model of adaptive security that uses intellectual mechanisms of neural networks and fuzzy logic, tools for security of information of computer-aided systems are organized in the form of hierarchy of security levels: immune (for operative reaction to the variation of threats) and receptor (for accumulated know-how in the form of information fields of neural networks). Tools for describing processes in information fields of neural networks by batch neural-network programs, i.e., a formal model of adaptation and operation of neural-network security tools. © 2008 MAIK Nauka."
1323,A label-based information flow control model for object-oriented systems,"This paper proposes a label-based information flow control model to prevent information leakage within object-oriented systems. It offers the features of: (a) adapting to dynamic object state change, (b) adapting to dynamic role change, (c) preventing indirect information leakage, (d) detailing the control granularity to variables, (e) allowing purpose-oriented method invocation, (f) controlling method invocation through argument sensitivity, (g) allowing declassification, and (h) allowing only trusted sources to write a variable. © 2007, Taylor & Francis Group, LLC."
1351,Software rejuvenation approach to security engineering,"While traditional security mechanisms rely on preventive controls and those are limited in surviving malicious attacks, we propose a novel approach to security engineering. The objective is to characterize the attacks in real time and survive in face of attacks by using software rejuvenation. In this paper we address the critical intrusion tolerance problems ahead of intrusion detection. Firstly, the attacks are characterized by applying Principle Component Analysis (PCA) and these characterized intrusions are analyzed according to their state changes by utilizing transient state analysis. Subsequently, the software rejuvenation methods are performed by killing the intruders' processes in their tracks, halting abuse before it happens, shutting down unauthorized connection, and responding and restarting in real time. These slogans will really frustrate and deter the attacks, as the attacker can't make their progress. This is a way of survivability to increase the deterrence level against an attack in the target environment. © Springer-Verlag Berlin Heidelberg 2004."
1363,Autonomic protection system using adaptive security policy,"There are various techniques to safeguard computer systems and networks against illegal actions. Secure OS based on Role Based Access Control (RBAC) is one of the systems that reflect these techniques. The RBAC system controls access to system resources based on roles. Recently, many systems employ more fine-grained access control on system resources to enhance system security. However, this approach in access control level may cause unexpected problems, since most systems acquire system resources through system call that is hooked on kernel. In this paper, we propose a novel approach to Intrusion Detection System (IDS). The proposed Autonomic Protection System (APS) supports fine-grained intrusion detection. It resides above Secure OS based on RBAC that provides general-grained access control. The system detects intrusions using security policy based on RBAC model. The system performs double checking for intrusions using positive and negative intrusion detection policy. Additionally, as one of active responses, the system supports the self-adaptation of security policy depending on various computing environments. Therefore, the system can detect intrusions more accurately and respond to the attacks actively and appropriately. © Springer-Verlag Berlin Heidelberg 2004."
1365,CAPSL integrated protocol environment,"CAPSL, a Common Authentication Protocol Specification Language, is a high-level language to support security analysis of cryptographic authentication and key distribution protocols. It is translated to CIL, an intermediate language expressing state transitions with term-rewriting rules. Connectors are being written to adapt CIL to supply input to different security analysis tools, including PVS for inductive verification and Maude for model-checking. © 2000 IEEE."
1366,A composable framework for secure multi-modal access to Internet services from post-PC devices,"The post-PC revolution is bringing information access to a wide-range of devices beyond the desktop, such as public kiosks, and mobile devices like cellular telephones, PDAs, and voice based vehicle telematics. However existing deployed Internet services are geared toward the secure rich interface of private desktop computers. We propose the use of an infrastructure-based secure proxy architecture to bridge the gap between the capabilities of post-PC devices and the requirements of Internet services. By combining generic content and security transformation functions with service-specific rules, the architecture decouples device capabilities from service requirements and simplifies the addition of new devices and services. Security and protocol specifics are abstracted into reusable components. Additionally, the architecture offers the novel ability to deal with untrusted public Internet access points by providing fine-grain control over the content and functionality exposed to the end device, as well as support for using trusted and untrusted devices in tandem. Adding support for a deployed Internet service requires a few hundred lines of scraping scripts. Similarly, adding support for a new device requires a few hundred lines of stylesheets for the device format. The average latency added by proxy transformations is around three seconds in our unoptimized Java implementation. © 2000 IEEE."
1377,State in Haskell,"Some algorithms make critical internal use of updatable state, even though their external specification is purely functional. Based on earlier work on monads, we present a way of securely encapsulating stateful computations that manipulate multiple, named, mutable objects, in the context of a non-strict, purely-functional language. The security of the encapsulation is assured by the type system, using parametricity. The same framework is also used to handle input/output operations (state changes on the external world) and calls to C. © 1995 Kluwer Academic Publishers."
1402,Blockchain based Secured Virtual Machine Image Monitor,"Blockchain technology supports data immutability. Whereas, smart contracts are piece of self-executable codes running inside the blockchain network, responsible for the transformation or state change of these data. Furthermore, Cloud Computing is used in the application of data storage and usage. Several business enterprises use cloud for hosting their applications and data with a minimized effort, cost and hurdles of maintenance. However, ensuring security of client data and proper management of the Service Provider's infrastructure remains a crucial issue. In this article, an Ethereum based blockchain network has been proposed that monitors and assures the safety of the VirtualMachine Images (VMI) stored at the Cloud Service Provider (CSP) end. The proposed scheme tends to design a dedicated Smart Contract which handles each and every function, starting from request of a VMI by the Cloud Service Consumer (CSC) to the usage of the same by the later. The use of blockchain technology ensures that no single admin/third party can control/modify the system. This prevents unwanted modification of the VMIs by an intruder and guarantees the efficiency of the scheme to be higher than any other methodology designed for the same purpose till date."
1404,Taxonomy of Cyber Threats,"Cyber threats span the attack cycle, and include both offensive and defensive elements. Several conceptual models help with describing the attack process and associated entities, in developing a taxonomy of cyber threats. For Example, the US National Institute of Standards and Technology (NIST) Cybersecurity Framework (CSF) helps to describe a system to manage cyber security risk. In addition, the Structured Threat Information Expression (STIX) and the Trusted Automated eXchange of Indicator Information (TAXII) are used to standardize indicator information into a form that will make the data sharable. This helps to structure the cyber threat intelligence (CTI) information in order to use it in defensive approaches (e.g., DREAD: damage/reproducibility/exploitability/affected users/discoverability; STRIDE: spoofing/tampering/repudiation/information disclosure/denial of service/elevation of privilege; CVSS: Common Vulnerability Scoring System) along with more advanced approaches that emulate offensive steps. Sharing cyber data is performed by government agencies (e.g., US Department of Homeland Security) along with information analysis centers (e.g., Multi-State Information Sharing and Analysis Center [MS-ISAC]). In addition to managing known threat data across an attack process, threat evaluation is performed via methodological evaluation of system-level vulnerabilities using model/architecture descriptions (e.g., system modeling language [SysML]) and rolling up developing threat descriptions through techniques like the US Department of Defense (DoD) Cyber Analytics Repository (DoDCAR)."
1427,Multi-modal and multi-sensor approach to support security management tasks,"Recent changes in the dynamic characteristics of security and emergency management requirements have a big impact on the development of more effective security systems. Innovative solutions have to provide support for new security challenges and newly developed operational strategies. Widely used security concepts based on video sensor solutions are being replaced by high-performance multi-sensor systems, which allow monitoring of outdoor areas with various sizes independent of lighting and weather conditions. Apart from the sensors used, the system effectiveness depends on innovative automatic data analysis including AI methods to enable generation of a comprehensive near real-time representation of a given situation. This work describes a concept and an experimental prototype of a self-sufficient, independent multi-sensor system for monitoring of critical personal behavior in the context of events, border area surveillance and critical infrastructure monitoring. The specific security scenarios were defined and worked out in detail in close cooperation with security experts. In order to ensure 24/7 operational capability, the work focuses on a flexible sensor platform concept and includes optical, thermal and radar sensors which are synergistically employed. Furthermore, innovative approaches to multi-sensor AI-based data analysis and web-based mobile information management solutions were developed as part of the nationally funded research project WatchDog to enable a targeted, scenario oriented support of the security forces. © 2019 by the authors."
