id,title,abstract
355,Performance Analysis of Lightweight Algorithm GIFT-COFB for 3-D Printer Security,"Secure lightweight algorithms have lately been proving their benefits and applications in resource-constrained environments. 3-D printers in a distributed network need security approval for their authentic and secure utilization. NIST round 2 algorithm GIFT-COFB and its primitive algorithm GIFT have been tested for their performance for STL files used in 3-D printers. GIFT-COFB is an Authenticated Encryption with Associated Data (AEAD) algorithm, an underlying scheme for which is the GIFT-128 lightweight block cipher. We analyze the power consumed, energy consumed and time taken by the algorithm for the encryption and decryption of a particular STL file. Then a comparison of state-of-the-art parameters of GIFT-COFB and GIFT is carried out to show the improvements we achieved by using the COFB lightweight AEAD operating mode. Analysis results show its worth in providing security to STL files. For further improvement in the system, signal processing can be applied."
358,Dynamic security regions of power systems,"A method for deriving dynamic security regions of power systems is developed. A power system operating state is defined to be dynamically secure with respect to a given disturbance if the system, starting in that state maintains transient stability after experiencing the disturbance. Specifically, these are regions of prefault angles such that the post-fault system is asymptotically stable. The proposed approach is to construct affine approximations to the nonlinearities in the transient stability model and then derive quadratic bounds on the errors between the nonlinearities and their approximation. These are then used to derive sufficient conditions for a polytope of operating states to be dynamically secure."
377,Threat modeling at run time: the case for reflective and adaptive threat management (NIER track),"Threat modeling is an analysis activity aimed at eliciting viable and realistic security and privacy threats in the design of a software-intensive system. Threat modeling allows for a by-design approach, mitigating problems before they arise and avoiding later costly development efforts. However, it mainly pays off in software construction approaches that rely on planned architectures, in which sources of threats can be anticipated beforehand. These axiomatic assumptions are, however, increasingly untrue in contemporary software development practices in which software systems evolve drastically in later stages. In addition, software-intensive systems are increasingly faced with uncertainty in their operational contexts, and these are nearly impossible to enumerate in early development stages. In this article, we first present the idea of reflective threat modeling, which involves the automated derivation of architectural system models from run-time and operational system artifacts, providing the threat modeler with an accurate and workable run-time inspection view of the system. We then outline and motivate the potential of adopting threat analysis models as a basis for holistic and adaptive threat management through integration of adaptive security and privacy technologies. This will enable systems to autonomously respond to emerging threats by dynamically activating dedicated controls or via run-time reconfiguration."
385,The method of selecting the operation modes of the multifunctional HF radio,"The article proposes the method for determining the operation modes of the multifunctional radio using the theory of fuzzy logic. The method takes into account the requirements for customers of various categories of importance. The method implements two ways of evaluating the effectiveness of each of the available operating modes of the radio. In the first case, the timely, credibility and security of information transmission on the specified radio route is evaluated. In the second case, the system supports decision-making based on the expert assessment is used. The method would be used for the development of an automated system decided to determine the operation modes of a multifunctional radio."
391,Intel case study: Software on demand,"This paper presents the application of the software as a service (SaaS) approach of software streaming. Streaming refers to downloading software to client hardware platforms for temporary local execution. OS and application software is managed from a centralized server and provided only on-demand. Users obtain a clean, consistent, current build each time they log in, removing the nuisance of security patching and rebooting for environmental changes. Local execution and caching preserves user experience comparable to traditionally installed applications. To explore feasibility, Intel conducted a proof-of-concept (POC) to evaluate streaming in its call center and manufacturing environments on multi-user systems. The four-part study included performance, usability, IT operations and total cost of ownership (TCO). The proof-of-concept was successful in identifying streaming as a feasible technology with good performance and positive TCO in the tested scenarios. The biggest benefits were related to locking down the client and thus eliminating service calls related to configuration changes, software installation and viruses. The major challenges encountered were around the high learning curve and the software maturity related to packing applications for streaming. Based on the strong positive outcome of the POC, Intel has added streaming to its IT roadmaps."
404,A honeypot system for wearable networks,"Securing any information exchanged within a Body Area Network (BAN) from unauthorized tampering is essential to ensure that such systems are safe, and thus do no harm, to the people using them. Solutions for enabling information security in BANs require extensive use of cryptographic primitives that involve considerable performance overhead. Consequently, information security is typically not available in wearable technologies. We need adaptive security solutions that increase the level of security in the event of threats but otherwise impose minimal security overhead in order for them to viable for BANs. The first step in building adaptive security for BANs is to detect the threats. In this paper we propose a solution for detecting adversaries attacking the communication channel of a BAN called a wearable honeypot system. It works by communicating fake user health information between the base station and a set of designated decoy nodes in the BAN. Any alteration of this traffic, in content or arrival time, is considered adversarial tampering. A preliminary implementation of this wearable honeypot system demonstrates that it is effective in detecting a variety of communication attacks on a BAN."
407,Resolution-based proof for multi-modal temporal logics of knowledge,Temporal logics of knowledge are useful in order to specify complex systems in which agents are both dynamic and have information about their surroundings. We present a resolution method for propositional temporal logic combined with multi-modal S5 and illustrate its use on examples. This paper corrects a previous proposal for resolution in multi-model temporal logics of knowledge.
410,Digital low-impedance bus differential protection with reduced requirements for CTs,"The paper presents a new algorithm, its implementation, and results of extensive testing, for a microprocessor-based low-impedance busbar relay. For increased security, the presented technique combines percent differential and current directional protection principles. The directional (phase comparison) principle does not require a voltage signal as it responds to relative directions of the currents. For fast operation, the outlined approach uses an adaptive trip logic that shifts between the 2-of-of-2 operating mode and the differential principle alone depending on a detection of CT saturation. The saturation detector responds to a differential-restraint current trajectory and is capable of detecting saturation occurring as fast as approximately 2 msec into a fault. The presented solution is implemented as a centralized type microprocessor-based relay with a sub-cycle tripping time and exceptional immunity to CT saturation."
418,Modbus/DNP3 state-based filtering system,"The security of SCADA systems is one of the most pressing subjects in industrial systems, especially for those installation actively using the public network in order to provide new features and services. In this paper we present an innovative approach to the design of Filtering Systems based on the state analysis of the system being monitored. The aim is to detect attacks composed of a set of “SCADA” commands that, while licit when considered in isolation on a single-packet basis, can disrupt the correct behavior of the system when executed in particular operating states. The proposed firewall detects these complex attacks thanks to an internal representation of the controlled SCADA system. Furthermore, we detail the design of the architecture of the IDS for systems using the ModBus and DNP3 protocols, and the implementation of a prototype, providing experimental comparative results that confirm the validity of the proposed approach."
435,"Adaptive SSL: Design, Implementation and Overhead Analysis","Adaptive security is based on the observation that the security requirements of a system or service heavily depend on the environment in which they operate and should therefore be dynamically adjusted to best operate within that environment as the environment changes. In this paper we are concerned with adapting the choice of cryptographic algorithms applied to client-server interactions. To that end, we design and implement an adaptation controller for SSL (Secure Socket Layer), called Adaptive SSL."
444,New architecture of Direct RF Sampling for avionic systems applied to VOR and ILS,"In the aerospace industry, there is an increased demand for a new kind of avionic architecture, in order to reduce cost, weight, number of components, certification, installation and maintenance complexity, while improving the security, compatibility and RF efficiency. The key solution to achieve this goal is to integrate multiple avionic systems, apply new signal processing and RF capabilities. A generalized and reconfigurable architecture of Multi-Mode Receiver (MMR) with integrated and modularised structure based on Direct RF Sampling (DRFS) and Software Defined Radio (SDR) is presented in this paper for avionic applications. The proposed architecture is composed of a DRFS digital receiver integrated within a SDR software modules. DRFS technology is adopted in the digital receiver, which consists of Pre-selection Filters and Field Programmable Gate Arrays (FPGA) to provide flexible compatibility for diverse modulation modes and various RF/IF frequency bands. By employing the concept of DRFS/SDR, distinct procedures for different avionic purposes, such as Very High Frequency Omnidirectional Range (VOR) and Instrument Landing System (ILS), can be achieved in the same hardware platform. Notably, this proposed architecture has the potential to be reconfigured and improved in several ways without any hardware change to accommodate new features and signal capabilities. As per experimental validation phase, an MMR integrated system for VOR and ILS receivers has been designed and implemented. Test results have illustrated that the implementation feasibility of multi-mode DRFS avionic receivers is beneficial and efficient using the proposed architecture. Moreover, the benefits obtained from this new approach are not only covering miniaturization, lightweight, and low power consumption but is also promising to overreach the equivalent commercial systems in the future."
445,Partial cuts in attack graphs for cost effective network defence,"Because of increasing vulnerabilities, maturing attack tools, and increasing dependence on computer network infrastructure, tools to support network defenders are essential. Course-of-action recommendation research has often assumed a goal of perfect network security. In reality, network administrators balance security with usability and so tolerate vulnerabilities and imperfect security. We provide realistic course-of-action decision support for network administrators by minimizing connectivity in attack graphs, by optimizing network configuration changes to separate defence goals from attackers as much as possible, even when complete security is impractical. We introduce vertex closures and closure-relation graphs in AND/OR digraphs as the underlying framework. Computing an optimal course-of-action is NP-hard but we design a polynomial-time greedy algorithm that almost always produces an optimal solution."
468,Effect of intrusion detection on secure group communications in hierarchically structured group architectures,"We develop a class of adaptive security protocols with designs to allow group communication systems (GCSs) in mobile ad hoc networks (MANETs) to dynamically adjust operational settings to best satisfy application-imposed performance and security requirements, leveraging the inherent tradeoff between security and performance properties of the system. These adaptive security protocols include an intrusion detection protocol for dealing with insider attacks and a scalable region-based hierarchical group key management protocol for dealing with outsider attacks. Our design settings include the time interval over which intrusion detection should be performed, and the regional area size for the region-based hierarchical group key management protocol for group key management. When given a set of parameter values characterizing operational and environmental conditions of a GCS, we identify optimal design settings to be used by the system dynamically to maximize the mean time to security failure of the system while minimizing the total group communication cost incurred for GCSs in MANET environments."
480,Assessment of Integrated Electronic Information System survivability based on u-function,"Considering vulnerable Integrative electronic information system (IEIS) operating under influence of external impacts and internal failures, the elements of IEIS work with different reliability and performance characteristics. In this paper we divided IEIS into basic element categories and element categories, which wok in multi-states. Basic element categories can meet its specified mission, which must be satisfied in survivability analysis. We define survivability as the performance of the basic element categories, and then get this performance using u-function to denote the survivability of IEIS, considering influence of external impacts and internal failures. The evaluation method is useful to combine the performance of the basic element categories and its survivability, and improve the survivability of the IEIS based on the basic elements in poor performance."
497,Combining Multimodal DNN and SigPid technique for detecting Malicious Android Apps,"Google announced that they are 2.7 billion active Android users in the world. There are different categories of mobile apps available, based on development nature and different categories, for example apps based on development nature are native apps, hybrid apps, web apps and apps based on different categories are gaming, business, educational, lifestyle, entertainment and utility etc. Due to its scalable growing and open source nature it is easily vulnerable to hackers or attackers to steal our information and inject malware apps into our mobile system. In recent days, a new malware app called Joker was introduced in the mobile market and infected 24 apps in the Google store, which mainly focus on extracting money and credential information from the users without their knowledge. Many scientific researches are undergoing to identify android malicious apps using machine learning classification approach. In this paper, the deep neural network algorithm is chosen to detect Android Malware by extracting features from the Android Manifest file and java API modules then fed into Deep Neural network (DNN) [10] classifier to detect whether the apps as malicious or benign app. This paper combines the Sigpid [1] (Significant Permission Identification) technique which is given as a feature in Multimodal DNN. SigPid was evaluated as a high probability of detecting malware apps using Permissions. The goal is to implement an efficient framework for detecting the Android Malware apps using Machine learning techniques which can be used in App store where all the applications are deployed in cloud and also in Mobile Antivirus app, to detect the harmfulness of the app."
504,Key security challenges for cloud-assisted connected and autonomous vehicles,"Connected and Autonomous Vehicles (CAVs) bring situational awareness to vehicles promising a safer transportation system. To support collaborative awareness, cloud-assisted CAV are being developed besides Vehicle-to-Vehicle (V2V) and Vehicle-to-Infrastructure (V2I) communications. CAVs require efficient and accurate information from numerous sources, internal and external to the vehicle, for time-critical safety applications. As such, cloud-assisted CAVs would be exposed to a large amount of dynamic information (such as speed, location, vehicle ID, travel routes, passengers' personal information, bank details and so on). Moreover, CAVs have a reasonably long lifetime due to which the associated vehicular technologies in CAVs age and it is possible that vulnerabilities can be exploited to inflict harm. As a result, when technologies change, the security requirements evolve. This research aims to discuss significant research challenges, classify emerging threats, attacks and countermeasures and identify immediate research directions to protect the evolving cloud-assisted CAVs with security mechanisms to adapt to complex and dynamic environments."
515,A Novel Model of Mimic Defense Based on Minimal L-Order Error Probability,"Mimic defense is an active defense theory, which aims to fundamentally change the “easy to attack and difficult to defend” situation of network security. In this paper, we propose an evaluation method based on the probability of being attack successfully, and improve the evaluation scheme of historical confidence. We combine the two evaluation schemes with the TOPSIS (technique for order performance by similarity to ideal solution) algorithm, and finally form a complete heterogeneous variant dynamic scheduling model. Different from traditional multi-mode voting algorithms, the effect of the heterogeneous degree in voting is considered, and we use Bayesian estimation to obtain the optimal result in the probabilistic sense. Finally, simulation results show that the proposed algorithm can effectively enhance the dynamic and security of the mimic defense model, and give full play to the characteristics of mimic defense."
544,Cyber-physical and networked sensor systems: Challenges and opportunities,"Rapid advancements in embedded systems, sensors and wireless communication technologies have led to the development of cyber-physical systems, pervasive computing and smart environments with important applications such as smart grids, sustainability, health care and security. Wireless sensor networks play significant role in building such systems as they can effectively act as the human-physical interface with the digital world through sensing, communication, computing and control or actuation. However, the inherent characteristics of wireless sensor networks, typified by resource constraints, high degree of uncertainty, heterogeneity and distributed control pose significant challenges. After introducing the basic challenges, opportunities and applications, this talk will present a novel framework for multi-modal context recognition from sensor streaming data, context-aware data fusion, and situation-aware decision making with a trade-off between information accuracy (hence inference quality) and energy consumption. The underlying approach is based on dynamic Bayesian model, information theoretic reasoning, and game theory. The talk will be concluded with open issues and future directions of research."
548,Ecological Robustness-Oriented Grid Network Design for Resilience Against Multiple Hazard,"Power systems are critical infrastructure for reliable and secure electric energy delivery. Incidents are increasing, as unexpected multiple hazards ranging from natural disasters to cyberattacks threaten the security and functionality of society. Inspired by resilient ecosystems, this paper presents a resilient network design approach with an ecological robustness (RECO)-oriented optimization to improve power systems' ability to maintain a secure operating state throughout unknown hazards. The approach uses RECO, a surprisal-based metric that captures key features of an ecosystem's resilient structure, as an objective to strategically design the electrical network. The approach enables solvability and practicality by introducing a stochastic-based candidate branch creation algorithm and a Taylor series expansion for relaxation of the RECO formulation. Finally, studies are conducted on the RECO-oriented approach using the IEEE 24 Bus RTS and the ACTIVSg200 systems. Results demonstrate improvement of the system's reliability under multiple hazards, network properties of robust structure and equally distributed power flows, and survivability against cascading failures. From the analysis, we observe that a more redundant network structure with equally distributed power flows benefits its resilience."
550,Studying Advanced Firewalls,"A Cisco Adaptive Security Appliance (ASA) is a security device that combines a firewall, an antivirus, an Intrusion Prevention System (IPS) and VPN functionalities. This chapter focuses on ASA models, modes of using ASA equipment, and an overview of ASA 5505. It discusses the types of ASA licenses, and configuring of the interfaces, DHCP service, ACLs, network address translation (NAT) service, and AAA. The chapter also discusses the configuring of Cisco devices using the Cisco Configuration Professional and Adaptive Security Device Manager (ASDM) graphic tools. There are different models of ASAs. All the models offer advanced firewall and VPN functionalities. The biggest difference between the models is the maximal flow of traffic that can be managed by each model and the number and the types of interfaces. An ASA model is chosen based on the requirements of an organization such as the flow, maximal connections per second and the company's budget."
586,Requirements and Specifications for Adaptive Security: Concepts and Analysis,"In an adaptive security-critical system, security mechanisms change according to the type of threat posed by the environment. Specifying the behavior of these systems is difficult because conditions of the environment are difficult to describe until the system has been deployed and used for a length of time. This paper defines the problem of adaptation in security-critical systems, and outlines the RELAIS approach for expressing requirements and specifying the behavior in a way that helps identify the need for adaptation, and the appropriate adaptation behavior at runtime. The paper introduces the notion of adaptation via input approximation and proposes statistical machine learning techniques for realizing it. The approach is illustrated with a running example and is applied to a realistic security example from a cloud-based file-sharing application. Bayesian classification and logistic regression methods are used to implement adaptive specifications and these methods offer different levels of adaptive security and usability in the file-sharing application."
589,Applicability of Security Metrics for Adaptive Security Management in a Universal Banking Hub System,"Banking applications require a high standard of security, resilience and adaptation. The results presented here were obtained from a case study of the deployment of the security metrics-driven adaptive security solutions of a distributed middleware in the context of monetary transfers. The focus of this study is on the analysis of the applicability of security metrics for adaptive authentication, authorization, and end-to-end confidentiality, and the applicability of trust metrics."
605,Threat Modeling for Security Assessment in Cyberphysical Systems,"In this paper, threat modeling issues in cyberphysical systems are discussed. First a generic model of a cyberphysical system is outlined, with an attack surface suitable for security analysis. Then, a case study of network communication in a road vehicle is presented, with its behavior modeled by a discrete time Markov chain, under the assumption that security violations can cause gradual degradation of functionality. Finally, two ways of numerical assessment of vulnerabilities are analyzed, to help better estimate probabilities of state changes in a Markov model."
