id,title,abstract
625,Position Paper: A Case for Exposing Extra-Architectural State in the ISA,"The recent Meltdown and Spectre attacks took the community by surprise. Rather than exploiting an incorrect implementation of the ISA, these attacks leverage the undocumented implementation-specific speculation behavior of high-performance microarchitectures to affect the extra-architectural state of the machine (e.g., caches).Inspired by these novel speculation-based attacks, we argue it is time to rethink the traditional ISA layers. Programmers and security professionals need a framework to reason about the effects of speculation and other microarchitectural performance optimizations. We propose judiciously extending the ISA to include the extra-architectural state so that an ISA implementation either completely squashes all system state changes caused by mis-speculated instructions or the potential changes are rigorously documented. We hope this new framework will give architects and security researchers tools to reduce the likelihood of future surprise vulnerabilities."
662,An Adaptive Confidentiality Security Service Enhancement Protocol Using Image-Based Key Generator for Multi-Agent Ethernet Packet Switched Networks,"Conventional network Security Protocols provide different types of security services that establish secure connections between network nodes making them robust against different security threats. The security establishment process depends on sharing security keys between connected devices. The level of security provided by such security protocols is static and irrelevant to the status of the network. In this paper, we propose an adaptive security-aware lottery-EDF scheduler for limited resources Ethernet packet switched networks using GAIA multi-agent approach. The proposed system adopts a periodic nonshared cryptographic key-generation process of different sizes (i.e., 64 bits, 128 bits, 160 bits, and 512 bits) using the textural features of digital images stored on a central imageserver. The proposed system deploys a security enhancement unit that adaptively enhances the confidentiality security-service level for the real-time packets according to feedback from a congestion control scheme that is based on network resource estimation technique, hence making the network robust against the spoofing security threat while preserving the overall network performance metrics (NPMs). By simulating a realtime Ethernet packet switched network, extensive simulation results show the efficiency of the adaptive proposed protocol over the static-security and IPSec protocols in guaranteeing the QoS requirements for the real-time flows in terms of destination’s buffer consumption and average total packet delays © 2023 by the authors. This is an open access article distributed under the Creative Commons Attribution License (CC BYNC-ND 4.0), which permits use, distribution and reproduction in any medium, provided that the article is properly cited, the use is noncommercial and no modifications or adaptations are made"
679,Optimizing distributed firewall reconfiguration transients,"The flexibility and dynamism brought over by softwarization for network management have increased the frequency of configuration changes. In this context, when a distributed security function is subject to a series of configuration changes, a problem that arises is the preservation of the security. The transient from the application of the first change to the last one may present unsecure temporary states, where the required security protection is missing. Establishing a safe scheduling of the configuration changes can significantly limit the number of unsecure states and decrease the time period where the network may be at risk. However, the literature challenged this problem only for centralized firewalls or SDN switches, and without applying formal methods to ensure the correctness of the computed scheduling. In order to overcome these limitations, this paper addresses the problem for distributed firewalls, aiming to satisfy the largest number of user-specified network security policies in each transient state. To this end, it proposes a formal methodology relying on the combination of three main features: automation, formal verification and optimization. This combination is achieved by pursuing a correctness-by-construction approach, based on the formulation of a Maximum Satisfiability Modulo Theories problem. A framework has been developed on the basis of this methodology, so that validation tests have been experimentally executed to assess the feasibility, efficacy and scalability of the approach. © 2022 Elsevier B.V."
696,Regularity-Based Virtualization under the ARINC 653 Standard for Embedded Systems,"In embedded real-time virtualized systems (ERTVS), the ARINC 653 standard specifies a cyclic scheduling policy to guarantee the real-time performance of tasks in multiple Virtual Machines (VMs) residing on shared hardware. Based on this policy, the Regularity-based Resource Partitioning (RRP) model defines an efficient interface specification to hierarchically partition and assign resource slices among VMs. Although this model has received plenty of attention recently, three major pieces remain missing for applying this model in ERTVS. (1) Embedded systems are more sensitive to resource utilization efficiency since this may drastically affect their deployment cost for including additional cores. Therefore, this paper proposes an optimal and an approximate RRP resource scheduler for multi-core platforms. (2) A resource reconfiguration is required when an embedded system has to switch between operating modes, resulting in the current cyclic schedule being replaced by another pre-configured and verified cyclic schedule. This paper formalizes a new One-Hop Reconfiguration (OHR) problem tailored for mode-switch-capable embedded systems and introduces a corresponding optimal solution. (3) No RRP-based toolset is currently available for embedded systems. This paper thus presents an optimized RRP toolset tailored for embedded systems. Numerous experiments are conducted to evaluate the efficacy of this toolset.  © 1968-2012 IEEE."
704,Multi-modal cyber security based object detection by classification using deep learning and background suppression techniques,"Foreground object recognition in video is critical in many computer vision applications and automated video surveillance systems. Object detection and tracking are critical steps in navigation, object recognition and surveillance schemes. Object detection is process of separating foreground and background items in photographs. In this paper, we proposes a framework for achieving these tasks with the enhanced cyber security control facility. This proposed algorithmperformed in 2 stages: multi-object detection utilizing the Cyber secure Probabilistic Gaussian Mixture Model (Cy_SPGMM) and background suppression and another stage is multiple moving objects tracking utilizing Kernel convoluted moving window with Kalman filter (KCMW_KF). It can, however, deal with a variety of video sequences in the MOT 20 dataset. The experimental findings reveal that the proposed algorithm detects and tracks foreground objects in complex and dynamic scenarios with high accuracy, robustness, and efficiency. This method also produces smoothened images without noise. © 2022"
705,Dynamic Security Assessment For Power System Using Attribute Selection Technique,"The evaluation of the dynamic security of the electrical power system after the occurrence of disturbances in the network is one of the most important tools that the control center uses to maintain the system in a safe operating mode, as well as prevent cases of system out of control and cases of complete shutdown. With the annual increase in the size of the electrical system and its distribution over a very wide geographical area, this led to a new challenge to assess dynamic security assessment (DSA), which is dealing with a huge and varied amount of data that requires processing in a very short time. To address these challenges, this study presented a new technique of artificial intelligence, which is the attribute selection technique, to reduce the size of this data and thus improve the accuracy and speed of results. This method relied on the combination of decision tree (DT) algorithms and a technique attribute selection in the data obtained from the test system IEEE-30Bus Model. The results of this method showed a significant reduction in the number of data used, which amounted to 77.27% of the total data, which led to an improvement in the classification accuracy, as the classification accuracy reached 97.39%. This reduction is very important when dealing in the online operating environment, as it saves the time necessary to reach the most accurate evaluation decision and thus issue gives a greater opportunity to take the appropriate decision in the event of disturbances and keep the power system in a secure case. © 2022 Institute of Advanced Engineering and Science. All rights reserved."
706,Research on a PSO-H-SVM-Based Intrusion Detection Method for Industrial Robotic Arms,"The automation and intelligence of industrial manufacturing is the core of the fourth industrial revolution, and robotic arms and proprietary networked information systems are an integral part of this vision. However, with the benefits come risks that have been overlooked, and robotic arms have become a heavily attacked area. In order to improve the security of the robotic arm system, this paper proposes an intrusion detection method based on a state classification model. The closure operation process of the robotic arm is divided into five consecutive states, while a support vector machine based on the particle swarm optimization algorithm (PSO-H-SVM) classifies the operation state of the robotic arm. In the detection process, the classifier predicts the operation state of the robotic arm in real time, and the detection method determines whether the state transfer meets the logical requirements, and then determines whether the intrusion occurs. In addition, a response mechanism is proposed on the basis of the intrusion detection system to make protection measures for the robotic arm system. Finally, a physical experiment platform was built to test the intrusion detection method. The results showed that the classification accuracy of the PSO-H-SVM algorithm reached 96.02%, and the detection accuracy of the intrusion detection method reached 90%, which verified the effectiveness and reliability of the intrusion detection method. © 2022 by the authors. Licensee MDPI, Basel, Switzerland."
710,Predicting reliability of software in industrial systems using a Petri net based approach: A case study on a safety system used in nuclear power plant,"Context: Software reliability prediction in the early stages of development can be propitious in many ways. The combinatorial models used to predict reliability using architectures such as fault trees, binary decision diagrams, etc. have limitations in modeling complex system behavior. On the other hand, state-based models such as Markov chains suffer from the state-space explosion problem, and they need transition probability among different system states to measure reliability. These probabilities are usually assumed or are obtained from the operational profile for which the system should be used in the field. Objective: The objective of this paper is to present a method for predicting the reliability of software in industrial systems using a generalized stochastic Petri nets based approach. The key idea is to violate the assumption of state transition probabilities in the Markov chain. The state transition probabilities are calculated using Petri net transitions’ throughput by performing stationary analysis under the consideration to identify and handle dead markings in the Petri net. Method: Initially, a generalized stochastic Petri net of the system under consideration is generated from the standard system's specification. Thereafter, dead markings are identified in the Petri net which are further removed to perform steady-state analysis. At last, a Markov model is generated based on the reachability graph of the Petri net, which is further used to predict the system reliability. Results: The presented method has been applied to a safety-critical system, Shut Down System-1, of a nuclear power plant, which is operational in the Canada Deuterium Uranium reactor. The predicted reliability of the system using this method is 99.99966% which has been validated using the specified system requirements. To further validate and generalize the results, sensitivity analysis is performed by varying different system parameters. Conclusions: The method discussed in this paper presents a step of performing structural analysis on the Petri net of the system under consideration to identify and handle dead markings on the Petri net. It further handles the issue of assuming transition probabilities among the system states by calculating them using Petri net transitions’ throughput. © 2022 Elsevier B.V."
757,Threat Modelling of Cyber–Physical Systems Using an Applied π-Calculus,"Cyber–Physical Systems (CPS) are distributed systems in which the state of the physical system is generally not observable in non-trivial cases, and where state transitions of this physical system can also occur without resulting in immediate changes to observable variables. This poses challenges for the bidirectional synchronisation of the discrete cyber models and the partially continuous physical systems. Threats to CPS from cyber attacks are, however, often instantiable only where conditions on the CPS state during the attack meet certain conditions such that they drive the system state outside a desirable or safe space. In this paper we propose an extension to an applied π-calculus in which we can capture both the behaviour of the CPS as well as modelling possible adversary behaviour. This is achieved by embedding an algebraic representation of Attack–Defence Trees (ADT) in the applied π-calculus and augmenting this by the addition of a partial ordering over the constituents of the ADT within the embedding, offering an elegant mechanism to extend ADT to ordering and time-related attacks. We illustrate the modelling approach for the case of an electrical substation fragment in which components communicate via the IEC 61850 protocol. © 2021 The Authors"
764,Toward securing the control plane of 5G mobile networks against DoS threats: Attack scenarios and promising solutions,"With the advent of the fifth generation (5G) technology, a plethora of revolutionary applications can now be supported. This tremendous growth will be certainly accompanied by a wider and fast-evolving security threat landscape, especially when the potential of massive devices connectivity will be fully unleashed. In this paper, we outline the security challenges faced by the 5G radio access network (5G-RAN) control plane as a result of the functional and architectural enhancements made at the radio resource control (RRC) protocol layer. We correspondingly analyze the dynamics of the new 5G RRC three-states model for a machine-type traffic pattern under an attack-free situation. Afterwards, we introduce and describe two RRC-based denial of service (DoS) attacks threatening the 5G-RAN resources availability. In the first threat scenario, the attacker maliciously manipulates the timing of state transitions in an attempt to overload the control plane. The second attack can be carried out through faking huge on-demand system information requests to prevent legitimate consumers from access to the cell and cause failed and interrupted 5G mobile services. Through numerical simulations, we measure the potential impact of these attacks on both 5G devices using the collision probability along with the access delay metrics, and on the critical gNB-centralized unit using the signaling overhead and the resource occupancy time metrics. Our observations reveal that both attacks can have disastrous effects on network stability and resiliency. Finally, some promising solutions are listed, with a special emphasis on injecting randomness into system parameters to complicate the task of designing such DoS attacks. © 2021"
775,Model for risk calculation and reliability comparison of level crossings,"There is not a single country in the world that is so rich that it can remove all level crossings or provide their denivelation in order to absolutely avoid the possibility of accidents at the intersections of railways and road traffic. In the Republic of Serbia alone, the largest number of accidents occur at passive crossings, which make up three-quarters of the total number of crossings. Therefore, it is necessary to constantly find solutions to the problem of priorities when choosing level crossings where it is necessary to raise the level of security, primarily by analyzing the risk and reliability at all level crossings. This paper presents a model that enables this. The calculation of the maximal risk of a level crossing is achieved under the conditions of generating the maximum entropy in the virtual operating mode. The basis of the model is a heterogeneous queuing system. Maximum entropy is based on the mandatory application of an exponential distribution. The system is Markovian and is solved by a standard analytical concept. The basic input parameters for the calculation of the maximal risk are the geometric characteristics of the level crossing and the intensities and structure of the flows of road and railway vehicles. The real risk is based on statistical records of accidents and flow intensities. The exact reliability of the level crossing is calculated from the ratio of real and maximal risk, which enables their further comparison in order to raise the level of safety, and that is the basic idea of this paper. © 2021 by the authors. Licensee MDPI, Basel, Switzerland."
779,Privacy-Preserving Flexible Access Control for Encrypted Data in Internet of Things,"Along with the development of edge computing and the cloud, the Internet of Things (IoT) is affecting and changing people's lives. Data sharing has played an important role in the IoT, but the leakage of private user information poses a new security threat to the users. Thus, flexible fine-grained access control for such shared data is proposed in this article as an effective and secure method of eliminating vulnerabilities. However, the disclosure of access policies will also expose users' private information. Recently, Yang et al. attempted to solve this problem and proposed a framework based on attribute-based encryption for shared data onto IEEE IoT-J(DOI: 10.1109/JIOT.2016.2571718). They hide the access policies by using a bloom filter (BF) and attempt to address privacy preservation in IoT. However, we demonstrate several security weaknesses of their framework and point out its vulnerability to dictionary attacks and access policy guessing attacks. Then, an improved IoT solution is proposed. Under this proposal, the attribute values are stored in BF while the attribute names are embedded in the access policy. The proposed scheme can resist dictionary attacks and access policy guessing attacks. In addition, it simultaneously realizes large attribute sets, an efficient decryption algorithm, and adaptive security. Security analysis and performance evaluations show that the presented scheme achieves higher security and implementation simplicity in the IoT than other currently available schemes.  © 2014 IEEE."
780,Identity-based outsider anonymous cloud data outsourcing with simultaneous individual transmission for IoT environment,"The integration of the Internet of Things (IoT) and cloud computing has become an attractive cloud-oriented big data processing paradigm, which is playing an important role in efficiency and productivity for digitalization of numerous IoT enabled industries. However, cloud-assisted IoT is also becoming an increasingly attractive target for various cyber-attacks, including the authenticity of outsourcing data, untrustworthiness of third parties, and data security and privacy. As a potential and promising solution to securely outsource data, we present the first construction for an efficient cloud data outsourcing system with simultaneous individual transmission preserving outsider anonymity of the subscribed consumer set. In our system, a data owner generates personalized data for each of the consumers in a group and transmits a common encrypted data for the group in such a way that the subscribed consumer set is completely hidden from the outsiders. Personalized data can be recovered only by an authorized consumer, while the common data can be decrypted by all the authorized consumer in that group. The communication bandwidth is compact in our construction, and the decryption algorithm requires significantly less computation cost. We design our scheme using asymmetric bilinear map over the prime order group to prevent fault attacks on symmetric bilinear map. Our construction is built in identity-based setting without any non-standard q-type security assumption and does not use random oracles. Our scheme enjoys adaptive security against an indistinguishable chosen-plaintext attack under the hardness of the standard decisional bilinear Diffie–Hellman exponent problem. Furthermore, our design supports an exponential number of consumers as the size of the valid identity set grows exponentially with the security parameter, whereas it is only polynomial in the security parameter for the existing cloud data outsourcing systems. In particular, the implementation and performance analysis explicates the advantages of our design for resource-constrained IoT enabled frameworks. © 2021 Elsevier Ltd"
787,A data-driven approach to anomaly detection and vulnerability dynamic analysis for large-scale integrated energy systems,"In an integrated energy system (IES), the operating state of each energy subsystem changes relatively frequently, which can seriously threaten the security of IES operation. A systematic data-driven approach is proposed for detecting anomalies and analyzing the dynamics of IES vulnerability. Firstly, an anomaly detection method is introduced to determine whether there are anomalies in the system operation. The method can be set up even if the data labels for discriminating the anomalies are unknown, often the cause in practice. Secondly, a method of complex network phase theory is proposed to model information propagation among IES nodes representative of the IES physical entities. Complex network models can then be constructed to describe the system behavior in different operating conditions and over different time horizons. The degree centrality, betweenness centrality, and closeness centrality are used as indications to analyze changes in IES vulnerability. Finally, a method is proposed to identify the critical points of the IES from the point of view of its vulnerability. The new approach is applied to analyze the vulnerability of an IES in Spain. The results show that the proposed methods allow revealing system anomalies, vulnerability and weaknesses. Outcomes from an analysis by these methods can be used by managers to take defensive measures in advance for preventing and mitigating the impact of potential factors and threats on the IES. © 2021 Elsevier Ltd"
809,A Hierarchical Modeling Approach for Evaluating Availability of Dynamic Networks Considering Hardening Options,"Modern networks are dynamic with configuration changes that introduces a set of challenge to the network administrator in terms of security and availability. Here, the major challenge faced by the administrator is the increasing number of vulnerabilities with the uncertainties related to defense deployment options and how these options affect the network availability over time. This work proposes a hierarchical model-based approach to evaluate the availability of dynamic networks considering the deployment of different hardening options. In particular, this work adopts reliability block diagrams and Petri nets to represent and analyze dynamic network environments and evaluate their availability. A case study is presented to demonstrate the feasibility, usefulness, and scalability of the proposed approach for computing the availability of dynamic networks considering different hardening options. The proposed approach can be helpful for network administrators who are in charge of choosing the best hardening options taking into account the impacts on availability.  © 2021 IEEE."
